810	958604	GENERAL MOTORS CORP.	PONTIAC	GRAND PRIX	1989			N	0	0	WHEELS	MARIETTA    	GA	1G2WJ14W5KF	19950112	19950112			BOOMERSHINE DEALER IN SMYRNA GA.,  OWNER HASN'T BEEN RECONTACTED SINCE JULY 94. DEALER/MANUFACTURER STATES PARTS ON BACK ORDER. PLEASE DESCRIBE DETAILS.  TT	EVOQ																									V	
811	958602	GENERAL MOTORS CORP.	CHEVROLET	LUMINA	1991		19950105	N	0	0	SERVICE BRAKES, HYDRAULIC:FOUNDATION COMPONENTS:DISC	SOUTH BURLIN	VT	2G1WN54T2M9	19950112	19950112			REAR DISC BRAKES CORRODED/RUSTED INSIDE BRAKE CALIPER; CAUSED BRAKES TO FREEZE LEAVING ONLY FRONT BRAKES OPERATIVE; EXTENDED STOPPING.  TT	EVOQ																									V	
812	479017	MITSUBISHI MOTORS NORTH AMERICA, INC.	MITSUBISHI	MIRAGE	1985	Y	19941128	Y	0	3	FUEL SYSTEM, GASOLINE:STORAGE:TANK ASSEMBLY	HATO REY    	00	UNK	19950112	19941128		1	FUEL TANK EXPLODED DURING ACCIDENT IMPACT, CAUSING DEATHS OF PASSENGERS (ATTORNEY FOR CLIENT).  *SKD	VOQ																									V	
813	469414	GENERAL MOTORS CORP.	GMC	GMC	9999	Y	19890603	Y	0	1	FUEL SYSTEM, GASOLINE:STORAGE:TANK ASSEMBLY	ARLINGTON   	TX	UNK	19950112	19941111		1	GAS TANK EXPLODED/CAUGHT FIRE DURING ACCIDENT, RESULTING IN DEATH.  *SKD	VOQ																									V	
814	479000	GENERAL MOTORS CORP.	CHEVROLET	CHEVROLET TRUCK	1973	Y	19931106	Y	1	0	FUEL SYSTEM, GASOLINE:STORAGE:TANK ASSEMBLY	WATERLOO    	00	UNK	19950112	19941111		1	FUEL TANK MOUNTED OUTSIDE FRAME EXPLODED DURING ACCIDENT, RESULTING IN INJURIES.  (ATTORNEY FOR CLIENT)  *SKD	VOQ																									V	
815	476317	GENERAL MOTORS CORP.	PONTIAC	FIREBIRD	1985		19941121	N	0	0	SEAT BELTS:FRONT:BUCKLE ASSEMBLY	PHOENIX     	AZ	1G2FS87SXFL	19950112	19941121		1	RECALL REPAIRS REFUSED DUE UNAVAILABILITY OF SEAT BELT BUCKLES (90V-105).  *SKD	VOQ																									V	
816	476824	FORD MOTOR COMPANY	FORD	TAURUS	1991		19941126	N	0	0	SUSPENSION:FRONT:MACPHERSON STRUT	POTOMAC     	MD	1FACP50U4MA	19950112	19941126		1	STRUT PLATES INSTALLED TO CORRECT A GRINDING NOISE COMING FROM FRONT SUSPENSION.  *SKD	VOQ																									V	
817	471329	GENERAL MOTORS CORP.	CADILLAC	DEVILLE	1987		19940621	N	0	0	VEHICLE SPEED CONTROL	OAKLAND     	CA	1G6CD5183H4	19950112	19940621		1	CRUISE CONTROL FAILURE.	VOQ																									V	
818	471329	GENERAL MOTORS CORP.	CADILLAC	DEVILLE	1987		19940621	N	0	0	EXTERIOR LIGHTING:BRAKE LIGHTS	OAKLAND     	CA	1G6CD5183H4	19950112	19940621		1	BRAKE LAMP STAYED ON.	VOQ																									V	
819	471329	GENERAL MOTORS CORP.	CADILLAC	DEVILLE	1987		19940123	Y	0	0	ENGINE AND ENGINE COOLING:ENGINE:GASOLINE	OAKLAND     	CA	1G6CD5183H4	19950112	19940621		1	ENGINE EXPLODED.   *AW	VOQ																									V	
820	958636	FORD MOTOR COMPANY	MERCURY	SABLE	1989		19940404	N	0	0	POWER TRAIN:MANUAL TRANSMISSION	TALSA       	OH		19950112	19950112			TRANSMISSION HAD TO BE REPLACED 71,000 MILES.  TT	EVOQ																									V	
821	958627	GENERAL MOTORS CORP.	PONTIAC	SUNBIRD	1990		19950102	N	0	0	STEERING:WHEEL AND HANDLE BAR	FT WORTH    	TX	1G2JB34K7L7	19950112	19950112			STEERING ARM BRACKET ATTACHED TO THE FIRE WALL CAME LOOSE, RESULTING IN STIFF STEERING.  TT	EVOQ																									V	
822	476750	FORD MOTOR COMPANY	FORD	F SERIES (LIGHT)	1988		19941129	N	0	0	ENGINE AND ENGINE COOLING:ENGINE	LAKE ORION  	MI	2FTDF15N2JC	19950112	19941129		1	RUSTED OIL PAN LEAKS OIL.   *AW	VOQ																									V	
823	476812	FORD MOTOR COMPANY	MERCURY	SABLE	1991		19940901	N	0	0	POWER TRAIN:AUTOMATIC TRANSMISSION	SAINT PAUL  	MN	1MECM55U7MG	19950112	19941130		1	TRANSMISSION FAILURE.   *AW	VOQ																									V	
824	471580	GENERAL MOTORS CORP.	CADILLAC	CIMARRON	1987	Y	19930921	N	1	0	VEHICLE SPEED CONTROL	BEVERLY HL  	CA	1G6JG51WXHJ	19950112	19940601		4	VEHICLE SUDDENLY ACCELERATED FROM PARKED POSITION, RESULTING IN AN ACCIDENT/INJURY.   *AW	VOQ																									V	
825	478897	DAIMLERCHRYSLER CORPORATION	DODGE	D SERIES(LIGHT)	1989		19941001	N	0	0	VEHICLE SPEED CONTROL	CYPRESS     	CA	1B7FE16Y1KS	19950112	19941213		1	DEFECTIVE THROTTLE BODY CAUSES ENGINE TO STALL.   *AW	VOQ																									V	
826	958640	GENERAL MOTORS CORP.	CHEVROLET	S10	1994		19950111	N	0	0	POWER TRAIN:AUTOMATIC TRANSMISSION	HOBOKEN     	NJ	1GNDT13W4R2	19950112	19950112		1	WHEN FIRST STARTING VEHICLE AND MOTOR IS COLD, TRANSMISSION STICKS IN LOW GEAR.  *AK	EVOQ																									V	
827	958631	NISSAN NORTH AMERICA, INC.	NISSAN	SENTRA	1987		19941221	N	0	0	POWER TRAIN:AXLE ASSEMBLY	ARLINGTON   	TX		19950112	19950112			LOST CONTROL FACING TRAFFIC DRIVE AXLE CAME APART.  TT	EVOQ																									V	
828	477857	TOYOTA MOTOR NORTH AMERICA, INC.	LEXUS	LEXUS	1994		19940401	N	0	0	OTHER	SAN DIEGO   	CA	JT8GK13T3R0	19950112	19941114		1	PROBLEMS WITH LEATHER SEAT CUSHIONS.  *AK	VOQ																									V	
829	479145	MERCEDES-BENZ USA, LLC.	MERCEDES BENZ	240	1994		19940214	N	0	0	STRUCTURE:BODY:HOOD:HINGE AND ATTACHMENTS	LOS ANGELE  	CA	WDBHA22E4RF	19950112	19941119		1	HOOD RELEASE CABLE FAILED.  *AK	VOQ																									V	
830	474963	DAIMLERCHRYSLER CORPORATION	DODGE	RAM	1994		19940930	N	0	0	ENGINE AND ENGINE COOLING:ENGINE:GASOLINE	BAKERSFIEL  	CA	1B6MC36W1RS	19950112	19941011		1	ENGINE KNOCKS DUE TO OIL SENDING UNIT/PUMP FAILURE.  *AW	VOQ																									V	
831	958641	GENERAL MOTORS CORP.	OLDSMOBILE	CUSTOM CRUISER	1991	Y	19950111	N	0	0	VEHICLE SPEED CONTROL	NAPLES      	FL	1G3BP83E5MW	19950112	19950112		2	AUTO-TRAN: ENGINE ACCELERATED WHILE PARKED AND SHIFTING FROM 1ST TO PARK; LURCHED FORWARD; HIT 2 PARKED VEHICLES; 2ND OCCURENCE. HIT GARAGE WALL, 1ST OCCURENCE.	EVOQ																									V	
832	471599	VOLVO CARS OF N.A.  LLC.	VOLVO	740	1987	Y	19940610	N	0	0	VEHICLE SPEED CONTROL	MIDLAND     	MI	YV1FX88A3H2	19950112	19940706		1	UPON SHIFTING INTO REVERSE GEAR, VEHICLE SUDDENLY ACCELERATED BACKWARDS, RESULTING IN AN ACCIDENT.  *AW	VOQ																									V	
833	479254	GENERAL MOTORS CORP.	GEO	PRIZM	1994		19941126	N	0	0	EQUIPMENT:ELECTRICAL:AIR CONDITIONER	LONG BEACH  	CA	1Y1SK5368RZ	19950112	19941126		1	AIR CONDITIONER FAILED.  *SKD	VOQ																									V	
834	958635	ISUZU MANUFACTURING SERVICES OF AMERICA 	ISUZU	AMIGO	1994		19940520	N	0	0	SERVICE BRAKES, HYDRAULIC:ANTILOCK	YOUNGSTOWN  	OH	JACCG07E9R9	19950112	19950112			ABS SYSTEM IS FAILING.  TT	EVOQ																									V	
835	958633	GENERAL MOTORS CORP.	SATURN	SL	1994		19941201	N	0	0	POWER TRAIN:AUTOMATIC TRANSMISSION	FAIRBORN    	OH	1G8ZG5595RZ	19950112	19950112			VEHICLE WILL STALL AT SPEED OF 50 MPH WHEN CHANGING GEARS AND LOSS OF POWER HEARD A NOISE.  TT	EVOQ																									V	
836	958634	GENERAL MOTORS CORP.	CHEVROLET	K15	1995	Y	19950112	N	1	0	AIR BAGS:FRONTAL	HUTINGDON   	TN	1GCEK19K7SF	19950112	19950112			AIRBAG DID NOT DEPLOY ON 12:00 POSITION AT 50 MPH.  TT	EVOQ																									V	
837	958638	GENERAL MOTORS CORP.	CADILLAC	DEVILLE	1993	Y	19931124	N	1	0	AIR BAGS:FRONTAL	LAKE CITY   	FL	106CD53B5P4	19950112	19950112			UPON TWO DIFFERENT ACCIDENTS, DRIVERS AIRBAG DID NOT DEPLOY, DEALER SAID NOTHING WAS WRONG DURING 1ST ACCIDENT, HAVE NOT CHECK FOR SECOND ACCIDENT.  TT	EVOQ																									V	
838	477997	GENERAL MOTORS CORP.	OLDSMOBILE	CUTLASS	1994		19940823	N	0	0	EXTERIOR LIGHTING:TURN SIGNAL:SWITCH	SALTON CIT  	CA	1G3AG5542R6	19950112	19941112		2	TURN SIGNAL SWITCH FAILED.  *AK	VOQ																									V	
839	478848	GENERAL MOTORS CORP.	CHEVROLET	CAPRICE	1991		19930501	N	0	0	VEHICLE SPEED CONTROL	DREXEL      	PA	1G1BL83E7MW	19950112	19941215		2	CRUISE CONTROL MALFUNCTIONED TWICE, CAUSING TWO ACCIDENTS DUE TO UNEXPECTED ACCELERATION.   *AW	VOQ																									V	
840	958606	GENERAL MOTORS CORP.	CHEVROLET	CORVETTE	1992		19941216	Y	0	0	SEATS:FRONT ASSEMBLY:POWER ADJUST	GATE HARBOR 	WA	1G1YY33P0N5	19950112	19950112			POWER SEATS.  WIRING IN THE SEAT CAUGHT ON FIRE.  TT	EVOQ																									V	
841	958618	GENERAL MOTORS CORP.	CHEVROLET	ASTRO	1991			N	0	0	STRUCTURE:BODY:DOOR 	REDWING     	MN		19950112	19950112			SLIDING DOOR WON'T SHUT, DEALER REPLACED LOCK, AND NOW SAYS DOOR NEEDS TO BE REPLACED.  TT	EVOQ																									V	
842	958622	DAIMLERCHRYSLER CORPORATION	DODGE	CARAVAN	1991		19941208	N	0	0	SERVICE BRAKES, HYDRAULIC:SWITCHES:BRAKE WARNING	EDMONDS     	WA	2B4GD55R8MR	19950112	19950112		1	ABS SYSTEM LIGHT CAME ON, DEALER SAID VEHICLE NEEDED HYDRAULIC UNIT AND IF REPAIRS NOT DONE ABS SYSTEM WILL FAIL WITHOUT ANY WARNING.  TT	EVOQ																									V	
843	958613	FLEETWOOD ENTERPRISES, INC.	FLEETWOOD	JAMBOREE RALLYE	1990		19941012	N	0	0	SERVICE BRAKES, HYDRAULIC:FOUNDATION COMPONENTS	YUBA CITY   	CA	1FDKE30GXLH	19950112	19950112		2	BRAKES HAVE FAILED ON TWO SEPARATE OCCASIONS, MFG WAS NOTIFIED BUT NEVER REPPLIED.  TT	EVOQ																									V	
844	958611	FORD MOTOR COMPANY	MERCURY	SABLE	1990		19950111	N	0	0	EQUIPMENT:ELECTRICAL:AIR CONDITIONER	ST LOUIS    	MO	1MECM50U3LG	19950112	19950112		1	A/C COMPRESSOER LOCKED AT 39,000 MILES.  TT	EVOQ																									V	
845	958630	NISSAN NORTH AMERICA, INC.	INFINITI	Q45	1991	Y	19950109	N	0	0	SERVICE BRAKES, HYDRAULIC:ANTILOCK	DALLAS      	TX	JNKNG01C2MM	19950112	19950112		1	BRAKE PEDAL WENT TO THE FLOOR  DUE TO FAULTY ANTI LOCK BRAKING SYSTEM.  TT	EVOQ																									V	
846	958620	GENERAL MOTORS CORP.	GEO	METRO	1994	Y	19941123	N	3	0	LATCHES/LOCKS/LINKAGES:DOORS:LATCH	DIAMOND SPRI	CA	2C1MR2463R6	19950112	19950112		1	BOTH FRONT DOOR LATCHES LOCKED UP/JAMMED; DOORS WOULD NOT OPEN; EXCESSIVE EFFORT.   TT	EVOQ																									V	
847	958620	GENERAL MOTORS CORP.	GEO	METRO	1994	Y	19941123	Y	3	0	FUEL SYSTEM, GASOLINE:STORAGE:TANK ASSEMBLY	DIAMOND SPRI	CA	2C1MR2463R6	19950112	19950112		1	VEHICLE RAN OVER OBJECT IN ROAD; REAR GAS TANK ERUPTED; VEHICLE CAUGHT ON FIRE.   TT	EVOQ																									V	
848	476771	FORD MOTOR COMPANY	FORD	TEMPO	1988		19911001	N	0	0	ELECTRICAL SYSTEM:BATTERY	ANDERSON    	IN	1FAPP36X1JK	19950112	19941126		1	BATTERY FAILED.	VOQ																									V	
849	476771	FORD MOTOR COMPANY	FORD	TEMPO	1988		19940401	N	0	0	VEHICLE SPEED CONTROL	ANDERSON    	IN	1FAPP36X1JK	19950112	19941126		2	THROTTLE POSITION SENSOR/POTENTIONMETER FAILED TWICE, CAUSING ENGINE LIGHT TO COME ON/ENGINE SURGING/STALLING.  *SKD	VOQ																									V	
850	477945	DAIMLERCHRYSLER CORPORATION	DODGE	RAM	1994		19940908	N	0	0	POWER TRAIN:AUTOMATIC TRANSMISSION:COOLING UNIT AND LINES	MT LAGUNA   	CA	1B7KF26CXRS	19950112	19950110		1	TRANSMISSION COOLING LINE FAILED, CAUSING LEAK.  *SKD	VOQ																									V	
851	958611	FORD MOTOR COMPANY	MERCURY	SABLE	1990		19950111	N	0	0	VISIBILITY:WINDSHIELD	ST LOUIS    	MO	1MECM50U3LG	19950112	19950112		1	FRONT WINDSHIELD FOGS UP, CANNOT TURN DEFROSTER ON BECAUSE IT COMES FROM AIR CONDITIONER.  *AK	EVOQ																									V	
852	477888	MITSUBISHI MOTORS NORTH AMERICA, INC.	MITSUBISHI	GALANT	1994		19940401	N	0	0	VISIBILITY:POWER WINDOW DEVICES AND CONTROLS	N HOLLYWOO  	CA	4A3AJ56G7RE	19950112	19941109		2	RIGHT FRONT/LEFT REAR POWER WINDOWS FAILED.  *AK	VOQ																									V	
853	477889	DAIMLERCHRYSLER CORPORATION	PLYMOUTH	VOYAGER	1994		19941102	N	0	0	STRUCTURE:BODY	BUENA PARK  	CA	2P4GH2531RR	19950112	19941102		1	PROBLEM WITH INSIDE MOULDING.  *AK	VOQ																									V	
854	958605	MAZDA NORTH AMERICAN OPERATIONS	MAZDA	929	1990	Y	19940101	N	1	0	SEAT BELTS	OAKRIDGE    	TN		19950112	19950112			VEHICLE WAS A STOP IMPACT 6:00 POSITION SHOULDER BELT DID NOT RETRACT CAUSING INJURIES.  TT	EVOQ																									V	
855	477933	TOYOTA MOTOR NORTH AMERICA, INC.	TOYOTA	PICKUP	1994		19940301	N	0	0	STEERING:GEAR BOX (OTHER THAN RACK AND PINION)	LA CRESCEN  	CA	JT4VN93D4R5	19950112	19941112		1	STEERING GEAR BOX LEAKED.  *AK	VOQ																									V	
856	477789	DAIMLERCHRYSLER CORPORATION	PLYMOUTH	ACCLAIM	1994		19941129	N	0	0	TIRES	HAWTHORNE   	CA	1P3AA4634RF	19950112	19941129		1	LEFT/RIGHT FRONT MICHELIN TIRES CONTINUOUSLY LOSING AIR.  *SKD	VOQ																									V	
857	477776	DAIMLERCHRYSLER CORPORATION	JEEP	GRAND CHEROKEE	1994		19940401	N	0	0	SUSPENSION:REAR	VENICE      	CA	1J4GZ78Y8RC	19950112	19941109		1	FRONT SWAY BAR BUSHINGS/COIL SPRING SLEEVES FAILED, CAUSING NOISE WHEN GOING OVER BUMPS/DIPS.  *SKD	VOQ																									V	
858	477972	DAIMLERCHRYSLER CORPORATION	JEEP	GRAND CHEROKEE	1994		19940801	N	0	0	POWER TRAIN:AUTOMATIC TRANSMISSION:GEAR POSITION INDICATION (PRNDL)	YORBA LIND  	CA	1J4GZ78Y2RC	19950112	19941114		1	TRANSMISSION SHIFT LEVER LOOSE, RESULTING IN SHIFTING PROBLEMS.  *AK	VOQ																									V	
859	477959	GENERAL MOTORS CORP.	GMC	SUBURBAN	1994		19941110	N	0	0	POWER TRAIN:DRIVELINE:DIFFERENTIAL UNIT	SAN PEDRO   	CA	1GKEC16K7RJ	19950112	19941110		1	DIFFERENTIAL FAILURE.  *AK	VOQ																									V	
860	477986	GENERAL MOTORS CORP.	CHEVROLET	S10	1994		19940708	N	0	0	ELECTRICAL SYSTEM:WIRING	AVILA BEAC  	CA	1GNDT13W7R2	19950112	19941112		1	FUEL PUMP FAILED DUE TO LOOSE CONNECTION.   *AK	VOQ																									V	
861	477652	HONDA (AMERICAN HONDA MOTOR CO.)	HONDA	CIVIC	1994		19940707	N	0	0	FUEL SYSTEM, GASOLINE:STORAGE:TANK ASSEMBLY	LA MIRADA   	CA	2HGEJ1230RH	19950112	19941115		1	PROBLEM WITH GAS TANK DOOR.  *AK	VOQ																									V	
862	477988	GENERAL MOTORS CORP.	GMC	SAFARI	1994		19940701	N	0	0	ELECTRICAL SYSTEM:ALTERNATOR/GENERATOR/REGULATOR	LOS ALAMOS  	CA	1GKDM15Z3RB	19950112	19941113		1	ALTERNATOR FAILURE.  *AK	VOQ																									V	
863	471225	GENERAL MOTORS CORP.	GMC	JIMMY	1993	Y	19940620	N	0	0	VEHICLE SPEED CONTROL	CUMBERLAND  	RI	1GKCT18WXP0	19950112	19940630		1	UPON SHIFTING INTO DRIVE GEAR, VEHICLE SUDDENLY ACCELERATED, RESULTING IN AN ACCIDENT.  *AW	VOQ																									V	
864	478038	NISSAN NORTH AMERICA, INC.	NISSAN	SENTRA	1992		19940801	N	0	0	SERVICE BRAKES, HYDRAULIC:FOUNDATION COMPONENTS	COALINGA    	CA	JN1EB31P2NU	19950112	19941210		1	BRAKE FAILURE.	VOQ																									V	
865	478038	NISSAN NORTH AMERICA, INC.	NISSAN	SENTRA	1992		19940801	N	0	0	POWER TRAIN:AXLE ASSEMBLY	COALINGA    	CA	JN1EB31P2NU	19950112	19941210		1	REAR AXLE SPLINE FELL OUT.  *AW	VOQ																									V	
866	477997	GENERAL MOTORS CORP.	OLDSMOBILE	CUTLASS	1994		19940929	N	0	0	ELECTRICAL SYSTEM:WIRING:INTERIOR/UNDER DASH	SALTON CIT  	CA	1G3AG5542R6	19950112	19941112		3	INSTRUMENT PANEL CLUSTER MODULE FAILED.  *AK	VOQ																									V	
867	476220	DAIMLERCHRYSLER CORPORATION	DODGE	RAM	1992		19941109	N	0	0	SERVICE BRAKES, HYDRAULIC:FOUNDATION COMPONENTS	SACRAMENTO  	CA	3B7KM23CXNM	19950112	19941109		7	BRAKES FAIL INTERMITTENTLY.  *SKD	VOQ																									V	
868	468576	DAIMLERCHRYSLER CORPORATION	CHRYSLER	NEW YORKER	1990		19941208	N	0	0	POWER TRAIN:DRIVELINE:DRIVESHAFT	HUNTINGTON  	NY	UNK	19950112	19941208		1	TRANSAXLE FAILURE.  (OTHER VEHICLE ON 478926).  *SKD	VOQ																									V	
869	468575	GENERAL MOTORS CORP.	GMC	SCHOOL BUS SERIES	1989		19940523	N	0	0	OTHER	SALEM       	VA	UNK	19950112	19941024		1	POWER STEERING BOX SPOOL GEAR BROKE TOOTH OFF, CAUSING VEHICLE TO STEER TO ONE SIDE. (OTHER VEHICLES 468574/474850) *SKD	VOQ																									V	
870	477998	GENERAL MOTORS CORP.	OLDSMOBILE	CUTLASS	1994		19940721	N	0	0	POWER TRAIN:AUTOMATIC TRANSMISSION	BAKERSFIEL  	CA	1G3WH15M1RD	19950112	19941115		1	TRANSMISSION DRIVE SPROCKET SUPPORT BEARING FAILURE.	VOQ																									V	
871	477998	GENERAL MOTORS CORP.	OLDSMOBILE	CUTLASS	1994		19940721	N	0	0	ENGINE AND ENGINE COOLING:ENGINE	BAKERSFIEL  	CA	1G3WH15M1RD	19950112	19941115		1	ENGINE VALVE BODY FAILURE.	VOQ																									V	
872	479143	HONDA (AMERICAN HONDA MOTOR CO.)	HONDA	CIVIC	1994		19940401	N	0	0	VISIBILITY:POWER WINDOW DEVICES AND CONTROLS	RIVERSIDE   	CA	1HGEG8656RL	19950112	19941116		1	AUTOMATIC WINDOW REGULATOR FAILED.   *AK	VOQ																									V	
873	479156	DAIMLERCHRYSLER CORPORATION	PLYMOUTH	VOYAGER	1994		19941115	N	0	0	EQUIPMENT:ELECTRICAL:AIR CONDITIONER	LONG BEACH  	CA	2P4GH2434RR	19950112	19941115		1	AIR CONDITIONER FAILED.  *AK	VOQ																									V	
874	479131	HONDA (AMERICAN HONDA MOTOR CO.)	HONDA	CIVIC	1994		19941117	N	0	0	POWER TRAIN:MANUAL TRANSMISSION:FLOOR SHIFT ASSEMBLY	EL CAJON    	CA	2HGEH2354RH	19950112	19941117		1	TRANSMISSION SHIFTS ONLY INTO REVERSE GEAR, ALSO NOISY.  *AK	VOQ																									V	
875	479146	JAGUAR CARS LTD	JAGUAR	XJS	1994		19941103	N	0	0	LATCHES/LOCKS/LINKAGES:TRUNK LID:LOCK	BEVERLY HL  	CA	SAJNX2348RC	19950112	19941103		1	TRUNK FAILS TO LOCK.  *AK	VOQ																									V	
876	479135	TOYOTA MOTOR NORTH AMERICA, INC.	TOYOTA	PICKUP	1994		19940801	N	0	0	VISIBILITY:WINDSHIELD	LOMPOC      	CA	JT4RN81A1R5	19950112	19941119		3	WINDOW RATTLES INSIDE OF DOOR.  *AK	VOQ																									V	
877	479136	COACHMEN INDUSTRIES, INC.	COACHMEN	COACHMEN	1994		19940801	N	0	0	ELECTRICAL SYSTEM:STARTER ASSEMBLY:SOLENOID	HUNTINGTON  	CA	1FDGS24H5RH	19950112	19941119		1	STARTER SOLONOID FAILED.  *AK	VOQ																									V	
878	475064	NISSAN NORTH AMERICA, INC.	NISSAN	VAN	1987		19930501	N	0	0	STEERING:HYDRAULIC POWER ASSIST SYSTEM	SOUTHAVEN   	MS	JN8SC26S3H4	19950112	19940927		1	POWER STEERING HUB ASSEMBLY DISINTEGRATED.  *AW	VOQ																									V	
879	477998	GENERAL MOTORS CORP.	OLDSMOBILE	CUTLASS	1994		19940721	N	0	0	ENGINE AND ENGINE COOLING:ENGINE:GASOLINE:BELTS AND ASSOCIATED PULLEYS	BAKERSFIEL  	CA	1G3WH15M1RD	19950112	19941115		1	SERPENTINE BELT/TENSIONER BELT FAILED.	VOQ																									V	
880	958624	GENERAL MOTORS CORP.	CHEVROLET	C10	1993		19950112	N	1	0	VISIBILITY:REARVIEW MIRRORS/DEVICES:EXTERIOR	HOUSTON     	TX	1GCDC14Z6PZ	19950112	19950112		1	AT 50 MPH GLASS FROM MIRROR ON THE DRIVERS SIDE FLEW OFF.  TT	EVOQ																									V	
881	471609	FORD MOTOR COMPANY	MERCURY	GRAND MARQUIS	1987		19940709	N	0	0	VEHICLE SPEED CONTROL	MAPLEWOOD   	NJ	2ME8M75F7HX	19950112	19940709		1	INCREASED ACCELERATION/ENGINE SURGES.   *AW	VOQ																									V	
882	471329	GENERAL MOTORS CORP.	CADILLAC	DEVILLE	1987		19940621	N	0	0	EQUIPMENT:ELECTRICAL:AIR CONDITIONER	OAKLAND     	CA	1G6CD5183H4	19950112	19940621		1	A/C FAILURE.	VOQ																									V	
883	471329	GENERAL MOTORS CORP.	CADILLAC	DEVILLE	1987		19940621	N	0	0	ELECTRICAL SYSTEM:BATTERY	OAKLAND     	CA	1G6CD5183H4	19950112	19940621		1	BATTERY/ALTERNATOR FAILURE.	VOQ																									V	
884	471556	FORD MOTOR COMPANY	MERCURY	TRACER	1988		19940615	N	0	0	VEHICLE SPEED CONTROL	GLEN BURNI  	MD	3MABM1257JR	19950112	19940711		1	SUDDEN REVERSE ACCELERATION, CAUSING LOSS OF CONTROL.  *AW	VOQ																									V	
885	475071	GENERAL MOTORS CORP.	PONTIAC	FIREBIRD	1984		19941005	N	0	0	STEERING:LINKAGES:TIE ROD ASSEMBLY	EDGEWOOD    	NM	1G2A58718EL	19950112	19941005		2	INNER/OUTER TIE RODS BROKE, CAUSING LOSS OF STEERING.   *AW	VOQ																									V	
886	475071	GENERAL MOTORS CORP.	PONTIAC	FIREBIRD	1984		19941005	N	0	0	SEAT BELTS:FRONT:RETRACTOR	EDGEWOOD    	NM	1G2A58718EL	19950112	19941005		1	SHOULDER HARNESS FAILS TO RETRACT/LOCK.	VOQ																									V	
887	475071	GENERAL MOTORS CORP.	PONTIAC	FIREBIRD	1984		19941005	N	1	0	SEATS	EDGEWOOD    	NM	1G2A58718EL	19950112	19941005		1	BROKEN SEATS, ALSO METAL WIRE COMES THROUGH SEAT, CAUSING INJURY.	VOQ																									V	
888	476074	DAIMLERCHRYSLER CORPORATION	JEEP	GRAND CHEROKEE	1994		19940201	N	0	0	SERVICE BRAKES, HYDRAULIC:FOUNDATION COMPONENTS	GRASS VALL  	CA	1J4GZ58S3RC	19950112	19941109		1	VEHICLE PULLS TO RIGHT WHEN BRAKES APPLIED.   *AW	VOQ																									V	
889	477996	GENERAL MOTORS CORP.	GMC	JIMMY	1994		19941115	N	0	0	VISIBILITY:POWER WINDOW DEVICES AND CONTROLS	TEMPLE CIT  	CA	1GKCS13WXR2	19950112	19941115		1	POWER WINDOW MOTOR FAILED.   8AK	VOQ																									V	
890	477960	GENERAL MOTORS CORP.	GMC	C SERIES(LIGHT)	1994		19941101	N	0	0	VISIBILITY:WINDSHIELD	NORWALK     	CA	2GTFC29K3R1	19950112	19941114		1	CAB WINDOW LEAKS.	VOQ																									V	
891	477882	GENERAL MOTORS CORP.	CHEVROLET	SUBURBAN	1994		19950109	N	0	0	POWER TRAIN:AUTOMATIC TRANSMISSION	GARDEN GRO  	CA	1GNGC26N2RJ	19950112	19950109		1	TRANSMISSION FAILS TO SHIFT.	VOQ																									V	
892	477882	GENERAL MOTORS CORP.	CHEVROLET	SUBURBAN	1994		19950109	N	0	0	SEAT BELTS:FRONT:ANCHORAGE	GARDEN GRO  	CA	1GNGC26N2RJ	19950112	19950109		1	SEAT BELT FAILURE. *AK	VOQ																									V	
893	477916	DAIMLERCHRYSLER CORPORATION	DODGE	CARAVAN	1994		19940701	N	0	0	SERVICE BRAKES, HYDRAULIC:ANTILOCK	ORANGE      	CA	1B4GH54L3RX	19950112	19941114		1	ANTI-LOCK BRAKE FAILURE.   *AK	VOQ																									V	
894	479267	MERCEDES-BENZ USA, LLC.	MERCEDES BENZ	300	1994		19940625	N	0	0	SEAT BELTS:FRONT:ANCHORAGE	PALM SPRIN  	CA	WDBGA32E8RA	19950112	19941108		1	DRIVER'S SEAT BELT FAILED.  *AK	VOQ																									V	
895	477454	FORD MOTOR COMPANY	FORD	ECONOLINE	1994		19950110	N	0	0	STEERING:HYDRAULIC POWER ASSIST SYSTEM	ALHAMBRA    	CA	1FDKE30GXRH	19950112	19950110		1	POWER STEERING FAILURE.	VOQ																									V	
896	477823	DAIMLERCHRYSLER CORPORATION	JEEP	WRANGLER	1994		19941128	N	0	0	POWER TRAIN:AUTOMATIC TRANSMISSION:COOLING UNIT AND LINES	WOODLAND    	CA	1J4FY19P6RP	19950112	19941128		1	TRANSMISSION HOSE LEAKS. *AK	VOQ																									V	
897	479281	GENERAL MOTORS CORP.	CHEVROLET	C SERIES(LIGHT)	1994		19941101	N	0	0	SEAT BELTS:FRONT:ANCHORAGE	BAKERSFIEL  	CA	1GBEC19H1RE	19950112	19941130		1	SEAT BELT FAILURE.  *AK	VOQ																									V	
898	477746	TOYOTA MOTOR NORTH AMERICA, INC.	TOYOTA	PICKUP	1994		19941114	N	0	0	EXTERIOR LIGHTING:TURN SIGNAL	LA MESA     	CA	4TARN01P3RZ	19950112	19941114		1	RIGHT TURN SIGNAL FAILED.	VOQ																									V	
899	477834	GENERAL MOTORS CORP.	CHEVROLET	S10	1994		19941108	N	0	0	SERVICE BRAKES, HYDRAULIC:ANTILOCK	SAN DIEGO   	CA	1GCCS19W0R8	19950112	19941108		1	ANTI-LOCK BRAKES ENGAGE DURING LIGHT BRAKING.  *SKD	VOQ																									V	
900	477933	TOYOTA MOTOR NORTH AMERICA, INC.	TOYOTA	PICKUP	1994		19940301	N	0	0	TIRES:TREAD/BELT	LA CRESCEN  	CA	JT4VN93D4R5	19950112	19941112		1	TREAD WEAR ON BRIDGESTONE TIRES.	VOQ																									V	
901	477844	GENERAL MOTORS CORP.	CHEVROLET	SUBURBAN	1994		19941101	N	0	0	SERVICE BRAKES, HYDRAULIC:FOUNDATION COMPONENTS:MASTER CYLINDER	SANTA MONI  	CA	1GNGK26NXRJ	19950112	19941109		1	MASTER CYLINDER FAILURE.   *AK	VOQ																									V	
902	477782	FORD MOTOR COMPANY	FORD	FORD TRUCK	1994		19940401	N	0	0	SERVICE BRAKES, HYDRAULIC:FOUNDATION COMPONENTS	VALENCIA    	CA	3FCMF53G0RJ	19950112	19941118		1	BRAKES OVERHEATED/FAILED ON A STEEP GRADE.  *SKD	VOQ																									V	
903	477744	GENERAL MOTORS CORP.	GMC	SUBURBAN	1994		19941109	N	0	0	SEAT BELTS:FRONT:RETRACTOR	SIMI VALLE  	CA	1GKEC16K4RJ	19950112	19941109		3	FRONT SEAT BELT RETRACTORS FAILED.  *SKD	VOQ																									V	
904	471433	GENERAL MOTORS CORP.	CADILLAC	FLEETWOOD	1989	Y	19900101	N	1	0	VEHICLE SPEED CONTROL	HILLSBOROU  	NC	1G6CB5155K5	19950112	19940624		2	VEHICLE SUDDENLY ACCELERATED TWICE AT START UP, ONCE RESULTING IN AN ACCIDENT/INJURY.  *AW	VOQ																									V	
905	471329	GENERAL MOTORS CORP.	CADILLAC	DEVILLE	1987		19940621	N	0	0	VISIBILITY:POWER WINDOW DEVICES AND CONTROLS	OAKLAND     	CA	1G6CD5183H4	19950112	19940621		1	POWER WINDOW/ANTENNA FAILURE.	VOQ																									V	
906	471329	GENERAL MOTORS CORP.	CADILLAC	DEVILLE	1987		19940621	N	0	0	ENGINE AND ENGINE COOLING:ENGINE:GASOLINE:BELTS AND ASSOCIATED PULLEYS	OAKLAND     	CA	1G6CD5183H4	19950112	19940621		1	SERPENTINE BELT FAILED, ALSO RADIATOR/HOSES REPLACED.	VOQ																									V	
907	479267	MERCEDES-BENZ USA, LLC.	MERCEDES BENZ	300	1994		19940625	N	0	0	ENGINE AND ENGINE COOLING:EXHAUST SYSTEM:EMISSION CONTROL 	PALM SPRIN  	CA	WDBGA32E8RA	19950112	19941108		1	OXYGEN SENSOR FAILED.   *AK	VOQ																									V	
908	477953	MITSUBISHI MOTORS NORTH AMERICA, INC.	MITSUBISHI	MONTERO	1994		19940401	N	0	0	POWER TRAIN	SAN FRANCI  	CA	JA4MR41H5RJ	19950112	19941107		1	SPEEDOMETER PLASTIC GEAR FAILURE.  *AK	VOQ																									V	
909	477780	DAIMLERCHRYSLER CORPORATION	CHRYSLER	NEW YORKER	1994		19950109	N	0	0	VISIBILITY:POWER WINDOW DEVICES AND CONTROLS	CLAREMONT   	CA	2C3ED46F6RH	19950112	19950109		1	REAR WINDOW SEALS FAIL, CAUSING WATER ENTRY WHEN RAINING.	VOQ																									V	
910	477757	GENERAL MOTORS CORP.	CHEVROLET	C SERIES(LIGHT)	1994		19941109	N	0	0	POWER TRAIN:AUTOMATIC TRANSMISSION	PINON HILL  	CA	1GCEC19K3RE	19950112	19941109		1	TRANSMISSION HAS CLUNKING NOISE WHEN STOPPING VEHICLE.	VOQ																									V	
911	477757	GENERAL MOTORS CORP.	CHEVROLET	C SERIES(LIGHT)	1994		19941109	N	0	0	LATCHES/LOCKS/LINKAGES:TAILGATE:LATCH	PINON HILL  	CA	1GCEC19K3RE	19950112	19941109		1	TAILGATE LOCK FAILED.	VOQ																									V	
912	479244	FORD MOTOR COMPANY	FORD	F SERIES (LIGHT)	1994		19941022	N	0	0	SERVICE BRAKES, HYDRAULIC:FOUNDATION COMPONENTS:DISC:ROTOR	ANAHEIM     	CA	1FTEF15N3RL	19950112	19941124		2	BRAKE ROTORS/PADS FAILED TWICE. (F150) *SKD	VOQ																									V	
913	479245	FORD MOTOR COMPANY	FORD	F SERIES (LIGHT)	1994	Y	19941125	N	0	0	SERVICE BRAKES, HYDRAULIC:ANTILOCK	HUNTINGTON  	CA	1FTDF15Y5RL	19950112	19941125		1	REAR ANTI-LOCK BRAKE PRESSURE REGULATOR FAILED, CAUSING ANTI-LOCK BRAKE FAILURE/BRAKE FADE/LOSS OF CONTROL/ACCIDENT. (F150)  *SKD	VOQ																									V	
914	479338	DAIMLERCHRYSLER CORPORATION	DODGE	CARAVAN	1994		19940919	N	0	0	VEHICLE SPEED CONTROL	LAGUNA BCH  	CA	1B4GH44R6RX	19950112	19941207		1	SPEED SENSOR FAILED.	VOQ																									V	
915	477878	GENERAL MOTORS CORP.	CHEVROLET	C SERIES(LIGHT)	1994		19941129	N	0	0	ELECTRICAL SYSTEM:IGNITION:MODULE	LONG BEACH  	CA	1GCDC14Z4RZ	19950112	19941129		1	COMPUTER CHIP FAILURE.  *AK	VOQ																									V	
916	477811	MITSUBISHI MOTORS NORTH AMERICA, INC.	MITSUBISHI	GALANT	1994		19941128	N	0	0	POWER TRAIN:AUTOMATIC TRANSMISSION	BANNING     	CA	4A3AJ46G0RE	19950112	19941128		1	TRANSMISSION DOWN SHIFTS INTERMITTENTLY.	VOQ																									V	
