CPSC	recall_number	remedy	sold_to	name_of_product	description	manufacturer	sold_exclusively_at	manufactured_in	incidents_injuries	hazard	importer	consumer_contact	units
CPSC	03161	Return the oil lamp sets to any Target store for a refund.	null	Oil Lamp Boxed Sets	The boxed sets contain a clear vase with pink or purple floral designs, and a 16-ounce bottle of paraffin oil. The packaging is labeled &quot;Handpainted Oil Lamp Set&quot; and &quot;Floral Garden.&quot; Item number 054 11 0229 is printed on the packaging.	DesignPac, of Northlake, Ill.	null	null	None reported.	The bottles of paraffin oil in these sets do not have the child-resistant closures required by federal law.	null	null	4,000
CPSC	03162	Return the lighters to the store where purchased for a refund.	null	Novelty Cigarette Lighters	There are two styles of lighters included in this recall. The first is a chrome and silver lighter, in the shape of a rearing horse. It is about 2.3 inches long and is labeled &quot;DE-L-36.&quot; The second lighter is silver-colored, in the shape of a bird head holding a snake. It is about 2.5 inches long and is labeled &quot;DE-L-23.&quot;	De Bon Sales Inc., of Houston, Texas	null	China	None reported.	The novelty lighters are not equipped with child-resistant mechanisms. They pose fire and burn hazards to young children.	null	null	8,000
CPSC	03163	Consumers should contact UWATEC for a free replacement unit.	null	UWATEC Smart Dive Computers	The recalled units are the UWATEC Smart PRO and the Smart COM dive computers. The Smart PRO is offered as a console and as a wrist unit. The Smart COM only comes in a console model. The names of each unit appear on the computer case, along with the name &quot;UWATEC.&quot;	UWATEC AG of Hallwil, Switzerland	null	Switzerland	The firm has received two reports of the dive computers not working properly, though no injuries have been reported.	The computer's alert signal system may not work properly and the computer screen may freeze. This may cause inaccurate information to be displayed, such as water depth, tank pressure, and ascent rate, posing a risk to the safety of a diver.	null	null	6000 units
CPSC	03159	The sprinklers should be returned to the place of purchase for a full refund.	null	Toad Lawn Ball Sprinkler	The green, frog-shaped sprinkler is 6 1/2 inches long, 6 1/2 inches wide and 7 inches tall. The recalled lawn balls have a label on the bottom that includes the model number 738449 508893 and the words, &quot;Made in China.&quot;	Midwest, of Cannon Falls, Minn.	null	null	There have been eight incidents involving the lawn balls exploding, though no injuries or property damage have been reported.	A small hose inside the toad can fail, allowing water to fill the toad's cavity. The increased water pressure can cause the toad to explode, posing the risk of injury to anyone nearby.	null	null	4,000
CPSC	03160	Consumers will be shipped a replacement slow cooker base.	null	Slow Cookers	The recalled slow cookers were sold under the Hamilton Beach and Proctor-Silex brand names, which are printed on the front of the base of the unit. The slow cookers are either round or oval, and were sold in solid white and various print designs. They have a capacity of 3.5 to 6.5 quarts. The slow cookers have series codes A through D which are printed on the bottom along with the model number.	Hamilton Beach/Proctor-Silex, of Glen Allen, Va.	null	null	The company has received approximately 4,700 reports of handles breaking, including two reports of consumers who required medical attention for burns.	The handles on the base of the slow cookers can break, posing a risk of burns from hot food spilling onto consumers.	null	null	2.7 million
CPSC	03161	Return the oil lamp sets to any Target store for a refund.	null	Oil Lamp Boxed Sets	The boxed sets contain a clear vase with pink or purple floral designs, and a 16-ounce bottle of paraffin oil. The packaging is labeled &quot;Handpainted Oil Lamp Set&quot; and &quot;Floral Garden.&quot; Item number 054 11 0229 is printed on the packaging.	DesignPac, of Northlake, Ill.	null	null	None reported.	The bottles of paraffin oil in these sets do not have the child-resistant closures required by federal law.	null	null	4,000
CPSC	03162	Return the lighters to the store where purchased for a refund.	null	Novelty Cigarette Lighters	There are two styles of lighters included in this recall. The first is a chrome and silver lighter, in the shape of a rearing horse. It is about 2.3 inches long and is labeled &quot;DE-L-36.&quot; The second lighter is silver-colored, in the shape of a bird head holding a snake. It is about 2.5 inches long and is labeled &quot;DE-L-23.&quot;	De Bon Sales Inc., of Houston, Texas	null	China	None reported.	The novelty lighters are not equipped with child-resistant mechanisms. They pose fire and burn hazards to young children.	null	null	8,000
CPSC	03163	Consumers should contact UWATEC for a free replacement unit.	null	UWATEC Smart Dive Computers	The recalled units are the UWATEC Smart PRO and the Smart COM dive computers. The Smart PRO is offered as a console and as a wrist unit. The Smart COM only comes in a console model. The names of each unit appear on the computer case, along with the name &quot;UWATEC.&quot;	UWATEC AG of Hallwil, Switzerland	null	Switzerland	The firm has received two reports of the dive computers not working properly, though no injuries have been reported.	The computer's alert signal system may not work properly and the computer screen may freeze. This may cause inaccurate information to be displayed, such as water depth, tank pressure, and ascent rate, posing a risk to the safety of a diver.	null	null	6000 units
CPSC	03548	Consumers should stop using their riding mowers until free repairs can be made. Contact a Toro dealer immediately for a free repair.	null	null	null	Toro Company, of Bloomington, Minn.	null	null	One consumer reported loss of control resulting in a tip over. The consumer received a black eye, along with cuts and bruises.	The actuator arm could fail, resulting in a loss of transmission control and risk of personal injury.	null	null	7,500
CPSC	03547	Select Comfort is contacting all registered owners and will provide a replacement air pump at no charge to consumers whose cords exhibit damage to the wire insulation. Consumers should unplug the pump from the electrical outlet before inspecting the power cord. The bed can continue to be used even if the pump has to be replaced, but the pump should remain unplugged if the wire insulation shows any sign of cracking.	null	null	This program includes all Sleep Number&reg; Beds by Select Comfort sold from November 2002 through March 15, 2003 that were shipped through or to cold weather locations.	Select Comfort Corporation, of Minneapolis, Minn.	null	United States	null	When exposed to severely cold temperatures and impact, such as may occur during shipping, the power cord insulation on the electric air pump can crack, creating a short-circuit or exposing live electrical wires and presenting a shock or electrocution hazard.	null	null	90,000
CPSC	03544	Toshiba has contacted many of the owners of the affected televisions. However, if you have not been contacted, please contact Toshiba at the phone number or Web site below. Consumers who have an affected television will receive a free replacement, which includes removal of the recalled television, delivery and installation of the replacement.	null	null	This program includes a limited number of units of the following Toshiba rear projection televisions: Model 50A62, Model 51H83, and Model 57H83. To determine if your television set is affected by this corrective action, go to www.tacp.toshiba.com/safety_notice.asp and follow the instructions.	Toshiba America Consumer Products, Inc., of Wayne, N.J.	null	U.S.A.	null	If the capacitors short circuit due to a very high electrical surge, such as from a lightening strike, the metal parts on the television could present a shock or electrocution hazard. In addition, the metal jacks on the back of the television or another metal box attached to the television could present a shock or electrocution hazard as a result of the capacitors' failure.	null	null	3,400
CPSC	03152	Firm is providing a free replacement blanket, but consumers should unplug the recalled units immediately.	null	SOIREE&reg; and Soft n' Warm&reg; Electric Blankets	The recalled electric blankets are the SOIREE&reg; (only those sold at Belk stores) and Soft n' Warm&reg; (only sold at K-mart), both of which were sold in king, queen, full and twin sizes. At Belk, the electric blankets were sold only in ivory color and at K-mart they were sold in ivory, light blue and hunter green colors. The model name appears on the packaging, but not on the blanket. Both models have a UL warning label and a permanent label that reads &quot;Perfect Fit&quot; and &quot;Shell Made in China. Wired and Closed in U.S.A.&quot; The Soft n' Warm&reg; model has a date code ranging from 02228 through 02305 printed on a warning label on the foot of the blanket.	Perfect Fit Industries, of Charlotte, N.C.	null	null	Perfect Fit is aware of 44 reports of these blankets overheating, resulting in four reports of minor burn injuries. Damage to the blankets and bedding materials also have been reported.	These blankets can overheat, posing a risk of burn injuries to consumers, especially when the blanket is folded or bunched.	null	null	About 18,000
CPSC	03153	Consumers should immediately take the aerosol can away from children and contact the company for instructions on disposal and how to receive a full refund.	null	&quot;Spit Smatter&quot; Spray Foam	The &quot;Spit Smatter&quot; spray comes in a pressurized can and emits a colored foam based on one of six brands: &quot;Original Smatter,&quot; &quot;Blueberry Smatter,&quot; &quot;Banana Cream Smatter,&quot; &quot;Lemon Meringue Smatter,&quot; and &quot;Fatter Smatter.&quot; The brand name is printed on the can and the word &quot;Nickelodeon&quot; is printed on the orange trigger mechanism.	JAKKS Pacific Inc., of Malibu, Calif.	null	China	The Company has received four reports of the aerosol cans breaking apart, including one incident that resulted in a laceration injury to a consumer and several incidents involving property damage.	The aerosol cans can forcefully break apart, posing a risk of serious injury to nearby consumers.	null	null	About 1.3 million
CPSC	03154	Free replacement adapter plugs.	null	International Adapter Plugs	The black or white plastic adapter plugs have names of specific countries or regions where the plugs are intended for use written on the side. The writing includes &quot;NORTHERN EUROPE,&quot; &quot;GREAT BRITAIN,&quot; &quot;NO. AMERICA,&quot; &quot;AUSTRALIA,&quot; and &quot;SO. EUROPE.&quot; Except for the names of these countries and regions, the recalled plugs have no other writing on them. Plugs with &quot;MADE IN USA&quot; printed between the prongs, or that have a screw between the prongs, are not included in the recall.	Franzus Company LLC, of Beacon Falls, Conn.	null	China	The Franzus Co. has received two reports of the plugs separating. No injuries have been reported.	The adapter plug can separate, exposing live electrical conductors, posing an electrocution and shock hazard to consumers.	null	null	About 29,000
CPSC	03155	Consumers should call the firm on information on getting a free replacement toy.	null	&quot;Egg Dippers&quot; Easter Plush Toys	The recall includes four animal plush toys. The white rabbit has a purple egg which reads &quot;Happy Easter,&quot; the green rabbit has a yellow egg which reads &quot;Happy Easter,&quot; the purple bear has a purple egg which reads &quot;Happy Easter,&quot; and the yellow duck carries a green egg which reads &quot;You're Egg-stra Special.&quot; Each toy has a permanent label affixed which reads &quot;The Boyd's Collection, Ltd.&quot;	Small Small World, of Englewood, N.J.	null	China	There have been two reports of children ingesting beads coming out of these plush toys. No injuries have been reported.	The toys' seams can separate and allow small beads to be released, presenting an aspiration hazard to young children.	null	null	About 75,000
CPSC	03156	When installing a GSW water heater with a SIT AC4 gas control valve in the identified group, or re-lighting the pilot light, the following instructions must be complied with:	null	S.I.T. Gas Temperature Controls on GSW Water Heaters	This recall involves GSW water heaters with S.I.T. model 650 AC4 gas/temperature controls. The temperature control knobs on GSW propane water heaters are red and the control knobs on GSW natural gas water heaters are blue. The controls can be found on GSW Water Heaters with serial numbers ranging from 0202694162 to 0304507825.	GSW Industries Inc., of Fergus, Ontario, Canada	null	The gas temperature controls were manufactured in Mexico. The water heaters were manufactured in Canada.	None reported in the U.S. In Canada, where 140,000 units were sold, there were 45 incidents reported, including 15 reports of minor burns.	A potential burn hazard from ignition flashback or an increase in tank water temperature.	null	null	13,000 in USA
CPSC	03157	Return the entire firework device to the retailer for a refund or contact TNT for further directions.	null	&quot;TNT&quot; Reloadable Tube Fireworks	The firework device consists of a black base with a multicolored PVC material tube having approximate dimensions of 11 inches high by 1.25 inches in diameter. Each product is sold with six shells with fuses. The product is labeled &quot;Model No. CP983,&quot; &quot;Item No 460070,&quot; &quot;TNT,&quot; and &quot;#1 SELLING BRAND.&quot;	null	null	China	There have been two reports of the base of these fireworks devices breaking. No injuries were reported.	The firework device has a defective base and can break during launch. If reused, the launching device could then send fireworks in unintended directions, possible causing injury.	American Promotional Events Inc., of Florence, Ala.	null	About 22,700
CPSC	03542	Consumers should immediately contact their Kawasaki dealer to schedule an appointment for a free inspection and repair. For more information, contact your Kawasaki dealer, call Kawasaki toll-free at (866) 802-9381 between 8:30 a.m. and 4:45 p.m. PT Monday through Friday, or visit the Kawasaki Web site at	null	Kawasaki KFX700 &quot;V-Force&quot; ATVs	The Kawasaki KFX700 &quot;V-Force&quot; is a four-wheel ATV with a variable automatic transmission. The green or orange ATVs have &quot;Kawasaki,&quot; &quot;KFX700&quot; and &quot;V-Force&quot; written on them.	Kawasaki Motors Corp., U.S.A., of Irvine, Calif.	null	U.S.A.	Kawasaki has received three reports from consumers of the throttle sticking because of the throttle cable adjuster on the carburetor. There was one report of a consumer suffering minor injuries as a result of this hazard.	The throttle cable adjuster on the carburetor can loosen during operation, causing it to stick, which can cause the rider to lose control and possibly crash.	null	null	3,000
CPSC	03148	null	null	null	null	null	null	null	null	null	null	null	null
CPSC	03543	null	null	null	null	null	null	null	null	null	null	null	null
CPSC	03545	null	null	null	null	null	null	null	null	null	null	null	null
CPSC	03546	Contact Ontel Products to receive a free protective blade cover.	null	null	The recalled red plastic food slicer and dicer contains six roller blades at the front and a single slicing blade on the top. The food slicer is stamped &quot;Made in W. Germany&quot; and &quot;Famos Gerate&quot; on the inside of handle and has a four-pointed star. Only food slicers sold without the protective blade cover are included in this recall.	null	null	Germany	null	The exposed slicing blade on top of the unit can cut a consumer's fingers or hand during use.	Ontel Products Corp., of Fairfield, N.J.	null	32,000
CPSC	03145	Consumer should stop using the product immediately and mail the to Homier Distributing Co., Customer Service Center, 100 Commerce Drive, Huntington, IN 46750 for a full refund, including the cost of shipping.	null	HDC Extension Cords, Portable Lights, and Fluorescent Work Lights	null	Homier Distributing Co. Inc., of Huntington, Ind.	null	China	Company has received one report of an individual who sustained an electric shock and burn injury using the fluorescent work light near his car.	null	null	null	150,000, 180,000, and 54,000 respectively
CPSC	03146	Firm providing free repair kits containing a seal for the battery compartment, which will prevent battery leakage.	null	Crib Mobile Toys	These are Sparkling Symphony™ Mobile crib toys that attach to the crib side rail and play music and lights that are activated by remote control. Four star and moon characters are suspended from the mobile, which turns. The recalled toys have model number 71985 found on both the lower arm of the mobile and the back of the remote control. The Fisher-Price logo appears at the top of the upper arm, over the silver decoration. The recalled mobiles were manufactured from October 1999 through November 2000. A date code is located on the upper arm of the mobile and on the back of the remote control. Consumers should contact Fisher Price with their date code to determine if their mobile is part of the recall.	Fisher-Price, of East Aurora, N.Y.	null	China	Fisher-Price has received 30 reports of batteries leaking from the toy's battery compartment, including six reports of minor burn injuries to babies.	If batteries used in the mobile leak, the caustic liquid can seep out of the battery compartment, posing a risk of chemical burns to babies.	null	null	233,000
CPSC	03138	Consumers should remove the mini-cutters from the set and return them to Creative Kids to get a free pack of colored paper clips.	null	Children's Art Supply Sets	The 87-piece art supply sets were sold in solid wood grain boxes. The sets contain crayons, markers, scissors, water and oil paints, brushes, etc. A label on the box reads &quot;JUMBO ART CASE 87 pieces&quot; and &quot;Item No. 11519.&quot;	Creative Kids Inc. of Monsey, N.Y.	null	China	The Commission and Creative Kids are aware of an incident where an 8-year-old girl received minor cuts to her finger when she used the mini-cutter.	The sets contain mini-cutters with razor blades which pose a laceration hazard to young children.	null	null	1,400
CPSC	03139	Consumers should return the pancake maker to Trivett to receive a full refund, including the cost of postage.	null	Pancake Express Pancake Makers	These &quot;Pancake Express&quot; pancake makers are two-sided stove top skillets constructed of aluminum with black plastic handles. The product is labeled &quot;Pancake Express&quot; and &quot;Made in China.&quot;	Trivett Industries, Inc., of Deland, Fla.	null	China	Trivett Industries is aware of one incident of a consumer receiving minor burns when the handle melted and separated from the pancake maker.	The handles on the pancake makers are unable to withstand the heat of the device, causing the handle to fail to provide support because of melting or breaking.	null	null	590
CPSC	03140	Consumers should return the unit to the firm for a full refund plus cost of postage. The heater should be mailed to: 2340 NW 102nd Place, Miami, FL 33172.	null	Weather Works Ventilaire Electric Heaters	The portable electric heater is beige, constructed of a plastic housing, and has the &quot;Weather Works&quot; logo printed on the front side of the fan. On the base of the unit is a sticker reading, &quot;Model No. CH-601, AC 120V - 60Hz, 1500 Watts, Made in China, 4H39.&quot;	Weather Works Inc., of Miami, Fla.	null	China.	Weather Works has received one report of a heater smoking and starting a fire, though no injuries were reported.	The electric heater can overheat internal plastic components and damage the wiring, posing a fire and electrocution hazard to consumers.	null	null	2,400
CPSC	03141	Consumers should mail the night light to Trisonic/Eastern America Trio Products, 11-11 131st St., P.O. Box 527018, Flushing, NY 11352, for a full refund plus the cost of postage.	null	Trisonic Nightlights	The recalled nightlights have a yellow exterior shaped like a smiley face. A label on the back of the nightlight reads, &quot;Trisonic, 4W/120Vcustom made in China for Trisonic, Queens, NY, TS-45431.&quot;	Trisonic/Eastern America Trio Products, of Flushing, N.Y.	null	China.	Trisonic has received a report of a nightlight exploding, resulting in laceration injuries to a consumer.	The nightlight poses a serious electrocution, electric shock, burn and fire hazard to consumers.	null	null	12,000
CPSC	03137	null	null	null	null	null	null	null	null	null	null	null	null
CPSC	03541	Authorized Stihl dealers will replace all fuel tank vents. If you own one of the recalled chain saws, stop using it until the fuel tank vent has been replaced.	null	Stihl Chain Saws	Stihl and model number, MS 270C, MS280, or MS280C are printed on the starter housing. The serial number is inscribed into the surface of the housing and can be seen by looking at the surface of the chain saw next to and above the bumper spikes. Saws with serial numbers from 255923345 through 260340097 are included in this recall.	Stihl Inc., Virginia Beach, Va.	null	U.S.A.	None reported.	In some units, the fuel tank vent could be installed incorrectly and become dislodged. If this occurs, fuel could leak and result in a fire.	null	null	13,000
CPSC	03135	null	null	null	null	null	null	null	null	null	null	null	null
CPSC	03133	null	null	null	null	null	null	null	null	null	null	null	null
CPSC	03134	null	null	null	null	null	null	null	null	null	null	null	null
CPSC	03127	Consumers should contact the company for information on receiving a replacement toy.	null	Toy Vehicles	The Viking Mini Chubbies are toy wagons, tractors, helicopters, cars, airplanes, and jeeps. The toys measure about 3-inches long and were sold in red, blue and yellow. Model numbers are printed on the bottom of the toy. Models included in the recall are AW01119, AW41111, AW61005 and AW81119.	International Playthings Inc., of Parsippany, N.J.	null	Thailand	International Playthings has received one report of small parts detaching. No injuries have been reported.	Small parts on the vehicles can detach, posing a choking hazard to young children.	null	null	126,000
CPSC	03128	Contact Step2 to receive a replacement set of drumsticks.	null	Toy Drumsticks	The drumsticks were sold with the Step2 Toddle Tunes Big Band Drum set, models 7135B2 and 7135KR. The drum sets are blue and yellow with music decals attached to the front. The word &quot;Step2&quot; is imprinted across the front of the drum set. The yellow and blue drumsticks are about 9-inches long.	null	null	Korea	CPSC and Step2 are aware of one incident where a child reportedly began to choke on the top of the drumstick. The child's parent performed the Heimlech maneuver to remove the small part.	The tip of the drumstick can break off, posing a choking hazard to young children.	null	null	800
CPSC	03129	Consumers should unplug and stop using the extension cords immediately. Consumers should mail the cords to United General Supply Co., Lee-Tools Extension Cords, 9320 Harwin Drive, Houston, Texas 77036 for a refund, including the cost of postage.	null	Extension Cords	The recalled extension cords were sold in yellow and brown and are approximately 9-, 25-, 50-, 100-feet long. The 9-foot extension cord was packaged in a green sleeve card with the words &quot;Household Extension Cord&quot; printed across the front. All remaining sizes were packaged in black sleeve cards with the words &quot;Air Conditioner Extension Cord&quot; printed across the front.	United General Supply Co., of Houston, TX	null	China	United General has not received any reports of incidents involving these extension cords. This recall is being conducted to prevent the possibility of injuries.	The extension cords have undersized conductors and no over- current protection which causes overheating, presenting a shock and fire hazard.	null	null	8,200
CPSC	03130	Consumers should stop using the lights immediately and contact the Sea Gull Lighting dealer from whom the light fixtures were purchased or the company, to receive a free replacement fixture.	null	Ceiling Light Fixtures	The recalled ceiling-mounted light fixtures come in six different models - 5359-01, 5359-02, 5359-15, 5370-15, 5370-98, and 5372-02 - which can only be accurately identified on the packaging or receipts. The white glass lights have an antique brass, polished brass, white, or brushed stainless finish and do not have any exposed screws. The light fixture is twisted into the base and locks in place. Because the light fixtures have no visible label or identifying marks on the outside, consumers are advised to look at the photos below or contact the company for more information.	null	null	China.	Sea Gull has received two reports of the fixtures shorting out, though there have been no reports of fire or injuries.	The wiring in the lights can short, posing a fire hazard to consumers.	null	null	7,100
