CPSC	recall_number	remedy	sold_to	name_of_product	description	manufacturer	sold_exclusively_at	manufactured_in	incidents_injuries	hazard	importer	consumer_contact	units
CPSC	04559	Consumers with a LG TM510 cell phone battery having one of the identified manufacturer/date codes and purchased from Verizon Wireless should stop charging the battery immediately and contact Verizon Wireless to receive a replacement battery. Verizon Wireless is sending letters directly to consumers notifying them of this hazard.	null	null	The recalled batteries can be found in LG TM-510 model cell phones, have a manufacturer/date code of &quot;AEMLLL 02220,&quot; AEMMHH 02220,&quot; &quot;AEMLLL 02X25H&quot; or &quot;AEMMHH 02725&quot; and were distributed by Verizon Wireless. The manufacturer/date code can be found on the battery, below the words, &quot;Model/Modelo&quot; or &quot;LG.&quot; The phone's model number appears on the back side of the phone beneath the battery. The cell phones, which come in black or silver, may have the Verizon Wireless name on the front.	null	null	null	Verizon Wireless has received 18 reports of incidents involving counterfeit batteries, including injuries to users and property damage.	Some LG-branded TM-510 batteries may be counterfeit and susceptible to overcharging, especially if used with a non-LG charger. LG Infocomm U.S.A. Inc. states that these are counterfeit LG-branded batteries, which do not contain a safety device in the circuitry to prevent overcharging. In turn, the counterfeit batteries can overheat, posing a fire and burn hazard to users.	null	null	About 50,000
CPSC	04168	Consumers should stop using the recalled &quot;Rock ‘N Roller&quot; strollers with detachable seats immediately and call the firm to determine how to inspect the stroller for possible replacement.	null	COSCO&reg; &quot;Rock ‘N Roller&quot; Baby Stroller	The COSCO&reg; &quot;Rock ‘N Roller&quot; strollers involved have seats that can be removed from the stroller frame. The detached seat can function as a bassinet, or be repositioned on the stroller frame facing front or back. The stroller has a dark blue or green metal frame with four wheels on the front and two wheels on the back. The side folding area of the frame has a white plastic cover that is labeled &quot;Rock ‘N Roller by Geoby COSCO&reg;.&quot; There is a label on the back of the frame containing one of the following model numbers: &quot;01-654, 01-622, 01-624, 01-646 or 01-656.&quot; The seat cover is usually a dark blue or green printed fabric with &quot;COSCO&reg; A Dorel Company&quot; printed on the footrest.	null	null	China	There have been 77 reports of problems related to the stroller seats. Injuries included one child that fell and had a slight concussion and another child that cut his forehead and required stitches. Additionally, there were 46 reports of bumps and bruises.	If the stop pins are bent or missing or the seat is not fully attached, the seat can partially detach from the frame during use and the infant occupant can be injured in a fall.	null	null	300,000
CPSC	04169	null	null	null	null	null	null	null	null	null	null	null	null
CPSC	04166	Consumers should stop using these cover-ups and contact Samara Brothers for instructions on receiving a free repair or replacement cover-up.	null	Children's Swimsuit Cover-up	The recalled cover-ups were sold in various colors for boys and girls. Cover-ups were sold separately or as part of a swimsuit set. The cover-ups were sold under the brand names &quot;Samara&quot; and &quot;Carter's,&quot; in sizes ranging from 3 to 24 months, 2T to 4T and 4X to 6X. On the short-sleeved cover-up are various patches depicting beach and swim-related themes. The name &quot;Samara&quot; or &quot;Carter's&quot; is printed on the garment-care tag, along with the size.	Samara Brothers Inc., of Edison, N.J.	null	China or Egypt	Samara Brothers has received one report of a zipper-pull coming off. No injuries have been reported.	The zipper pull on the cover-up can detach, posing a choking hazard to young children.	null	null	30,000
CPSC	04167	Consumers should return the rompers to the Kmart store where purchased for a refund.	null	Basic Editions Infant and Toddler Girls' Romper	The recalled rompers are pink and white gingham with pink buttons and crocheted cherry-shape tassels on the pocket and green and white gingham bows on the trim of the leg openings. The rompers were sold in infant sizes 12-months to 24-months and toddler sizes 2T to 5T. &quot;MADE IN/HECHO EN BANGLADESH&quot; and &quot;basic EDITIONS&reg;&quot; is printed on a label inside the neck of the garment.	Kmart Corporation, of Troy, Mich.	null	Bangladesh	The firm has received two reports of children pulling off the crocheted cherry-shape tassels. No injuries reported.	The crocheted cherry-shape tassels and plastic buttons may pull off, posing a choking hazard to young children.	null	null	About 20,000
CPSC	04558	Consumers should take the wooden dolls away from young children immediately and contact Lakeshore Learning Materials for information on how to receive a free replacement doll set.	null	null	The recall involves Toddler Doll Family sets sold with four figurines, a mom, dad, brother and sister. The 4-inch-tall dolls have a wooden head, arms and feet. The body is constructed of wire, which makes the doll adjustable. Each doll has yarn hair and is dressed in various colored outfits.	null	null	null	The company received reports of the boot and head detaching. No injuries have been reported.	The head and boot of the dolls can detach, posing a choking hazard to young children.	null	null	About 2,800
CPSC	04557	Consumers should return the hats to any Gap store for a refund and a complimentary $5 appreciation card.	null	null	The girls' straw cowboy hats were sold in two colors, pink and natural straw, with a flower embroidered on one side and a butterfly embroidered on the other. Style number 239040 is printed on a white label sewn into the brim of the hat, under the garment-care tag. The hats were sold in sizes small/medium (s/m) and large/extra-large (lg/xl).	null	null	null	GapKids has received two reports of customers who received minor scratches from the exposed wire tip. A 7-year-old child received a scratch on the leg and a 12-year-old received a scratch on the forehead.	The straw hat is constructed using a thin wire within a seam. The tip of the wire can break free from the seam, posing a laceration hazard.	null	null	5,200
CPSC	04557	Consumers should return the hats to any Gap store for a refund and a complimentary $5 appreciation card.	null	null	The girls' straw cowboy hats were sold in two colors, pink and natural straw, with a flower embroidered on one side and a butterfly embroidered on the other. Style number 239040 is printed on a white label sewn into the brim of the hat, under the garment-care tag. The hats were sold in sizes small/medium (s/m) and large/extra-large (lg/xl).	null	null	null	GapKids has received two reports of customers who received minor scratches from the exposed wire tip. A 7-year-old child received a scratch on the leg and a 12-year-old received a scratch on the forehead.	The straw hat is constructed using a thin wire within a seam. The tip of the wire can break free from the seam, posing a laceration hazard.	null	null	5,200
CPSC	04163	Tyler will replace the recalled defrost heater with a Cal-rod hairpin style heater in all wide island frozen food and ice cream end cap cases.	null	Defrost heaters used in grocery store frozen food cases	The recalled defrost heater was used in Tyler's &quot;wide island&quot; frozen food end cap cases in grocery stores. The recalled defrost heaters (which are not visible to consumers) are Electro-Heat Defrost Heater Model 51957100. The Tyler wide island frozen food end cap cases with the recalled heaters are models NCE, NFE, NGE, NCGE, NFJEA, NCJEA, NCJGEA and NFJGEA. The model and serial number is located on the data plate, which is on the front inner panel of the case.	null	null	U.S.A.	Carrier Commercial Refrigeration Inc. has reports of four incidents where the defrost heater forcefully ejected, and in two instances, the defrost heater penetrated through the end of the frozen food case. In one incident, a consumer's leg was broken.	Moisture building up pressure inside the defrost heater can cause it to forcefully eject from the frozen food case, possibly injuring bystanders.	null	null	16,000
CPSC	04164	Consumers should stop using the bicycles and contact Huffy Bicycle to determine if the product is a part of the recall. Consumers will receive a free replacement handlebar and stem.	null	Huffy &quot;Cranbrook&quot; Bicycles	The recall involves single-speed &quot;Cranbrook&quot; bicycles with 26-inch wheels. The bicycles were sold in both men's (model 56462) and ladies' (model 56472) style frames. The name &quot;Cranbrook&quot; is printed on the frame of the bicycle. Serial numbers included in the recall range from SNHHE04C52556 to SNHHE04C64557. Serial numbers and model numbers are located on the bottom bracket of the frame, where the crank is attached to the bicycle.	Huffy Bicycle Company, of Springboro, Ohio	null	China	None reported.	The handlebar could unexpectedly loosen causing the rider to lose control of bicycle.	null	null	12,000
CPSC	04162	Consumers should stop using the amplifiers immediately and contact Linn Inc. at (800) 595-6770 for information on how to obtain free repair of the recalled product.	null	Linn Power Amplifiers and Linn Melodik Bass Extension Loudspeaker System	The Linn AV5105 2-Channel Power Amplifier comes in black or silver and is 3 inches by 15 inches by 14 inches; all serial numbers of this model are recalled. The Linn LK240 Single-Channel Power Amplifier comes in black or silver and is 3 inches by 12 &frac12; inches by 12 &frac34; inches; all serial numbers of this model are recalled. The Linn AV5150 Melodik Bass Extension Loudspeaker System comes in black ash, American cherry, or maple and is 19 inches by 25 inches by 19 inches; only serial numbers 1001 to 714451 are recalled. The model numbers and serial numbers are on the front panel, printed on the bottom of the product, or on the control panel near the main power supply.	null	null	Scotland.	Among the 70 reported incidents, there were two reports of heat damage to the cover of the connected speakers. No injuries reported.	The amplifier's capacitors can overheat, blow a fuse, and damage the products to which they are connected, presenting a fire hazard.	null	null	About 2,157 units
CPSC	04158	Consumers should stop using these chairs immediately and contact The Land of Nod for instructions on how to return these chairs. The company is offering an exchange, credit or refund. Those who choose an exchange for new chairs, and who respond before July 15, 2004, will receive an additional $50 gift certificate to be used toward a future purchase.	null	Children's Wooden Chairs	The child's round back (item #0409042) and straight back (item #0409102) wooden chairs have a lacquer painted finish in one of the following colors: red, light blue, dark blue, pale yellow or light green. They are about 26-inches high. Underneath the seat, there is a sticker that reads either &quot;Made in PROC&quot; or &quot;Made in China.&quot; No other writing is on the recalled chairs. The item number was used for ordering from the catalog or from the firm's Web site, and is not written on the chairs. The chairs are intended for use by children 3 to 8 years old.	The Land of Nod, of Wheeling, Ill.	null	China	The Land of Nod has received three reports of the chairs collapsing, including one injury in which a child bumped her head.	The leg supports can crack, causing the chair to collapse. Children sitting in these chairs can fall.	null	null	3,500
CPSC	04159	Consumers should immediately stop using product and return the slow cooker to Wal-Mart for a full refund.	null	General Electric Cool Touch Slow Cooker	The recalled General Electric (GE) Cool Touch 6 Quart Slow Cooker has a removable blue ceramic bowl with a glass lid. The enclosure that surrounds the ceramic bowl is made of plastic. The GE logo is located on the front of the unit underneath the temperature control knob. The model number 168945 is located on a silver label on the bottom of the base.	Select Brands Inc., of Lenexa, Kan.	Wal-Mart stores nationwide from June 2003 through May 2004 for about $28.	China	Wal-Mart has received 27 reports of scorched or damaged countertops, though no injuries have been reported.	The heating element can drop to the bottom of the slow cooker and melt through the plastic outer shell, posing a burn hazard to users.	null	null	146,000
CPSC	04160	Consumers should stop using the charger immediately and contact Associated Electrics to receive a free repair.	null	Reedy Quasar Pro Battery Chargers (charges batteries used to power remote control race cars)	The recalled #611 Quasar Pro Chargers were manufactured from February 2002 through February 2004. The grey charger box has words &quot;Quasar Pro&quot; printed in yellow on the front and shows a display of &quot;QUASAR PRO VERSION 1.0&quot; when first turned on. The recalled chargers either have no barcode label on the underside or a barcode label with the numbers &quot;611&quot; or &quot;611A&quot;.	Associated Electrics Inc., of Costa Mesa, Calif.	null	China	Associated Electrics has received three reports of incidents involving exploding battery cells. One consumer sustained a bruised hand, while another received an eye injury from flying debris.	A defective fuse and program error in the charger can cause the battery packs being charged to overheat and explode, posing a risk of serious injury to consumers.	null	null	4,900
CPSC	04161	Consumers should contact Lutron Electronics to receive a free replacement power supply unit.	null	DC power supply units	These recalled 12-volt DC power supply units were sold as an accessory power supply device for some of Lutron Electronic's wall stations and control interfaces, including some Grafik Eye 3000 lighting control systems. These systems were professionally installed in indoor commercial and residential settings for lighting and dimmer control applications. The power supplies are black plastic with &quot;Basler Electric&quot; and the model number &quot;BE29736001&quot; imprinted on the plug side. On the opposite side is a blue and white Lutron label with the number &quot;GRX-12VDC.&quot; Lutron's Grafik Eye 3000 lighting system is not part of the recall.	Basler Electric Co., of Highland, Ill.	null	Mexico	Basler has received two reports of the power supply case overheating and melting; though, no injuries have been reported.	The power supply, if overloaded, can overheat, posing a fire hazard to consumers.	null	null	3,000
CPSC	04556	Stop using the recalled benches immediately and contact your local Allen Organ dealer or call the Allen Organ Company Service Department for information on how to schedule an appointment to have your wooden organ bench repaired.	null	null	The recalled wooden organ bench is sold primarily to churches and theaters as part of a package that also includes an organ, console, pedal board, and speaker cabinets. A very small number of the wooden organ benches were sold separately. The wooden organ bench measures 26 inches high, 12 inches wide, and 48 inches long. The benches are made of oak, red oak, and walnut colored wood.	null	null	null	Four incidents have been reported involving loose joints for the legs of the organ bench. No injuries have been reported.	The wooden bench may collapse because not enough glue was used during assembly.	null	null	1,757
CPSC	04157	null	null	null	null	null	null	null	null	null	null	null	null
CPSC	04155	Consumers should stop using the gun holsters immediately and bring the recalled gun holsters to an authorized Fobus USA distributor for a free replacement gun holster or contact First Samco Inc. for instructions on how to return the product for a replacement item. Consumers also may send their recalled gun holsters to Fobus USA, 1300 B-3 Industrial Highway, Southampton, PA 18966. First Samco, Inc. will reimburse consumers for return shipping.	null	Fobus GLT gun holsters	The gun holsters are designed to hold a Series 17 and Series 19 Glock handgun fitted with a laser-sight light. &quot;GL 2*EMZ&quot; is engraved in the top of the gun holster and &quot;FOBUS&quot; and &quot;MADE IN ISRAEL&quot; is printed on the back of the gun holster. This recall involves two early versions of the Fobus GLT gun holsters, one with a plastic retention strap less than one inch wide and one with a leather retention strap less than one inch wide. The new design includes a strap that is more than one inch wide with a plastic tip too wide to be caught inside the trigger guard.	First Samco Inc., through its Fobus USA Holster Division, of Southampton, Pa.	null	Israel	There have been eight reports of the Glock handgun unintentionally discharging when being inserted into the gun holster, and one report of a user injuring his finger when a Glock handgun unintentionally discharged while being inserted into the gun holster.	A plastic or leather strap on the gun holster can catch the trigger of the gun when inserted into the holster causing the gun to unintentionally discharge, posing an injury hazard to the user.	null	null	About 3,200
CPSC	04555	Consumers should stop using the recalled car immediately and return it to a Big Y store to receive a refund.	null	null	The Kiddie Car Cruiser is a battery-operated ride-on toy car that measures about 27 inches high by 30 inches wide and 44 inches long. &quot;Turbo&quot; and &quot;Cruiser&quot; are printed on labels on the side of the ride-on toys.	null	null	null	FEBC has received 10 reports of the Kiddie Car Cruiser continuing to run when the accelerator was not depressed. No injuries have been reported.	The Kiddie Car Cruiser can continue to run when the accelerator is no longer depressed, which could result in the rider losing control of the car.	null	null	About 500
CPSC	04152	Consumers should stop using the adapters immediately and contact Targus to receive a full refund.	null	Universal All-in-One Plug Adapters	The recall involves 110/220 volt All-in-One Universal Travel Adapters. The black adapter unit provides four different types of power connection based on the different electrical outlets worldwide. The recalled adapters have the brand name &quot;Targus&quot; printed on the front. On the side of the adapter is a switch to allow the user to select one of the three country settings: &quot;USA/Aust/N.Z.&quot; or &quot;Europe&quot; or &quot;U.K.&quot;	Ahoku Electronics Co., of Taipei, Taiwan	null	Taiwan	Targus has not received any reports of incidents. This recall is being conducted to prevent the possibility of injuries.	The adapters may have an electrical wiring problem, posing a shock and fire hazard to consumers.	null	null	34,000
CPSC	04154	Consumers should not use the oven in self-cleaning mode until free replacement doors have been installed. Call the company to make arrangements for free replacement oven doors.	null	DCS Wall Oven	These wall ovens come in single or double oven models in three color options: stainless steel, black, or white. The Wall Oven/Single (WOS) models have these serial numbers indicating the date of manufacture in 2003 and 2004 (the blank can be any of the letters A through L):	Dynamic Cooking Systems Inc. of Huntington Beach, Calif.	null	USA	None reported.	When the oven is in the self-cleaning mode, the oven's exterior door temperature exceeds the allowable surface temperature limits under the industry voluntary standard for household electric ranges. Sustained contact with the door during self-cleaning mode could cause burns.	null	null	About 1,400
CPSC	04151	Consumers should stop using the units immediately and contact Electrolux for a free inspection and repair, if needed.	null	Room Air Conditioning and Heating Units	The recalled air conditioning/heating units are installed &quot;thru-the-wall&quot; and include the Frigidaire FAH12EM21 model and Carrier models 52FED31201AA.. The model numbers can be found on a serial plate on the side of the unit. The beige AC/heating units are about 14&quot; high, 24&quot; wide, and 20&quot; in depth.	null	null	United States.	Electrolux has received two reports of incidents, though there have been no injuries.	The heating coil in the units can be damaged during assembly, causing an electrical short and overheating, which poses a fire hazard to consumers.	null	null	5,800
CPSC	04554	Stop using the Tredex 10.0 treadmill immediately. The firm is out of business and a remedy is no longer available. Please destroy or discard the product.	null	null	The treadmill measures 62 inches high, 79 inches long, and 35 inches wide. It is gray and has a gray control panel. The name &quot;Tredex 10.0&quot; appears on the control console of the treadmill and on the motor cover of the treadmill. This recall includes only the Tredex 10.0 model treadmill.	null	null	null	Sportcraft received nine reports of unexpected acceleration, including five reports of injuries. The injuries included sprains to the back, shoulder and knees, and cuts and abrasions to various parts of the body.	The treadmill's circuitry can overheat, causing it to unexpectedly accelerate during use. When this happens, the user can fall.	null	null	320
CPSC	04150	Consumers should stop using the hair dryers immediately and return them to the store where purchased or to Marukyo U.S.A. Inc. for a refund.	null	Kuru Kuru Hair Dryers	The recalled Kuru Kuru model hair dryers include the following model numbers: EHP798P, EHP790P, EH724V, and EH725PK. The model name and number can be found on the handle. The recalled units, which come in blue and pink, do not have an immersion protection device at the end of the plug.	National Electric, of Japan	null	Japan.	None reported.	These electric hair dryers are not equipped with an immersion protection device to prevent electrocution if the hair dryer falls into water.	Marukyo U.S.A. Inc., of Los Angeles, Calif.	null	6,100
CPSC	04148	Stop using the recalled walkers immediately and return the walkers to the retailer where purchased to receive a refund.	null	Dream On Me Baby Walkers	The recalled baby walkers have model number 408 or 423 written on a label sewn into the seats. Model 408 has a white and black tray and a black printed fabric base and seat, measuring about 25 inches by 28 inches. Model 423 has a red tray and a purple plastic base measuring about 25 inches by 28 inches. Both models have eight snap in wheels and a label sewn into the seat that reads &quot;DREAM ON ME IND INC. BROOKYN, NY 112321, MADE IN CHINA.&quot;	null	null	China	No injuries have been reported with the baby walkers. This recall is being conducted to prevent the possibility of injury.	The walkers will fit through a standard doorway and are not designed to stop at the edge of a step. Babies using these walkers can be seriously injured or killed if they fall down stairs.	null	null	About 20,000
CPSC	04149	Consumers should take the recalled shoes away from young children immediately and should return the shoes to a Payless ShoeSource store for a cash refund or exchange.	null	Smart Fit™ and Teeny Toes™ Athletic Shoes	These are children's athletic shoes in prewalk and toddler sizes. The shoes are white with different color trim and come in sizes 0 to 10. The brand name &quot;Smart Fit&quot; or &quot;Teeny Toes&quot; is written on the sole and insole of the shoes. The recalled shoes have one of the following five-digit numbers, found on a label on the bottom of the shoe tongue: 31056, 31057, 31219, 32264, 32265, 33060 and 33061. No other styles or models are included in this recall.	Payless ShoeSource Inc., of Topeka, Kan.	null	China	Payless ShoeSource has received one report of a child starting to choke on a detached eyelet from one of these shoes. No injuries have been reported.	The metal eyelet lace holder at the top of the shoes can detach, posing a choking hazard to young children.	null	null	About 441,000
CPSC	04144	Take the recalled &quot;Dread Pirate&quot; ships away from children immediately and call Front Porch for free replacement toy ships that do not contain lead and will not break.	null	Dread Pirate coffee table game	The &quot;Old Century Dread Pirate™&quot; coffee table game has many playing pieces illustrating pirates, ships, coins, and treasure. This recall covers all games with lot numbers 75, 79, and 81. The lot numbers are on the bottom of the &quot;treasure chest.&quot;	null	null	China	None reported.	The surface coating and the metal in the ships contain lead and pose a risk of lead poisoning to young children. A child could ingest lead by swallowing a broken part of the ship or by repeatedly mouthing the ships.	null	null	2,000
CPSC	04145	Firm is out of business and the repair program is no longer availabe. Consumers should immediately stop using and discard or destroy the product	null	Backyard Products Swings	This recall involves single swings and acrobatic swings sold separately or as part of the Backyard Products wood gym set. Additional options to the gym sets include overhead ladders, slides, swings and forts. A yellow, triangular metal gusset on the gym sets contains the brand name, &quot;Backyard Products™&quot; followed by &quot;Collingwood, ON Canada.&quot; Model names and numbers are located on the assembly instructions.	Backyard Products™, of Collingwood, Ontario, Canada	null	Canada	The company had received 31 reports of chains breaking, resulting in five reports of injuries including a sore back, cut lip, and bumps and bruises.	Chains on the swing can detach during use and cause the child to fall to the ground and possibly suffer injuries.	null	null	47,600
