CPSC	recall_number	remedy	sold_to	name_of_product	description	manufacturer	sold_exclusively_at	manufactured_in	incidents_injuries	hazard	importer	consumer_contact	units
CPSC	05233	Consumers should stop using these chairs immediately, and contact Idea Nuova for instructions on how to receive a free repair kit to replace the locking pin.	null	null	The recalled children's folding chairs are made of metal tubing with a vinyl padded seat and seat back. They were sold with the following designs: &quot;Monkey Moods&quot; a monkey with stars, &quot;Rock n Roll&quot; with a monkey playing a guitar, &quot;Princess&quot; with pink flowers and a crown, &quot;Sport&quot; with a football, basketball and soccer ball, &quot;Training Camp&quot; with frogs, &quot;Rainbow Angel&quot; with clouds, rainbows and stars, Spiderman&reg;, and Disney&reg; Princess. The recalled chairs were sold as part of a set consisting of a table and two chairs. Each chair is about 22-inches high, 13 inches wide, and about 11 inches deep. &quot;Idea Nuova Inc.&quot; or &quot;I.N.I.&quot; is printed on a label located underneath the seat of the chairs.	Idea Nuova Inc., of New York, N.Y.	null	China	CPSC and Idea Nuova are aware of five incidents involving children. In one incident, there was a finger tip amputation, the second incident involved a finger tip amputation and a laceration, and the third incident involved a finger fracture and a laceration. There were no injuries reported in the other two incidents.	The chair's safety lock can fail, allowing the chair to collapse or fold unexpectedly. Children's fingers can become caught or entrapped in the hinge and slot areas of the chair, posing a pinch or cut hazard. This can cause severe lacerations and finger tip amputations to children's fingers.	null	null	About 1.1 million
CPSC	05234	Consumers should stop using the chairs immediately, and contact Fourstar for instructions on how to receive a free repair kit to replace the locking pin.	null	null	The recalled kid's folding chairs are made of metal tubing with a vinyl padded seat and seat back. They were sold in red, blue, yellow, green, pink, and lavender solid colors. They also come in pink with &quot;Princess&quot; printed in red on the seat and seat back along with stars, crowns and hearts, or in blue with pictures of basketballs, soccer balls, footballs, football helmets, and rollerblades. The recalled chairs were sold individually or as part of a set consisting of a table and two chairs. Each chair is about 22-inches high, 13.5-inches wide, and about 11.5-inches deep. &quot;MANUFACTURED BY FOURSTAR GROUP INC.&quot; OR &quot;IMPORTED BY FOURSTAR INTERNATIONAL TRADING COMPANY&quot; is written on a label located underneath the seat of the chairs.	null	null	China.	CPSC and Fourstar Group are aware of three incidents involving children. One resulted in a laceration to the finger and three finger fractures, the second incident resulted in a fracture and laceration to the fingers, and the third incident resulted in a pinched finger.	The chair's safety lock can fail, allowing the chair to collapse or fold unexpectedly. Children's fingers can become caught or entrapped in the hinge and slot areas of the chair, posing a pinch or cut hazard. This can cause severe lacerations and finger tip amputations to children's fingers.	null	null	About 522,000
CPSC	05230	Consumers should immediately take these recalled Walker Wagons away from young children and contact Radio Flyer for free replacement clickers.	null	null	The recalled wooden Walker Wagon has a push handle and removable wooden stake sides. It is 22-inches long, 12-inches wide and 16 &frac12;-inches high at the top of the handle. The Walker Wagon body is red and has the name “Radio Flyer” in white lettering on each side. The recalled Walker Wagons have black plastic clickers that make a clicking sound when the plastic wheels turn. The clickers are located between the rear wheels and the wagon. The Walker Wagon is intended for children 1 to 4 years old. The Walker Wagons with clear plastic clickers are not included in this recall.	null	null	China	Radio Flyer has received 11 reports of the tips breaking off the clickers on these Walker Wagons. No injuries have been reported.	The	Radio Flyer Inc. of Chicago, Ill.	null	About
CPSC	05231	Take these jackets away from young children immediately, and return the jacket to any H&amp;M store for a full refund.	null	null	These jackets are light blue denim with two breast pockets, a gray knit hood and gray knit sleeves. The buttons have “BABY” written on the front. A red and white “A” patch is sewn on the front, a blue “3” decal is on one sleeve and a red football is on the other sleeve. The recall included jackets sold in sizes 2 months through 18 months. Style number “432740” is written on the laundry care tag inside the jacket. “H&amp;M” is written on the collar label.	H&amp;M	null	China.	H&amp;M has received one report of the metal buttons detaching. No injuries have been reported.	The metal buttons can come loose and detach from these garments, posing a choking hazard to young children.	null	null	About
CPSC	05589	Fire Extinguisher Distributors and Service Organizations must immediately stop servicing all units covered under this Alert. Kidde has instituted a Fire Extinguisher Replacement Program (“Replacement Program”) for all units covered by this Alert. If you are a Fire Extinguisher Distributor or Service Organization and you have not already received a copy of the Replacement Program, as outlined in Service Bulletin 007, please contact the number below. Only professional Fire Extinguisher Distributors and Service Organizations should remove the affected units and the steps as outlined in the Replacement Program must be followed.	null	null	This Alert involves all Kidde 10 lb. dry chemical fire extinguishers manufactured with a black plastic Zytel&reg; nylon valve assembly and a steel cylinder between 1991 and 2000. These units were the subject of Kidde Service Bulletin 007 issued on July 21, 2004. These units were designed for commercial and industrial applications, and the majority of these units were placed into service in factories, plants, businesses and other commercial locations as they require service by a qualified Fire Extinguisher Distributor or Service Organization every 6 years. Some of these units are in use in residential settings. The affected extinguishers have a steel cylinder with a welded neck ring and are between 19 to 21 inches tall as depicted in the image below. This Alert does not apply to Kidde’s smaller 2 1/2 and 5 lb. residential fire extinguishers.	Walter Kidde Portable Equipment Inc., of Mebane, N.C.	null	United States.	Kidde has received five reports of valve separation during either technical service of the units or shortly afterwards, resulting in three reports of injuries.	The nylon valves on these extinguishers can separate from the steel cylinder during the 6-year recharge service or shortly afterwards creating a safety hazard to fire extinguisher service personnel and consumers.	null	null	About 470,000
CPSC	05229	Consumers should stop using the bicycle aero bars immediately and contact VisionTech USA, Inc. to have their aero bars tested. A free replacement will be provided for any bicycle aero bars found defective.&nbsp;	null	null	Aero bars are handlebar extensions typically used on racing and triathlon bicycles that either clip on to the handlebars or are sold as an integrated handlebar and stem system. The aero bars allow riders to ride in an aerodynamic crouching position. The recalled aero bars are an integrated system which have a casted aluminum centerpiece which are attached to a handlebar, a stem and two aero bars each approximately 15 inches long, protruding in front of the handlebar. The VisionTech logo is displayed in gold lettering against a black background on the wings of the bar.	VisionTech USA, Inc., of Auburn, Wash.	null	USA	VisionTech has received two reports of the centerpiece of these aero bars breaking, resulting in minor scrapes and abrasions.	The centerpiece of these bicycle aero bars can crack or break, causing the bicycle rider to lose control and crash.&nbsp;	null	null	About 280&nbsp;&nbsp;
CPSC	05227	Consumers should immediately stop using these torches and return them to any Wal-Mart store for a refund.	null	null	The recalled Tiki&reg; Cone Metal Torch is a 6-foot long, outdoor, open-flame lamp consisting of a black metal pole topped by a copper-colored, cone-shaped metal head. A black decorative rod spirals around the head of the torch. The torch head includes the fuel reservoir, cover and wick. It was sold under Lamplight Farms model numbers 1263 and 126301 and Wal-Mart item numbers 1656121 and 1691366. Both items were sold with the same UPC number 086861012635, which is located on the bottom of the printed hangtag.	Lamplight Farms Inc., a Division of W.C. Bradley Company, of Menomonee Falls, Wis.	null	China	Lamplight Farms has received one report that a torch head fell off the torch pole when bumped and spilled torch fuel. The spilled fuel was ignited by the burning wick, resulting in second and third degree burns to a consumer.	The head and cover of these torches can come loose or be dislodged during use, allowing torch fuel to spill. This poses a risk of burn injuries and property damage.	null	null	About 350,000
CPSC	05228	Consumers should take the toy trucks away from children and return them to the nearest Target store for a gift card in the amount of a full refund ($5.00, plus applicable state taxes).	null	null	The recall includes four-piece &quot;So Hot Way Cool Free Wheel&quot; Truck sets. Various trucks sold in the sets include a combination of fire trucks, oil trucks, vegetable trucks, sanitation trucks, tow trucks and box trucks. Writing on the trucks includes, &quot;EMERGENCY&quot; or &quot;CITY SERVICE.&quot; The words &quot;So Hot Way Cool Free Wheel Truck&quot; and the item number 204 02 0838 are written on the packaging.	null	null	China	None.	Small parts could break off the truck, posing a choking hazard to young children.	Target Corp., of Minneapolis, Minn.	null	About 17,400
CPSC	05226	Contact Sycamore Kids to find an authorized repair center to receive a free replacement handlebar ratchet.	null	null	The recalled strollers have a metal frame and a cloth seat with a sun canopy. The strollers were sold in a variety of solid colors, including navy, red, black, silver and orange. A metal plate above the footrest shows the Mountain Buggy logo with “Mountain Buggy” written underneath. “URBAN” also is written on the metal plates. The recalled Mountain Buggy Urban Single strollers have item number U1204-002, and serial numbers between 000000 and 0003342. The recalled Mountain Buggy Urban Double strollers have item number U2204-002, and serial numbers between 000000 and 006957. The serial number and model number are on the back of the metal plate.	null	null	New Zealand	Sycamore has received 10 reports of handlebar either cracking or breaking when the stroller was pulled up or taken down stairs. No injuries were reported.	The handlebar can crack or break causing the handlebar to possibly detach while in use, posing a risk of injury to young children.	null	null	About 2,200
CPSC	05225	Consumers should secure the blow dart gun and darts and return them to any Value City store for a full cash refund.	null	null	The blow dart gun is a 51-inch long decorative wooden tube with an attached pouch containing five darts. The brown, bamboo-shaped gun has a black, small barrel-like container attached to the top.	null	null	Indonesia	None.	Consumers may have mistakenly purchased the dart guns thinking it was a decorative walking stick, posing the risk of injury if someone used the gun for its intended purpose.	null	null	About 300
CPSC	05587	Consumers should immediately stop using the product and contact BJ Alan Co. for a replacement product.	null	null	The products are two hard balls that meant to produce a snapping or popping sound when hit together. Each package contains a pair of blaster balls that are about 1.25-inches in diameter and were sold in assorted colors. They were sold in a blister pack that measured about 6.75-inches by 5-inches, with a UPC number located on the pack of package reading 3826959035.	null	null	China	BJ Alan Co. has received reports of three incidents. One incident resulted in minor burns to fingers.	When the blaster balls are hit together, they can produce a spark that can catch on fire, posing a risk of burn injuries to consumers.	null	null	About 6,600
CPSC	05588	Consumers should immediately stop using the product and contact BJ Alan Co. for a replacement product.	null	null	The products are smoke-producing novelty devices packaged in a 4.5-inch long cylindrical tube. &quot;MAMMOTH SMOKE&quot; is written on the side of the devices in blue and yellow. They were sold in sets with other types of fireworks.	null	null	China	BJ Alan Co. has received two reports of incidents in which the product propelled on ground or exploded. One incident resulted in a minor burn to a consumer's foot.	The device can unexpectedly propel on the ground or unintentionally explode during use, posing a risk of burn injuries to consumers.	null	null	About 3,000
CPSC	05224	Consumers should keep this product out of the reach of children and return it to the store where it was purchased or contact NBTY for information on receiving a refund or replacement.	null	null	The Nature's Bounty and Natural Wealth brand multivitamins have lot number 60835-06 written on the label. The recalled vitamins were sold in containers of 100 caplets. The containers are both clear with white caps. They are labeled &quot;Nature's Bounty Multi-Day Multivitamin Plus Iron&quot; or &quot;Natural Wealth Daily Vitamin Plus Iron.&quot;	NBTY Inc., of Bohemia, N.Y.	null	United States	None reported.	The vitamins contain iron, but do not have child-resistant packaging as required by federal law. They could cause serious injury or death if ingested by a child.	null	null	About 12,000 bottles
CPSC	05586	Consumers can return the recalled safe-boxes to Perm-a-Store for a free repair or ship the safe-box directly to Perm-a-Store for free using a provided UPS account number.	null	null	These silver Inprint™ safe-boxes are about 8-inches long, 6-inches wide and 12.5-inches high and have &quot;INPRINT&quot; written on the top of the safe. They have serial numbers 04470001 through 04470500 printed on the inside back panel near the battery tray.	Perm-A-Store, of Golden Valley, Minn.	null	China	None reported.	The door on these safe-boxes may not latch properly when closed, possibly giving children and others unauthorized access to a firearm.	null	null	500
CPSC	05222	Parents should take these toys away from children immediately and contact Pok&eacute;mon USA to receive a free replacement toy.	null	null	The recall involves 10 “Pok&eacute;doll” plush toy characters including Pikachu, Minun, Plusle, Skitty, Evee, Munchlax, Mew, Ho-Oh, and Lugia. Pikachu comes in a 12-inch and a 6-inch tall version. All of the other characters are approximately 6-inches tall. They have a sewn-in label that reads: “Pok&eacute;mon Center &copy;2005 Pok&eacute;mon /Nintendo /Creatures/ GAME FREAK” on one side and “2005 MADE IN CHINA” on the other.	null	null	China	None reported.	The stuffing of the toy may contain tips of sewing needles which could pose a puncture hazard.	Pok&eacute;mon USA Inc. of New York, N.Y.	null	About
CPSC	05221	Consumers should stop using these strollers immediately and contact the firm to receive a free repair kit. The kit includes a custom-designed latch that consumers should attach to the stroller's frame to ensure it is properly latched. The repair kit will be available in approximately 1 to 2 weeks.	null	null	null	Graco Children's Products Inc., of Exton, Pa.	null	China	null	These strollers can fail to latch properly and unexpectedly collapse while in use. This can result in broken bones, cuts, bumps, bruises and other injuries to young children riding in the stroller and consumers pushing the stroller.	null	null	About 1 million Duo Tandem and about 143,000 MetroLite strollers
CPSC	05217	Contact your local bicycle retailer to have them inspect your wheels to determine if they are included in the recall. If so, the dealer will provide a free repair. Repair kits will be available in 6 to 8 weeks.	null	null	These 2003 Rolf Prima Vigor and Elan wheels were sold in a front and rear wheel set. Only the rear wheel is affected. &quot;Rolf Prima Vigor&quot; or &quot;Rolf Prima Elan&quot; are written on the wheel rim. The wheel models have serial numbers between 03926 and 06586. The serial number is located on the rim, under the yellow rim tape and is not visible from the outside of the wheel. The tire, tube and rim strip must be removed.	Rolf Prima Inc., of Eugene, Ore.	null	USA	No injuries reported.	The rear wheel freehub mechanism can malfunction causing no resistance when pedaling. The bicycle rider could lose balance, fall and suffer injuries.	null	null	About 870
CPSC	05218	Consumers should immediately stop using their lawn tractor, and contact Tecumseh for assistance in identifying affected units, and free repair if necessary.	null	null	These lawn tractors have a 6-speed MST206-545C Peerless transaxle and a 17.5, 18, 18.5 or 19 horsepower engine. The recalled tractor and transaxle model number information is located below the tractor seat (see Figure 1), and on the transaxle housing (see Figure 2). The recalled transaxles have a date of manufacture code (DOM) between 4275 and 5047 followed by the letter &quot;G&quot;, which can be found on the Transaxle ID Label (see Figure 3).	null	null	null	None reported.	The axles on these lawn tractors can crack and break if subject to extreme load amounts. Should the axle break, it could cause a loss of control and result in injuries to the rider.	null	null	About 21,000
CPSC	05219	null	null	null	null	null	null	null	null	null	null	null	null
CPSC	05585	Club Car will repair the accelerator pedal return assembly on these vehicles free of charge. Vehicle owners should immediately stop using any vehicle if they hear a grinding noise while depressing the accelerator pedal. Most vehicle owners have already been contacted by Club Car about this recall. Any owners not notified should contact their authorized Club Car dealer or call Club Car direct to schedule their free repair.	null	null	The Precedent and Precedent Champion golf cars are branded with the Precedent name on the steering wheel. The affected vehicles have serial number prefixes beginning with the two-letter combination CE, CF, PE, PF, PQ or PR. The serial number is located in the dash compartment on the passenger side of the car.	Club Car, Inc., of Augusta, Ga.	null	null	Club Car has received two reports of Precedent golf cars having difficulty braking due to accelerator pedals sticking. Minor injuries were reported in one incident.	The accelerator pedal can temporarily stick when depressed, resulting in unexpected acceleration or difficulty braking.	null	null	71,700 golf cars
CPSC	05214	Consumers should stop using these exercise benches immediately and contact Nautilus to receive a free repair kit.	null	null	The Nautilus NT 1020 is a free-standing exercise bench typically used for free weight workouts. It is comprised of a white steel base with wheels on one end, with a black vinyl bench and back support. The fronts of both the white base and the black vinyl back support are stamped with the name “Nautilus.” A tag affixed to the reverse side of the back support includes “Distributed by Nautilus/Schwinn Fitness Group Inc.” and “Made in China.” At the bottom of the product’s base, near its wheels, is a sticker that includes the words “Production Date Code” and a 4-digit number. The first three digits of the date code identify the day and the fourth digit identifies the year in which the unit was built. Units included in this recall have Production Date Codes from year 2002 that run between code numbers 1952 and 3652, and Production Date Codes from year 2003 that run between code numbers 0013 and 1903. Benches that are white in color and do not have a Production Date Code sticker also are included in this recall.	Daytona Fitness Co., of Xiamen, China	null	China	Nautilus has received four reports of the main pivot separating from the exercise bench’s main frame. No injuries have been reported.	A weld on the bench frame under the seat can crack and separate from the main frame, allowing the bench to collapse and the user to fall and suffer injuries.	Nautilus Inc., of Vancouver, Wash.	null	About 10,000
CPSC	05215	Consumers should stop using these candles and return them to the place of purchase for a full refund.	null	null	These recalled candles are wax-filled sea urchin shells, and were sold under item number 2659, which is found on the packaging tag. The candles are about 2.5-inches in diameter.	null	null	Philippines	There have been four reports of the candles catching fire, but no reports of property damage. No injuries have been reported.	The candles can burn at an excessive height or cause the outer shell to catch fire, posing a potential fire and burn hazard.	Two’s Company Inc., of Mount Vernon, N.Y.	null	About 18,000
CPSC	05216	Consumers should immediately stop using the 9-inch ATV wheels and contact HiPer Technology to receive a replacement wheel center section and or wheel repair, free of charge.	null	null	The recalled 9-inch ATV aftermarket rear wheels have a model number of 0990 YHR. The rear wheels were manufactured from February 15, 2005 through May 2005. The recalled wheel can be used as the rear wheel on ATVs having the following bolt patterns: four bolts on a 110mm circle or four bolts on a 115mm circle. The center section of the wheel is made of aluminum and has eight bolt holes.	HiPer Technology Inc., of Lawrence, Kan.	null	United States.	HiPer has 12 reports of wheel center section breakage and separation.	The aluminum center section of the wheel can come apart causing the tire and rim to unexpectedly separate from the ATV, posing a risk of serious injury if the rider loses control of the vehicle.	null	null	About 875
CPSC	05211	Consumers should immediately stop young children from using these toy chests and contact Pottery Barn Kids to determine if their toy chest lid support needs replacement. Pottery Barn Kids will provide consumers with a free lid support replacement kit.	null	null	This recall includes the Cameron toy chest in model numbers 4825378 (Honey), 6252852 (Espresso) and 4825386 (White). The product name and model number is located on a label affixed to the back of the toy chest. Inside the lid of the toy chest is a blackboard and an extra storage shelf. The toy chests are made of American hardwood frame with veneer panels and measure 40 x 18 x 20&quot; high.	Pottery Barn Kids of San Francisco, Calif.	null	China	No injuries or incidents have been reported.	A problem with the lid support on the toy chest could cause the lid not to stay open, posing the risk of an impact injury to a child's head, fingers or hands.	null	null	About 5,800
CPSC	05210	Consumers should stop using the recalled water scooter immediately and return it to the store where purchased for a full refund.	null	null	The Aqua Water Scooter is a hand-held, battery-powered product used to propel swimmers through the water. The product has either a yellow or red plastic enclosure, a black plastic handle and propeller and a shark face on the front.	null	null	China	CSK has received nine reports of the battery cover and/or the battery package being expelled from the water scooter, including three reports of facial injuries such as lacerations and bruising.	Hydrogen gas can build up in the battery compartment and cause the battery cover and the battery package to forcefully expel from the product, posing a risk of injury to the user or bystanders.&nbsp;&nbsp;	CSK Auto Inc., of Phoenix. Ariz.	null	About 2,200
CPSC	05584	Consumers should immediately stop young children from using these outdoor trunks and contact Pottery Barn Kids to determine if their trunk is included in the recall. Pottery Barn Kids will provide consumers with a replacement trunk or refund.	null	null	This recall involves all Chesapeake Outdoor Trunks. The model number (6512982) is printed on a sticker under the trunk. The trunks are made of tropical hardwood and measure 40 x 19 x 25&quot; high.	null	null	Indonesia	No injuries or incidents have been reported.	A problem with the lid support on the trunk could cause the lid not to stay open, posing the risk of an impact injury to a child's head, fingers or hands.	null	null	About 80
CPSC	05213	Consumers should contact Sears or LG to arrange for a free in-home repair.	null	null	The recalled refrigerators are three-door, 21 to 25 cubic foot units with a bottom freezer. The refrigerators come in titanium, stainless steel, bisque, white or black. Brand names are identified on the door at the top right of the units and the interior data plate. The units have the following model and serial numbers located on the data plate inside the fresh food section of the refrigerator door:	LG Electronics Inc., of Lincolnshire, Ill.	null	South Korea	LG Electronics has received 82 reports of incidents involving a condenser fan motor failure due to a failed capacitor arcing and smoking. There has been smoke damage in a few incidents. There have been no injuries.	null	null	null	About 20,000
