CPSC	recall_number	remedy	sold_to	name_of_product	description	manufacturer	sold_exclusively_at	manufactured_in	incidents_injuries	hazard	importer	consumer_contact	units
CPSC	05095	Consumers should keep this product out of reach of children and return the product to the nearest Long's retail store for a refund or replacement.	null	Long's Central-Vite Multivitamins	The recalled Central Vite multivitamins were sold in a value size container of 500 tablets. The plastic white pill bottle is labeled &quot;Advanced Formula Central Vite&reg; with Lycopene&quot; and &quot;Value Size.&quot;	Leiner Health Products, of Carson, Calif.	null	United States.	No injuries or incidents have been reported.	The vitamins, which contain iron that can cause serious injury or death if ingested by children, do not have child-resistant packaging as required by the Poison Prevention Packaging Act.	null	null	About 13,000
CPSC	05094	Consumers should immediately stop using these heaters, unplug, disable and discard them. The firm is out of business, and a remedy is no longer available.	null	Model 5101 oil-filled electric radiator heaters	The recalled heaters are portable electric radiator-style heaters with six fins, one of which has the control panel attached to it. The units are grayish-white in color and have the name &quot;Lakewood&quot; printed below the handle indentation on the control panel. The model number &quot;5101&quot; is printed on the UL label on the lower right side of the control panel.	Lakewood Engineering &amp; Mfg. Co., of Chicago, Ill.	null	United States.	Lakewood is aware of 28 reports of incidents, including one burn injury from spewing oil. An additional 14 heaters with ruptured welds have been returned to Lakewood.	Welds can rupture, expelling hot oil that can burn nearby consumers.	null	null	70,000
CPSC	05093	Consumers should immediately stop using the product and contact Fred Meyer to receive a store credit.	null	HD Designs, 5-piece Dining Set	The chairs and table are sold unassembled as part of a boxed 5-piece dining set. The words &quot;HD Designs 5 Piece Dining Set&quot; and item number BFR3917HO are written on the box. The chairs and dining table are honey oak wood and the seats have beige vinyl padding.	Commend Co. Ltd., of Fair Lawn, N.J.	null	Thailand	Commend has received one report of a chair breaking. In this report, there was a fall and minor injury.	The wooden chairs can break, posing a fall hazard to consumers.	null	null	About 600 sets
CPSC	05533	Consumers should stop using the recalled subwoofer, unplug it, and call Polk Audio's Customer Service department for instructions on obtaining a replacement subwoofer or a refund.	null	null	This recall includes Polk Audio model LSiW subwoofers with part numbers AM8080-A (Ebony enclosure) and AM8083-A (Cherry enclosure). Affected subwoofers have a serial number from AM808000100 to AM808000597 for the Ebony enclosure and AM808300100 to AM808300599 for the Cherry enclosure. The serial number can be found on the bottom, back edge of the subwoofer. The subwoofer measures 16 &frac34;-inches high by 16 7/8-inches wide by 19 3/8-inches deep, and weighs about 81 pounds.	null	null	null	Polk Audio has received six reports of smoke coming from these subwoofers. No injuries or property damage have been reported.	Electrical components in the subwoofer can overheat and fail, resulting in electrical arcing and smoke.	null	null	About 670
CPSC	05092	null	null	null	null	null	null	null	null	null	null	null	null
CPSC	05090	Consumers should immediately turn off the unit or unplug it. Consumers also should contact Research Products Corp. to receive a free repair kit containing the flame-retardant inner housing and filter.	null	null	The recall involves all Aprilaire Model 5000 Electronic Air Cleaners. The air cleaners are almond colored, and located near the heating and cooling equipment. An identification label on the access door reads &quot;Aprilaire Model 5000.&quot;	Research Products Corp., of Madison, Wis.	null	United States	Research Products has received six reports of fires involving these air cleaners. No injuries were reported.	The air cleaner's plastic inner housing and filter are not flame-resistant. If electrical arcing occurs in the cleaner, a fire can develop. This poses a risk of burn injuries and property damage.	null	null	About 67,000
CPSC	05091	Consumers can remove the decorative stitching or contact Pottery Barn Kids for information on how to receive a replacement or refund.	null	Chamois Blankets	This recall involves children's chamois blankets made of 100% polyester. The blankets were sold in yellow, pink, blue and green, and the reverse side of all the blankets are white. Decorative yarn in a coordinating color is stitched around the blanket's edge. The blanket measures 30-inches wide by 40-inches long and are labeled for stroller use. A label on the blanket reads &quot;pottery barn kids&quot; and &quot;Made in Korea.&quot;	Pottery Barn Kids, of San Francisco, Calif.	null	Korea.	Pottery Barn Kids has received four reports of incidents involving the decorative stitching coming loose. No injuries have been reported.	The decorative stitching on the blanket's edge can come loose, allowing a child to become entangled in the yarn. This poses a strangulation hazard to young children.	null	null	About 92,000
CPSC	05089	Consumers should immediately stop using the product and return it to the store where purchased or other stores where Carlton Cards are sold for a full refund.	null	Roasting Marshmallow Tealight Candle Holder	The candle holder is a Christmas decoration designed to hold a tealight candle. The candle holder includes three figures (penguin, moose, snowman) dressed in red and green sweaters, scarves and hats, roasting marshmallows on a stick over a small fire. Model numbers 4-01-427, 231279-4 and UPC code 90000 08741 are printed on the bottom of the candle holder.	null	null	China	None reported.	During normal use, the decorative marshmallows or decorative campfire flames may catch fire.	null	null	About 5,000
CPSC	05532	Consumers should stop using the recalled lamps immediately. Martha Stewart Living Omnimedia, Inc. is directly contacting all affected consumers to arrange for a full refund.	null	null	The recall involves Full Moon Lanterns sold by Martha Stewart Living Omnimedia, Inc. The lanterns were sold in the following three different Halloween themes: Bat (Model # XPM 012A), Flying Witch (Model # XPM 012B), and Jack O-Lantern (Model # XPM 012C).	null	null	null	Martha Stewart Living Omnimedia, Inc. has received 11 consumer complaints including reports of overheating, melting and fire. No injuries have been reported.	The lantern can overheat and melt or ignite, posing a burn hazard to consumers.	null	null	About 1,700 sets (2 lanterns per set)
CPSC	05088	Return the recalled Big Drum Musical Set to your nearest Toys &quot;R&quot; Us store for a refund.	null	Fun Years Music Big Drum Musical Set	The recalled music set includes a yellow and green drum with a clear plastic lid and a red one-piece carrying strap that doubles as a storage and carrying case for additional instruments. The drum measures 12 inches in diameter and about 7.5 inches in height. The instruments stored in the drum include: purple drumsticks, yellow and red dumb-bell-shaped maracas, purple wrist bells, an orange recorder, a yellow harmonica, a red-rimmed tambourine and a yellow whistle. Only this musical set is part of this recall. A similar drum set sold at Toys &quot;R&quot; Us with a two piece strap and different musical toys is manufactured by a different company and is not being recalled.	Kids Station Inc., of Miami, Fla., for Toys &quot;R&quot; Us, of Wayne, N.J.	null	China	None reported.	Small parts can break off during use, posing a choking hazard to young children.	null	null	About 10,500
CPSC	05530	Consumers should stop using the bicycle immediately and contact their local REI stores for a replacement seat at no cost to the consumer.	null	null	The recall involves Selle Royal/fi'zi:k [cp]	Selle Royal/fi'zi:k, of Pozzoleone, Italy.	null	null	Three reports of the seat breaking. One injury reported, causing the rider to sustain a mild concussion.	The plastic scuff guard underneath the front of the seat, which secures the seat rails, may crack or break causing the rider to lose control and/or fall, resulting in a serious injury.	null	null	About 257
CPSC	05531	Consumers should unplug the monitor and either use a different computer to go to the recall Web site or contact the HP L2035 Recall Helpdesk for instructions on how to determine if their monitor is affected by this recall program. If affected, consumers will receive instructions for getting their monitor tested and repaired or replaced at no cost.	null	null	The recall involves only the HP L2035 Flat Panel Monitor with serial numbers ranging from CNP352Y001 to CNP423Y1HS. The model number is displayed at the bottom, center of the monitor's bezel, just above the control buttons. The recalled monitors were produced from December 2003 through June 2, 2004.	Philips PC Peripherals, of Colorado Springs, Colo.	null	null	Philips has received one report of a consumer receiving an electrical shock from one of these monitors. The consumer was not injured.	A ground clip inside the back plastic panel of these monitors can be incorrectly installed, posing a risk of electrical shock to consumers.	null	null	About 15,000
CPSC	05085	Consumers should stop using the product immediately and contact Wal-Mart to receive a replacement slow cooker base.	null	GE Oval and Double Dish Slow Cookers	The recalled slow cookers include the 4.5-Quart Oval and 6-Quart Double Dish models sold under the General Electric (GE) brand name. The model name is printed on the front of the units. The 4.5-quart unit has model number 106661 and the 6-quart unit has model number 106851. Both models have series codes A through D, which are printed on the bottom along with the model number. The base of the slow cookers is white with an olive or honeysuckle graphic.	null	Wal-Mart stores nationwide from August 2000 through December 2002 for about $25 (4.5-quart model) and $35 (6-quart model).	null	Hamilton Beach and Wal-Mart have received 531 reports of handles breaking, including four reports of consumers who were burned by hot food.	The handles on the base of the slow cookers can break, posing a risk of burns from hot food spilling onto consumers.	Hamilton Beach/Proctor-Silex Inc., of Glen Allen, Va.	null	600,000
CPSC	05083	Consumers should stop using the chairs immediately and contact Poundex to receive a free rear leg replacement kit.	null	Residential Dining Chair	The recalled dining chair has a dark bronze metallic frame, birch colored wooden back and gold colored upholstered seat. The front and rear legs have a curved shape. The label under the seat reads in part &quot;Imported by Poundex Associates Corp.&quot; The recalled dining chair is approximately 42-inches high and 17-inches wide.	Poundex Associates Corp., of City of Industry, Calif.	null	China	Poundex Associates Corp. has received one report of a chair breaking, involving one report of a minor injury.	The welds on the chair's rear legs can crack and break apart, posing a fall hazard to consumers.	null	null	About 32,000
CPSC	05084	If the air intake shield is missing, consumers should stop using their vacuum and contact the firm for a free repair kit.	null	Ridgid&reg; 16-Gallon, Model WD16650 2-In-1 Blower Vac	The Ridgid&reg; 16-gallon 2-In-1 Blower Vac, Model WD16650, have light gray drums with orange lids, gray power heads, and black wheels. The recalled units have the model number and a serial number from 04104C through 04114C located on a label on the side of the power head. &quot;Ridgid&reg; 2 In 1 Blower Vac&quot; is written on the front of the units.	Emerson Tool Co., of St. Louis, Mo.	null	Canada	Emerson Tool Co. has received two reports of consumers who suffered lacerations to finger tips while using these vacuums.	The air intake shield may be missing. Consumers can suffer lacerations if they come into contact with the intake blower wheel.	null	null	About 6,500
CPSC	05527	Consumers should stop using the transceivers immediately and contact Climb High for a free replacement.	null	null	The recalled Barryvoxes are 2004/2005 model Opto 3000 Avalanche Transceivers. The words, &quot;Mammut&quot; and &quot;Barryvox&quot; are printed on the front of the red and black transceivers. The serial numbers on the recalled units, which can be found in the battery compartment under the UPC code, include: M0080000 through M0088419, M0089616 through M0089800 and M0090000 through M0090419. The recalled units were shipped with an instructional CD and the box marked &quot;Bonus CD Included.&quot;	Ascom Systec AG, Eichtal, of Switzerland	null	null	None Reported.	The transceivers' plastic casing could crack, causing a malfunction if water were to enter the unit. If the transceiver fails to function properly in the aftermath of an avalanche, it could result in the buried victim not being found in time to avoid serious injury or death.	null	null	About 137
CPSC	05528	Owners who have not already been contacted by Club Car should contact the dealer from whom they purchased their vehicle, or call Club Car toll free to have the equalizer rod repaired free of charge.	null	null	The recalled vehicles are used for short distance transportation around golf courses, hotels, resorts, airports, and residential communities. Vehicles subject to this recall can be identified by the serial number located above and to the right of the accelerator pedal. The names and serial numbers of the primary affected models are listed below. The recalled vehicles were sold between April 6, 2004 and October 1, 2004.	Club Car Inc., of Augusta, Ga.	null	null	Club Car has received one report of one vehicle losing braking ability. No accidents, injuries, or damage have been reported.	Microscopic cracks, in the brake equalizer rods on certain vehicles may cause the rods to fatigue and fail prematurely in continuous use. Such failure could result in a loss of braking ability.	null	null	19,663
CPSC	05529	The retailer has a record of all product purchasers. The product purchasers will be contacted directly, provided with replacement light bulbs, and instructed to discard the originally supplied bulbs.	null	null	The recalled 40 Watt &quot;Type R&quot; incandescent mini spot-light bulbs were included in two- and three-lamp accent lights in certain furniture hutch items manufactured by Sauder Woodworking Co. The furniture hutch models involved are:	Comtrad, Division of Waljon Ltd., Mississauga, Ontario, Canada.	null	null	There have been 12 reports of bulb failures. No injuries have been reported.	null	null	null	About 22,600
CPSC	05087	Consumers should stop using the bindings and return them a Flow dealer to receive a free replacement axle pin used to secure the rear snaplock lever. Consumers also can contact Flow International to have a repair kit with instructions sent by mail.	null	2004 Flow MK Series Snowboard Bindings	This recall includes 2004 Flow MK series snowboard bindings with model numbers MK03, MK04, MK05 and MK110. The bindings affected by this recall can be identified by the shape of the rear lock lever and the cable adjustment wheel on the side of the baseplate (as shown in the photos below). No other bindings are included in this recall.	null	null	China	Flow International has received 40 reports of the pins bending or breaking. No injuries have been reported.	The pin used to secure the rear snaplock lever to the bindings can bend or break.	Flow International Inc., of San Francisco, Calif.	null	About 6,000
CPSC	05081	Consumers should stop using the backpack sprayers immediately and contact SHURflo to receive a free repair kit.	null	ProPack Rechargeable Electric Backpack Sprayers	The recalled SHURflo ProPack Model SRS-540 rechargeable electric backpack sprayers have manufacture dates before September 2004. The model number and manufacture date are printed on a label affixed to the motor bracket, which can found by removing the battery pack. The sprayers have a clear or black hose, aluminum spray lance, and a white body. The words &quot;SHURflo&quot; and &quot;Pro Pack&quot; are printed on a label on the front of the unit.	SHURflo LLC, of Cypress, Calif.	null	United States.	The firm has received three reports of power plug failures and one report of a minor fire. No injuries have been reported.	The power plug can corrode after extensive exposure to water and corrosive chemicals, posing a fire hazard to consumers.	null	null	About 6,100
CPSC	05082	Consumers should immediately take these bracelets away from young children and contact the company to receive a refund.	null	Metallic costume bracelets	The recalled bracelets have heart, oval, and rectangular shaped charms that have the phrases; &quot;I like sports,&quot; &quot;I like movies,&quot; &quot;I like shopping&quot; and &quot;I like music&quot; printed on them. The bracelet also contains various colored plastic trinkets.	Riviera Trading Inc., of New York, N.Y.	null	China	None reported.	The bracelets contain high levels of lead and pose a lead poisoning hazard to children.	null	null	About 7,100
CPSC	05080	Consumers should immediately stop using the product and contact their local bicycle dealer to arrange for an inspection and to receive a no charge repair kit to be installed for free.	null	Adams Trail-a-Bike or Adams Slipstream Bicycle Attachment	The recall involves the Adams Trail-A-Bike or Adams Slipstream sold under the following models: Starter, Folder, Shifter, Shocker, Ultimate Tandem, Deluxe Folder, Me 2 and Original. &quot;Trail-A-Bike&quot; or &quot;Slipstream&quot; is printed on the top tube of the bicycle attachment and &quot;Adams&quot; is printed on the chain guard. The product resembles a children's bicycle without a front wheel and has an elongated top tube that stretches to attach to the seat post of an adult bicycle, creating a tandem. The product was sold for use by children ages 4 to 7.	null	null	China	Norco Products has received two reports of hardware falling out of the hitch assembly. One minor injury reported.	The hardware used in the assembly of the universal hitch may come loose causing the unit to separate from the lead bicycle, which could lead to a serious injury or death to the rider of the bicycle attachment.	Norco Products Ltd., of British Columbia, Canada	null	About 80,000
CPSC	05079	If you own the Amber model crib, contact the firm to schedule an in-home repair or request a replacement crib. For all other model cribs, contact the firm to receive new assembly instructions and warning labels.	null	Cribs	The cribs included in this recall are the Daniella, Leeat, Noa, Naomi, Gabriella, Amber and Series 300 model cribs. The cribs are wood and come in a variety of painted and stained finishes including natural, cherry, blonde, or white wood. Some of the cribs have built-in storage drawers on the side of the crib or underneath the crib. The crib model name may be printed on the lower part of the headboard of each crib and the manufacturer name is printed on each set of crib warnings when provided.	Orbelle Trade Inc., of Brooklyn, N.Y.	null	Romania	None reported.	The Amber model crib included in this recall does not comply with crib safety standards due to a gap between the side rail and the crib mattress support, posing an entrapment hazard to infants. All other model cribs included in this recall do not have proper assembly instructions and diagrams required for cribs. They are also missing cautionary and warning labels as required by federal law. If the cribs are not assembled properly they could pose an entrapment hazard to infants.	null	null	About 7,700
CPSC	05078	Consumers should immediately stop using the product and contact Dirt Devil&reg; to receive a free replacement.	null	Dirt Devil&reg; Sweeper Vac™	The Dirt Devil&reg; Sweeper Vac™ is a battery operated upright vacuum cleaner with &quot;Dirt Devil&reg;&quot; and &quot;Sweeper Vac™&quot; printed on the front. The recall involves vacuum cleaners with the Model Number M083000 with the Plant Code J. The Model Number and Plant Code are printed on a silver plate located on the back of the product. Only vacuum cleaners manufactured in Plant Code J are included in this recall.	Royal Appliance, of Glenwillow, Ohio.	null	China	None reported.	The vacuum's rotor can lock and overheat during use causing a smoke and fire hazard.	null	null	About 20,000
CPSC	05077	Consumers should stop using these swings and contact the firm to determine if their swing is involved in the recall. If it is, the firm will provide a free repair.	null	Toddler Swings	The recall includes toddler swings with model numbers 7336KR, 733604 and 733600. The model numbers are located on a label on the back of the swings. The swings are made from green plastic and the red Step 2 logo is located on the front of the swing. The straps on the recalled swings are grey and blue colored.	The Step 2 Co., of Streetsboro, Ohio	null	United States	None reported.	The straps on these swings could break, causing a child riding in the swing to fall to the ground and suffer injuries.	null	null	About 9,300
CPSC	05076	Consumers should immediately take the recalled toys away from young children. Consumers should call the firm to get information on returning the toys to the importer for a refund and postage reimbursement.	null	Push Along Frog, Animal Organ, and Rock &amp; Roll Kids Guitar Toys	The recall includes three toys: Push Along Frogs, Animal Organs, and Rock &amp; Roll Kids Guitars. The Push Along Frog toy has a 9.5- inch green plastic frog attached to a 15-inch, red plastic handle. A sticker on the front of the toy reads &quot;Push Along Forg&quot; (sic). The electronic Animal Organ comes in four different styles, all about 11- inches long. The style number, written on the back of the toy begins with &quot;666.&quot; The electronic guitars are about 14-inches long and have various colored buttons. &quot;ROCK &amp; ROLL KIDS&quot; is written on stickers on the front. &quot;MADE IN CHINA&quot; is written on all three toys.	null	null	China	None reported.	The toys can easily break apart, exposing small parts. This poses a choking hazard to young children.	AA Importer Inc., of Los Angeles, Calif.	null	About 5,200
CPSC	05073	Free repair or replacement if necessary. If you smell gas near the appliance or in the building, immediately leave the area and call your gas company or a certified gas technician to investigate the cause. If you do not smell gas, check the pilot lights on your gas appliances. If any pilot lights are out, do not attempt to relight. Have the appliance examined by a qualified technician. Have the date-code of your 7000 gas valve ready when you contact Robertshaw.	null	Robertshaw 7000 Series Gas Control Valve	The 7000 Series Gas Valves that are being recalled are installed in gas appliances including residential space heaters, wall heaters, boilers, fireplaces, pool heaters, infrared heaters and furnaces, and commercial heating applications such as commercial cooking appliances, fryers, commercial water heaters, and poultry brooders. The recalled valves were manufactured between February 2003 and September 2004 and have production dates beginning with code 0306 and ending with 0436.	Robertshaw Controls Company of Long Beach, Calif.	null	Assembled in Mexico.	The firm has received three reports of flash fires, involving three reports of injuries. The injuries involved first and second degree burns.	Fire hazard. If the pilot light goes out, the gas valve could stick in an open position, permitting gas to continue to flow. This can result in a gas explosion and fire, which could result in severe personal injury or property damage.	null	null	About 425,000 gas control valves
CPSC	05074	Consumers should stop using these air pistols immediately and contact the company to receive a free inspection and repair or replacement unit.	null	Walther CP Sport, CP99, and Nighthawk CO	The recalled air pistols include the Walther models CP Sport, CP99, and Nighthawk manufactured throughout 2003. The recalled models have a serial number of &quot;J3,&quot; which is located on the right side of the air pistol. The Walther CP Sport and CP99 CO	Umarex, of Arnsburg, Germany	null	Germany.	None reported.	The air pistols' safety might move from the engaged or &quot;safe&quot; position to the disengaged or &quot;fire&quot; position when the trigger is pulled once or more and then released. This poses a risk of serious injury if the air pistol is loaded and unintentionally fired.	null	null	About 24,000
CPSC	05526	Consumers should contact their system installer or service provider to arrange for a free repair or replacement to make the smoke detectors and control panel systems compatible.	null	Smoke Detector Systems	The recalled smoke detection systems involve hard-wired S10A ESL smoke detectors that are incompatible with certain ITI control panels as well as certain S09A/S10A listed ESL smoke detectors that may be incompatible with control panels from other manufacturers. Model numbers are printed on the back of the smoke detectors. Inside the ITI control panel is a label that lists the name and model number of the unit. The following model names and model numbers of ITI control panels are incompatible when installed with the following model numbers of ESL smoke detectors:	GE Security Inc., of Austin, Texas.	null	United States.	None reported.	The smoke alarms can fail to activate during a fire or emergency, if installed in combination with certain control panels.	null	null	Approximately 246,800 smoke detectors
