FDA	4592be17bd	2012-05-24	http://www.fda.gov/Safety/Recalls/ucm305509.htm	This is to inform you of a product recall involving: All Sterile Human and Veterinary Prescriptions Distributed by Franck’s Pharmacy From November 21, 2011 to May 21, 2012. This recall is being initiated after the U.S. Food and Drug Administration ("FDA") notified us that environmental sampling of our clean room revealed the presence of microorganisms and fungal growth.	Urgent: Compounded Prescription Recall
FDA	79aa9aa289	2012-05-23	http://www.fda.gov/Safety/Recalls/ucm305254.htm	Harris Teeter is recalling HT Traders Sorbet in the following flavors: Lemon, Raspberry, Mango, Coconut and Orange, due to possible undeclared milk protein. This recall affects the below products:	Harris Teeter is Recalling 5 Flavors of Sorbet Due to Possible Undeclared Milk Allergen
FDA	8893f8acd8	2012-05-23	http://www.fda.gov/Safety/Recalls/ucm305247.htm	Indonesianfoodmart.com of Rockville, MD, is recalling all packages of "Tempeh Starter Yeast" because they have the potential to be contaminated with Salmonella, an organism which can cause serious and sometimes fatal infections in young children, frail or elderly people, and others with weakened immune systems. Healthy persons infected with Salmonella often experience fever, diarrhea (which may be bloody), nausea, vomiting and abdominal pain. In rare circumstances, infection with Salmonella can result in the organism getting into the bloodstream and producing more severe illnesses such as arterial infections (i.e., infected aneurysms), endocarditis and arthritis.	IndonesianFoodMart.com Recalls "Tempeh Starter Yeast" because of Health Risk of Salmonell
FDA	a00664b961	2012-05-23	http://www.fda.gov/Safety/Recalls/ucm305398.htm	Honeyville Honey Farm of Durango, CO is voluntarily recalling bottles of Honeyville Honey Barbecue Suace manufactured after August 1, 2011 because they contain undeclared anchovies in the Worcestershire sauce used in production. People who have allergies to anchovies run the risk of serious or life threatening allergic reaction if they consume these products.	Honeyville Honey Farm Issues Allergy Alert on Undeclared Anchovy in Honeyville Honey Barbecue Sauce
FDA	2882abc116	2012-05-22	http://www.fda.gov/Safety/Recalls/ucm305123.htm	Pacific Coast Fruit Company, Portland, Oregon is voluntarily recalling multiple types of bagged processed salads based on the potential contamination of Listeria monocytogenes, an organism which can cause serious and sometimes fatal infections in young children, frail or elderly people, and others with weakened immune systems. Although healthy individuals may suffer only short-term symptoms such as high fever, severe headache, stiffness, nausea, abdominal pain and diarrhea, Listeria infection can cause miscarriages and stillbirths among pregnant women.	Pacific Coast Fruit Company Recalls Single Side Serving Processed Salads for Potential Listeria monocytogenes Contamination
FDA	b311fb1198	2012-05-22	http://www.fda.gov/Safety/Recalls/ucm305203.htm	Taylor Farms Retail, Inc. is initiating a voluntary recall of Organic Baby Spinach with the potential to be contaminated with Salmonella following a random test conducted on a finished package of spinach by USDA.	Salinas Firm Initiates A Voluntary Recall Because Of Possible Health Risk
FDA	e44767454c	2012-05-21	http://www.fda.gov/Safety/Recalls/ucm304917.htm	Diamond Pet Foods is expanding a voluntary recall to include its Diamond Naturals Small Breed Adult Dog Lamb & Rice Formula dry dog food manufactured on Aug. 26, 2011 due to potential exposure to Salmonella. No illnesses have been reported.	Diamond Pet Foods Expands Voluntary Recall Diamond Naturals Small Breed Adult Dog Lamb & Rice Formula Dry Dog Food Production Code DSL 0801 Due to Small Potential for Salmonella Contamination
FDA	a66f1431db	2012-05-20	http://www.fda.gov/Safety/Recalls/ucm304732.htm	Gills Onions, LLC of Oxnard, CA is initiating a voluntary recall, 2,360 pounds, of diced red onions with lot code 51RDA1A2119 and use-by-dates May 14, 15 and 17, 2012 because it may be contaminated by Listeria monocytogenes. The product is beyond its use-by-date, no illnesses have been reported in connection with this recall, and no other Gills Onions product is affected by this recall.	Gills Onions Voluntarily Recalls One Lot of Diced Red Onions Because of Possible Health Risk
FDA	5578c52191	2012-05-20	http://www.fda.gov/Safety/Recalls/ucm304741.htm	River Ranch Fresh Foods, LLC of Salinas, CA is expanding its voluntary recall of retail and foodservice bagged salads, because they have the potential of being contaminated with Listeria monocytogenes.	River Ranch Expands Salad Recall Because Of Possible Health Risk
FDA	060fd26f71	2012-05-19	http://www.fda.gov/Safety/Recalls/ucm304719.htm	WEST COAST NUTRITIONALS, LTD is conducting a voluntary recalling all lots of FIRMINITE, EXTRA STRENGTH INSTANT HOT ROD, AND LIBIDRON capsules to the consumer level. An FDA lab analysis of FIRMINITE distributed by West Coast Nutritionals was found to contain undeclared Tadalafil.	WEST COAST NUTRITIONALS, LTD. Issues a Voluntary Worldwide/Nationwide Drug Recall of Products FIRMINITE, EXTRA STRENGTH INSTANT HOT ROD, AND LIBIDRON due to Undeclared Tadalafil
FDA	6166764c6c	2012-05-19	http://www.fda.gov/Safety/Recalls/ucm304718.htm	River Ranch Fresh Foods, LLC of Salinas, CA is initiating a voluntary recall of retail and foodservice bagged salads,because they have the potential of being contaminated with Listeria monocytogenes following routine random retail salad finished product tests conducted in the marketplace by the Food & Drug Administration.	River Ranch Recalls Retail And Food Service Salads Because Of Possible Health Risk
FDA	6cf941f1e2	2012-05-19	http://www.fda.gov/Safety/Recalls/ucm304717.htm	Santos Agency, Inc. has initiated a recall of Santos Brand products i.e. various kinds of flours, legumes and spices because they may contain undeclared peanuts and wheat.	Santos Agency, Inc. voluntarily recalls Santos Brands Products for undeclared peanuts and wheat in California
FDA	4c6de7aabb	2012-05-19	http://www.fda.gov/Safety/Recalls/ucm304726.htm	Caribe Produce LTD Co. of McAllen, TX, is recalling 286 cases of Papaya Maradol, Caribeña Brand papayas packed in 35 lb. cartons marked with the brand “ Caribeña “ and “ Product of Mexico” stamped on the side. The papayas are sold individually, and each one bears a label which states “3112 CARIBENA Papaya MARADOL PRODUCT OF MEXICO	Caribe Produce, LTD CO. Recalls Papaya Maradol, Caribena Brand Because Of Possible Health Risk
FDA	d174a65b26	2012-05-17	http://www.fda.gov/Safety/Recalls/ucm304373.htm	Bakery El Monte Sinai Corp., located at 100 A North Franklin Street in Hempstead, New York 11550, is recalling rainbow cake because it may contain undeclared eggs.	Bakery El Monte Sinai Corp Announces Allergy Alert on Undeclared Eggs in Rainbow Cake
FDA	d174a65b26	2012-05-17	http://www.fda.gov/Safety/Recalls/ucm304373.htm	Bakery El Monte Sinai Corp., located at 100 A North Franklin Street in Hempstead, New York 11550, is recalling rainbow cake because it may contain undeclared eggs.	Bakery El Monte Sinai Corp Announces Allergy Alert on Undeclared Eggs in Rainbow Cake
FDA	07c2107004	2012-05-15	http://www.fda.gov/Safety/Recalls/ucm304087.htm	December 14, 2011 - Cargill Animal Nutrition today announced a voluntary recall of select regional poultry, calf, and whole and cracked corn products due to aflatoxin levels that were detected above the acceptable limit. The affected animal feed products were manufactured at Cargill’s Lecompte, Louisiana, facility between Sept. 6, 2011, and Dec. 1, 2011.	Cargill Animal Nutrition Conducts Regional Recall of Select Animal Feed Products
FDA	467d64651e	2012-05-12	http://www.fda.gov/Safety/Recalls/ucm303937.htm	NestlÃ© Purina PetCare (NPP) is voluntarily recalling one specific lot of its Purina Veterinary DietsÂ® OM Overweight Management canned cat food, available through veterinarians in the U.S. and Canada. This precautionary measure is being taken in response to one consumer complaint received by FDA.	NestlÃ© Purina Voluntarily Recalls Single Lot of Therapeutic Canned Cat Food Due to A Low Level of Thiamine (Vitamin B1)
FDA	396ca8dff2	2012-05-12	http://www.fda.gov/Safety/Recalls/ucm303932.htm	Whole Foods Market is recalling its variety cupcake six-packs sold in stores in Northern California because some of the products contain undeclared walnuts. One illness has been reported to date, and people who have allergies to walnuts run the risk of serious or life-threatening allergic reaction if they consume these products.	Whole Foods Market recalls carrot cake cupcakes for undeclared walnuts in Northern California
FDA	15904325d7	2012-05-12	http://www.fda.gov/Safety/Recalls/ucm303942.htm	Hospira, Inc. (NYSE: HSP), announced today it is initiating a voluntary user level recall of one lot of Hydromorphone Injection, USP, 1 mg/mL (C-II), 1 mL fill in 2.5 mL Carpuject, NDC 0409-1283-31, due to two reported complaints of a single Carpuject containing more than the 1 mL labeled fill volume. Opioid pain medications such as Hydromorphone have life-threatening consequences if overdosed.	Hospira Announces A Nationwide Voluntary Recall Of One Lot Of Hydromorphone Hydrochloride Injection 1 MG/ML, (C-II) 1 ML Fill In 2.5 ML Carpuject, That May Contain More Than The Intended Fill Volume
FDA	a8ba93e3ee	2012-05-11	http://www.fda.gov/Safety/Recalls/ucm303786.htm	Jonlly Fruits Inc. de Bayamon PR, hace un llamado al cosumidor de sus productos Jonlly Fruit Y Natural Tropic; China, Acerola, Uva, Parcha, Frutas, Limón, Toronja, Guanabana, Guava Piña, China Light, Mandarina, China Zanahoria. Porque prodria contener un tipo de alergeno no declarado en la etiqueta, específicamente; Partilly Hydrogenated Coconut oil, Corn Syrup Solids, Sodium Caseinate (a Milk Derivative), Xanthan Gum, Mono-And Diglycerides, Dipotassium Phosphate, Contains 2% or less of Sodium Silicoaluminate and Soy Lecithin.	Jonlly Fruits Inc. Alerta De Alergia Por No Decrarar Alergenos En El Producto
FDA	12055ac70a	2012-05-11	http://www.fda.gov/Safety/Recalls/ucm303832.htm	Jonlly Fruits Inc., Bayamón, PR, is alerting consumers about their brands Jonlly Fruit and Natural Tropic: China (Orange), Acerola (Wild Cherry), Uva (Grape), Parcha (Passion Fruit), Fruta (Fruit Punch), Limón (Lemon), Toronja (Grapefruit), Guava-Piña (Guava-Pineapple), Guanábana (Soursop), China Light (Orange Light), Mandarin (Mandarina), and China-Zanahoria (Orange-Carrot) because it may contain undeclared sodium caseinate (a milk derivative). People who are allergic or are severely sensitive to milk run the risk of a serious or a life-threatening allergic reaction if they consume these products.	Jonlly Fruits Inc. Issues Allergy Alert On Undeclared Allergens In Several Products
FDA	38a0442e0c	2012-05-09	http://www.fda.gov/Safety/Recalls/ucm303465.htm	Moon Fishery (India) Pvt. Ltd., the Manufacturer of the Yellow Fin Tuna Nakaochi Scrape that was recently recalled by a U.S. Distributor, is also recalling its 22 pound cases of "Tuna Strips" Product of India AA or AAA GRADE because they have the potential to be contaminated with Salmonella, an organism which can cause serious and sometimes fatal infections in young children, frail or elderly people, and others with weakened immune systems. Healthy persons infected with Salmonella often experience fever, diarrhea, nausea, vomiting and abdominal pain.	Moon Fishery (India) Pvt. Ltd. Recalls Its "Tuna Strips" Product Of India "AA" Or "AAA" Grade Because Of Possible Health Risk
FDA	c6d4ae9e9b	2012-05-08	http://www.fda.gov/Safety/Recalls/ucm303305.htm	Cleveland Beansprouts Co. of Cleveland, OH is recalling all alfalfa sprouts because they may be contaminated with Listeria monocytogenes, an organism which can cause serious and sometimes fatal infections to individuals with weakened immune systems. Although healthy individuals may suffer only short term symptoms such as high fever, severe headache, stiffness, nausea, abdominal pain and diarrhea, Listeria infection can cause miscarriages and stillbirths among pregnant women.	Cleveland Beansprouts Co. of Cleveland, OH is recalling all alfalfa sprouts because they may be contaminated with Listeria monocytogenes
FDA	4b669efa8e	2012-05-08	http://www.fda.gov/Safety/Recalls/ucm303371.htm	Solid Gold Health Products for Pets, Inc., El Cajon, California, announced a voluntary recall of one batch of WolfCub Large Breed Puppy Food and one batch of Solid Gold WolfKing Large Breed Adult Dog, both with a Best Before date of December 30, 2012, and an "X" in the 11th digit of the date code.	Solid Gold Health Products for Pets, Inc. Recalls Dog Food Because of Possible Salmonella Health Risk
FDA	38881b8672	2012-05-07	http://www.fda.gov/Safety/Recalls/ucm303039.htm	WellPet LLC announced a voluntary recall of one recipe of Wellness' dry dog food after being notified by Diamond Pet Foods regarding the presence of Salmonella in Diamond’s Gaston, South Carolina facility. All Wellness products are tested for Salmonella and all lots tested negative prior to shipping to customers.	Wellpet LLC Voluntarily Recalls One Recipe Of Dry Dog Food Due To Salmonella At Diamond Pet Foods' Facility
FDA	c70207272e	2012-05-07	http://www.fda.gov/Safety/Recalls/ucm303034.htm	Diamond Pet Foods today announced that it is expanding a voluntary recall to include batches of nine brands of dry pet food formulas manufactured between December 9, 2011 and April 7, 2012 due to potential Salmonella contamination. In April 2012, Diamond Pet Foods initiated three voluntary recalls of Diamond manufactured dry dog food.	UPDATED: CORRECT PRODUCTION CODE INFORMATION Diamond Pet Foods Expands Voluntary Recall of Dry Pet Food Due to Potential Salmonella Contamination
FDA	9f12965bfc	2012-05-07	http://www.fda.gov/Safety/Recalls/ucm303042.htm	Natural Balance Pet Foods announced today that it is issuing a voluntary recall of certain dry pet food formulas manufactured by Diamond Pet Foods at their Gaston, South Carolina facility. Although there have been no animal illnesses reported and none of the products included in the recall has tested positive for Salmonella, the company has voluntarily initiated this recall as a precautionary measure.	Natural Balance Pet Foods Initiates Voluntary Recall of Certain Dry Pet Food Due to the Potential for Salmonella Contamination
FDA	4b37ae2928	2012-05-07	http://www.fda.gov/Safety/Recalls/ucm303061.htm	Apex Pet Foods announced today that it is issuing a voluntary recall of all dry dog food formulas manufactured on January 24, 2012. Although there have been no animal or human illnesses related to Apex Dog Food and the product has not tested positive for Salmonella, the company has voluntarily initiated this recall out of caution to ensure the health and safety of consumers and their pets.	Apex Pet Foods Initiates Voluntary Recall of Dry Pet Food Due to the Potential for Salmonella No Pet or Human Illnesses have been Reported Associated With Apex Dog Food
FDA	f184b485a5	2012-05-05	http://www.fda.gov/Safety/Recalls/ucm303012.htm	FunFresh Foods, Inc. of San Clemente, California in consultation with the FDA is voluntarily recalling a single lot of its 6 ounce packages of FunFresh Foods™ World Berries™ Organic “Cacao Nibs” because they may be contaminated with Escherichia coli O157:H7 bacteria (E. Coli O157:H7).  E. coli O157:H7 causes a diarrheal illness often with bloody stools.	Funfresh Foods, Inc. Voluntarily Recalls World Berries™ Organic “Cacao Nibs” Because of Possible Health Risk
FDA	4b64898a12	2012-05-04	http://www.fda.gov/Safety/Recalls/ucm302903.htm	H-E-B has issued a voluntary and precautionary recall for certain Asian Ready-to-Eat meals due to the possibility of undercooked chicken in those meals. There have been no confirmed illnesses reported related to this precautionary recall.	H-E-B Issues a Precautionary Recall For Asian Ready-to-Eat Meals due to Possible Health Risk
FDA	ad6bfb5601	2012-05-04	http://www.fda.gov/Safety/Recalls/ucm302896.htm	Figi's Inc, Marshfield, WI is recalling 51 units of the product Lemon Bar Bliss (1#tins), because it contains undeclared Almonds.	FIGI’S INC. Issues Allergy Alert On Undeclared Almonds In Lemon Bar Bliss
FDA	6b06be1b1a	2012-05-03	http://www.fda.gov/Safety/Recalls/ucm302899.htm	Franck’s lab recently had a fungal issue with one lot of triamcinolone acetonide P.F. 80mg/ml and on March 29, 2011 instituted a recall. The recall involved five physicians and eight prescriptions.	Notice of Recall - Triamcinolone acetonide P.F. 80mg/ml
FDA	7e2427ec38	2012-05-02	http://www.fda.gov/Safety/Recalls/ucm302694.htm	HenryÃ¢â‚¬â„¢s Farm Inc. is expanding the recall of its Soybean Sprouts, to include Natto Soybean Sprouts, because they may be contaminated with Listeria monocytogenes, an organism which can cause serious and sometimes fatal infections to individuals with weakened immune systems. Although healthy individuals may suffer only short term symptoms such as high fever, severe headache, stiffness, nausea, abdominal pain and diarrhea, Listeria infection can cause miscarriages and stillbirths among pregnant women.	Henry's Farm Inc. Expands Recall Of Soybean Sprouts Due To Possible Health Risk
FDA	0c56fcf3f6	2012-05-01	http://www.fda.gov/Safety/Recalls/ucm302514.htm	Diamond Pet Foods is expanding a voluntary recall to include Diamond Puppy Formula dry dog food. The company took this precautionary measure because sampling revealed Salmonella in the product.	Diamond Pet Foods Expands Voluntary Recall to Include Diamond Puppy Formula due to Possible Salmonella Contamination
FDA	1561199e91	2012-05-01	http://www.fda.gov/Safety/Recalls/ucm302546.htm	Kaytee Pet Products is recalling a single manufacturing batch of Kaytee Forti-Diet Pro Health Mouse, Rat and Hamster due to possible contamination with Salmonella. The product affected by this recall is identified below and has the following “Best Before” dates	Kaytee Recalls Forti-Diet Pro Health Mouse, Rat and Hamster Because of Possible Salmonella Health Risk
FDA	5f94fa374f	2012-05-01	http://www.fda.gov/Safety/Recalls/ucm302591.htm	Smiling Hara of Asheville is voluntarily recalling 12-ounce packages of unpasteurized soybean tempeh because of possible contamination with salmonella. The company is recalling tempeh manufactured this year between Jan. 11 and April 11.	Asheville Company Recalls Tempeh After Tests Detect Presence Of Salmonella
FDA	c1f6089bc6	2012-05-01	http://www.fda.gov/Safety/Recalls/ucm302588.htm	Chad Oliphant, of Smiling Hara Tempeh has announced that the company was initiating a voluntary recall of all Smiling Hara products out of an abundance of caution. The products in question were manufactured between January 11, and April 11, 2012.	Smiling Hara Recalls Tempeh because of Possible Health Risk
FDA	ef9b29ca84	2012-04-27	http://www.fda.gov/Safety/Recalls/ucm302101.htm	Feed Solutions is voluntarily recalling a single lot of DuMORÂ® Poultry Layer 16% Crumbles, which was incorrectly packaged and shipped in DuMORÂ® Poultry Grower/Finisher bags. The incorrectly packaged feed, while appropriate for layers, can be potentially harmful if fed to young chicks as a grower/finisher.	Limited Recall Of DuMOR' Poultry Grower/Finisher Bags Containing DuMOR' Poultry Layer 16% Crumbles Because of Possible Animal Health Risk
FDA	72efe5c76c	2012-04-27	http://www.fda.gov/Safety/Recalls/ucm302137.htm	Diamond Pet Foods is expanding a voluntary recall to include one production run and four production codes of Chicken Soup for the Pet Lover’s Soul Adult Light formula dry dog food. One bag of the product has tested positive for Salmonella, and the recall of the four production codes is being conducted as a precautionary measure.	Diamond Pet Foods Expands Voluntary Recall of One Production Run of Dry Dog Food Due to a Potential Health Risk Recall is limited to one formula of Chicken Soup for the Pet Lover’s Soul distributed to 10 states
FDA	7b629f412b	2012-04-26	http://www.fda.gov/Safety/Recalls/ucm301830.htm	Krispak, Inc. of Grand Rapids, MI is voluntarily recalling 16 cases of GFS Hostess Candy Mix 8-48 oz packages due to a potential mis-pack, resulting in undeclared allergens. A small number of cases of GFS Hostess Candy Mix were inadvertently put into GFS Chocolate Sprinkles packages.	KRISPAK INC. ISSUES RECALL DUE TO MIS-PACK, RESULTING in POTENTIAL ALLERGY ALERT on UNDECLARED MILK, WHEAT, and EGG in GFS BRAND HOSTESS CANDY MIX
FDA	c7880b9772	2012-04-26	http://www.fda.gov/Safety/Recalls/ucm301824.htm	Reserâ€™s Fine Foods, Inc. of Beaverton, OR is voluntarily recalling 653 cases of 7 oz. Mrs. Weaverâ€™s Pimento Spread that may have been packaged into containers marked Ham Salad. The Ham Salad label does not list milk ingredients on the label. People who are allergic to milk products run the risk of serious reaction if they consume this product.	Allergy Alert on Milk Products in Mrs. Weaverâ€™s Pimento Spread
FDA	3173b81851	2012-04-26	http://www.fda.gov/Safety/Recalls/ucm302049.htm	Alfa Sprouts Inc. of Honeoye Falls, NY is recalling approx. 100 lbs of Springwater Sprouts brand Organic Alfalfa Sprouts and bulk 3# Clover Sprouts because they may be contaminated with Listeria monocytogenes, an organism which can cause serious and sometimes fatal infections to individuals with weakened immune systems. Although healthy individuals may suffer only short term symptoms such as high fever, severe headache, stiffness, nausea, abdominal pain and diarrhea, Listeria infection can cause miscarriages and stillbirths among pregnant women.	Alfa Sprouts Inc. (Springwater Sprouts) Recalls Alfalfa Sprouts And Clover Sprouts Due To Possible Health Risk
FDA	5e8a73207f	2012-04-26	http://www.fda.gov/Safety/Recalls/ucm302056.htm	Café-Tasse S.A. is voluntarily recalling its 1.58 oz. Café-Tasse Noir (Dark) Belgian chocolate bar with best before date of "15 SEPT 2013" because it may contain undeclared traces of milk. People who have an allergy or severe sensitivity to milk run the risk of serious or life-threatening allergic reaction if they consume this product.	Café-Tasse Issues Allergy Alert on Undeclared Milk in Café-Tasse 45 gr. Noir (Dark) Chocolate Bar.
FDA	67f63fba0c	2012-04-26	http://www.fda.gov/Safety/Recalls/ucm302053.htm	FATIMA BROTHERS, 56-05 55th Drive, Maspeth NY11378 is recalling SHAD JAVANTRI (WHOLE MACE) because it contains undeclared sulfites. Consumers who have severe sensitivity to sulfites run the risk of serious or life threatening allergic reactions if they consume this product.	Fatima Brothers Issues An Allert On Undeclared Sulfites In Shad Javantri (Whole Mace)
FDA	9680e1e0d7	2012-04-25	http://www.fda.gov/Safety/Recalls/ucm301783.htm	American Regent is conducting a nationwide voluntary recall to the Retail/Hospital level of the following product: Epinephrine Injection, USP, 1:1000, 1 mL Ampules NDC #0517-1071-25 Lot #1395, Exp Date: July 2012	American Regent Initiates Nationwide Voluntary Recall of Epinephrine Injection, USP, 1:1000, 1mL Ampules Lot #1395 Due to Discoloration and Small Visible Particles
FDA	4234555116	2012-04-21	http://www.fda.gov/Safety/Recalls/ucm301210.htm	XROCK INDUSTRIES, an independent distributor of the X-ROCK products, is conducting a user level voluntary recall of certain supplement products sold by XROCK INDUSTRIES under the brand name of X-ROCK. Finished product of X-ROCK for Men was tested and preliminarily found to contain an analogue of an ingredient in an FDA-approved drug.	XROCK INDUSTRIES, LLC Issues a Voluntary Nationwide Recall of X-ROCK, a Product Marketed as a Dietary Supplement To Support Male Sexual Performance, Due to Unlisted, Potentially Hazardous Ingredient
FDA	e2b6a7230b	2012-04-18	http://www.fda.gov/Safety/Recalls/ucm300867.htm	M.E. Thompson, Inc. is expanding the recall of its Anytime Deli Turkey & Ham Footlong, to include Italian Footlong, and Classic Cuban, because the products have the potential to be contaminated with Listeria Monocytogenes, an organism which can cause serious and sometimes fatal infections in young children, frail or elderly people, and others with weakened immune systems. Healthy individuals may suffer only short-term symptoms such as high fever, severe headache, stiffness, nausea, abdominal pain and diarrhea.	M.E. Thompson, Inc. Expands Recall of Sub Sandwiches Because of Possible Health Risk
FDA	18d3cbf8cc	2012-04-18	http://www.fda.gov/Safety/Recalls/ucm300984.htm	Hong Lee Trading Inc., 225 Johnson Ave., Brooklyn, NY 11203 is recalling Peacock Brand Preserved Apricots because it may contain undeclared sulfites. People who have a severe sensitivity to sulfites run the risk of serious or life-threatening allergic reactions if they consume this product.	Hong Lee Trading Inc. Issues An Alert On Undeclared Sulfites In Peacock Brand Preserved Apricots
FDA	f933f1bf1a	2012-04-17	http://www.fda.gov/Safety/Recalls/ucm300689.htm	Kaytee, a Central Garden & Pet brand, is recalling two products, Kaytee exact® Hand Feeding Formula Baby Birds and Kaytee exact® Hand Feeding Formula Baby Macaw, due to high levels of vitamin D. These products are used primarily by bird breeders for feeding baby birds. Baby birds being fed the formula may run the risk of kidney failure when ingesting the product.	Product Recall Information of Baby Bird & Baby Macaw Feeding Formula
FDA	14fe10225d	2012-04-17	http://www.fda.gov/Safety/Recalls/ucm300712.htm	Franck’s lab recently had a fungal issue with one lot of triamcinolone acetonide P.F. 80mg/ml and instituted a recall. The recall involved five physicians and seven prescriptions. The physicians have been contacted and all prescriptions accounted.	Notice of Recall
