FDA	be579d28ab	2013-03-29	http://www.fda.gov/Safety/Recalls/ucm345857.htm	Lisy Corporation of Miami, FL is voluntarily recalling select seasoning blends because they contain the ingredient soy that is not declared on the label. People who have an allergy or severe sensitivity to soy run the risk of serious or life-threatening allergic reaction if they consume these products.	Lisy Corporation Issues Voluntary Recall on Undeclared Soy in 5 Seasoning Blends
FDA	a3e3f4cc8f	2013-03-29	http://www.fda.gov/Safety/Recalls/ucm345896.htm	Rich Products Corporation of Buffalo, New York, is announcing a voluntary recall of Farm Rich® Mini Quesadillas (PC 35635), Farm Rich® Mini Pizza Slices (PC 35643 and PC 37690), Farm Rich® Philly Cheese Steaks (PC 35634), Farm Rich® Mozzarella Bites (PC 37443 and PC 37691) and Market Day® Mozzarella Bites (PC 80435), produced from November 12, 2012 to November 19, 2012 due to possible contamination with Escherichia coli O121 bacteria (“E. Coli O121”).	Rich Products Corporation Announces a Voluntary Recall of Farm Rich' Mini Quesadillas, Farm Rich' Mini Pizza Slices, Farm Rich' Philly Cheese Steaks, Farm Rich' Mozzarella Bites, and Market Day' Mozzarella Bites Due to Possible Contamination with E. Coli
FDA	fc6b70ec45	2013-03-29	http://www.fda.gov/Safety/Recalls/ucm345921.htm	Lifestyle Evolution Inc announces the voluntary recall of NuGO FREE, NuGO Dark and NuGO Slim Non Dairy bars Made BEFORE October 2012 because of the potential for undeclared milk.	Lifestyle Evolution Inc. (LEI), Issues Allergy Alert -- -Undeclared Milk in Lifestyle Evolution Inc.’s, NuGO FREE, NuGO Dark and NuGO Slim Non Dairy bars
FDA	915c85e2fe	2013-03-28	http://www.fda.gov/Safety/Recalls/ucm345602.htm	The Gift Shop at Buffalo Trace Distillery today voluntarily recalled all non-expired products listed below due to mislabeling and undeclared allergens. People who have an allergy or severe sensitivity to wheat, soy, anchovy, and/or milk, run the risk of serious or life-threatening allergic reaction if they consume these products.	Food Product Recall by the Gift Shop at Buffalo Trace Distillery Due to Undeclared Allergens
FDA	a855c07a29	2013-03-27	http://www.fda.gov/Safety/Recalls/ucm345464.htm	La Preferida, Inc. is voluntarily recalling 4,734 cases (56,808 cans) of La Preferida Whole Pinto Beans 29 oz. (Water & Salt). Can Code: PINTO LP, BEST BY 01/03/2015, “Time” 3003. The manufacturer’s preliminary inspection indicates 420 cans may not have been fully processed, which could result in product contamination by spoilage organisms or by pathogens, which could lead to illness if consumed.	La Preferida, Inc. Issues A Voluntary Recall Of La Spanish Version - Preferida Whole Pinto Beans 29 OZ. (Water & Salt)
FDA	07803ba26a	2013-03-27	http://www.fda.gov/Safety/Recalls/ucm345468.htm	Pallimed Solutions, Inc. of Woburn, MA, doing business as Pallimed Pharmacy, is voluntarily recalling all sterile compound products dispensed since January 1, 2013 to the user level. The recall resulted from a recent inspection conducted by the U.S. Food and Drug Administration and the Massachusetts Board of Registration in Pharmacy where visible particulates (filaments) were observed in vials of sterile compounded products: TRIMIX, BIMIX (Lot 02252013@3), ALPROSTADIL, DMSO 50 PERCENT – IRRIGATION (Lot 03122013@19), and BACTERIOSTATIC WATER FOR INJECTION (Lot 01072013@28).	Pallimed Solutions, Inc. Announces Voluntary Nationwide Recall of All Sterile Compounded Products Dispensed
FDA	9ead9f91e1	2013-03-25	http://www.fda.gov/Safety/Recalls/ucm345197.htm	Gold Standard Baking of Chicago, IL is recalling 1,134 cases of Sweet P’s Bake Shop branded Caramel Apple Danish Coffee Cake because it contains undeclared walnuts. People who have an allergy or severe sensitivity to walnuts and other tree nuts run the risk of serious or life-threatening allergic reaction if they consume this product.	Gold Standard Baking Issues Allergy Alert on Undeclared Walnuts in Sweet P’s Bake Shop Branded Caramel Apple Danish Coffee Cake
FDA	7ff1a2980f	2013-03-21	http://www.fda.gov/Safety/Recalls/ucm344782.htm	New Chapter, Inc. is voluntarily recallingÂ a limited number of packages of its 90 count Probiotic Elderberry dietary supplement because it may contain an undeclared allergen - soy.Â People who have an allergy or severe sensitivity toÂ soy run the risk of serious or life-threatening allergic reaction if they consume this product.Â 	New Chapter, Inc. Issues Voluntary Recall Undeclared soy identified in one lot of Probiotic Elderberry dietary supplement
FDA	401789ff95	2013-03-21	http://www.fda.gov/Safety/Recalls/ucm345009.htm	Jones Natural Chews Co of Rockford, IL is recalling 245 boxes of Woofers (beef patties) because it has the potential to be contaminated with Salmonella. Salmonella can affect animals and there is risk to humans from handling contaminated pet products.	Jones Natural Chews Co Recalls Woofers Dog Treats Because Of Possible Salmonella Health Risk
FDA	cfab700b02	2013-03-21	http://www.fda.gov/Safety/Recalls/ucm344786.htm	Clinical Specialties is voluntarily recalling All Lots of All Sterile products repackaged and distributed by the pharmacy due to lack of sterility assurance. The recall of all sterile products is conducted in follow-up to concerns regarding practices at the site which cannot assure the sterility of the products.Â The expanded recall follows the firmâ€™s initial recall of Avastin due to reports of five patients who have been diagnosed with serious eye infections associated with the use of the product.Â 	Clinical Specialties Compounding Pharmacy Announces Voluntary Nationwide Recall of All lots of Sterile Products Repackaged and Distributed by Clinical Specialties Compounding Due to Lack of Sterility Assurance
FDA	c1d379104e	2013-03-21	http://www.fda.gov/Safety/Recalls/ucm344787.htm	Tinton Falls, NJ., Med Prep Consulting, Inc. is voluntarily recalling all lots of all products compounded at its facility. The level of recall is to the user, that is, regional hospital pharmacies and related departments, and physicianâ€™s office practices. The recall resulted from the pharmacy being notified by a Connecticut hospital, that it observed visible particulate contaminants in 50 ml bags of MAGNESIUM SULFATE 2GM IN DEXTROSE 5 Percent IN WATER, 50ML FOR INJECTION intravenous solution confirmed to be mold.	Medprep Consulting Inc. Announces Voluntary Nationwide Recall Of All Lots Of All Compounded Products Due To Potential Mold Contamination -2
FDA	8716ae837e	2013-03-20	http://www.fda.gov/Safety/Recalls/ucm344732.htm	La Preferida, Inc. is voluntarily recalling 4,734 cases (56,808 cans) of La Preferida Whole Pinto Beans 29 oz. (Water & Salt). Can Code: PINTO LP, BEST BY 01/03/2015, “Time” 3003. The manufacturer’s preliminary inspection indicates 420 cans may not have been fully processed, which could result in product contamination by spoilage organisms or by pathogens, which could lead to illness if consumed.	La Preferida, Inc. Issues A Voluntary Recall Of La Preferida Whole Pinto Beans 29 OZ. (Water & Salt)
FDA	f73d931fee	2013-03-20	http://www.fda.gov/Safety/Recalls/ucm344657.htm	March 19, 2013 - Daesang America Inc. One University Plaza, Suite 603, Hackensack, NJ 07601 is recalling its 500gram (17.64 Ounce) packages of Sesame and Garlic flavored Mixed Soy Bean Paste because they may contain undeclared peanuts. People who have allergies to peanuts run the risk of serious or life-threatening allergic reaction if they consume these products.	Daesang Issues Allergy Alert on Undeclared Peanuts in Mixed Soy Bean Paste (Sesame and Garlic)
FDA	1ee1779dca	2013-03-19	http://www.fda.gov/Safety/Recalls/ucm344421.htm	Natura Pet Products is voluntarily recalling specific lots of dry pet food because it has the potential to be contaminated with Salmonella. No Salmonella-related illnesses have been reported. Salmonella can affect animals eating the products and there is risk to humans from handling contaminated pet products, especially if they have not thoroughly washed their hands after having contact with the products or any surfaces exposed to these products.	Natura Pet Issues Voluntary Recall of Specialized Dry Pet Foods Due to Possible Health Risk
FDA	e6f508fde5	2013-03-18	http://www.fda.gov/Safety/Recalls/ucm344353.htm	Pro-Amino International Inc. is recalling protein bars which may contain Salmonella. The product is the ProtiDiet High Protein Chocolate Dream Bar, sold in 210 gram (7.4 oz.) packages, 7 bars per package, bearing UPC 6 21498 42238 1, lot code CR 18 13B, and Best Before date of 2015-08.	FDA Warns Consumers Not to Eat Certain ProtiDiet High Protein Chocolate Dream Bars Manufactured by Pro-Amino International, Inc., Quebec, Canada
FDA	97335e3c0e	2013-03-18	http://www.fda.gov/Safety/Recalls/ucm344229.htm	Tinton Falls, NJ., Med Prep Consulting, Inc. is voluntarily recalling all lots of all products compounded at its facility. The level of recall is to the user, that is, regional hospital pharmacies and related departments, and physician's office practices. The recall resulted from the pharmacy being notified by a Connecticut hospital, that it observed visible particulate contaminants in 50 ml bags of MAGNESIUM SULFATE 2GM IN DEXTROSE 5 PERCENT IN WATER, 50ML FOR INJECTION intravenous solution confirmed to be mold.	Medprep Consulting Inc. Announces Voluntary Nationwide Recall Of All Lots Of All Compounded Products Due To Potential Mold Contamination
FDA	700946d24e	2013-03-18	http://www.fda.gov/Safety/Recalls/ucm344377.htm	Clinical Specialties is voluntarily recalling Avastin unit dose syringes. The product has or potentially could result in an infection within the eye.	Clinical Specialties Issues Voluntary Nationwide Recall of Avastin Unit Dose Syringes due to Potential Serious Eye Infection
FDA	5aedffeb95	2013-03-17	http://www.fda.gov/Safety/Recalls/ucm344189.htm	Tinton Falls, NJ., Med Prep Consulting, Inc. is voluntarily recalling all lots of Magnesium Sulfate 2 grams in Dextrose 5 percent for Injection products compounded at its facility.Â The level of recall is to the user, that is, regional hospital pharmacies and related departments.Â The recall resulted from the pharmacy being notified by a Connecticut hospital, that it observed visible particulate contaminants in 50 ml bags of MAGNESIUM SULFATE 2GM IN DEXTROSE 5 percent IN WATER, 50ML FOR INJECTION intravenous solution confirmed to be mold.Â 	Medprep Consulting Inc. Announces Voluntary Nationwide Recall Of All Lots Of Magnesium Sulfate 2gm In Dextrose 5 percent In Water, 50ml For Injecton Due To Mold Contamination
FDA	5aedffeb95	2013-03-17	http://www.fda.gov/Safety/Recalls/ucm344189.htm	Tinton Falls, NJ., Med Prep Consulting, Inc. is voluntarily recalling all lots of Magnesium Sulfate 2 grams in Dextrose 5 percent for Injection products compounded at its facility.Â The level of recall is to the user, that is, regional hospital pharmacies and related departments.Â The recall resulted from the pharmacy being notified by a Connecticut hospital, that it observed visible particulate contaminants in 50 ml bags of MAGNESIUM SULFATE 2GM IN DEXTROSE 5 percent IN WATER, 50ML FOR INJECTION intravenous solution confirmed to be mold.Â 	Medprep Consulting Inc. Announces Voluntary Nationwide Recall Of All Lots Of Magnesium Sulfate 2gm In Dextrose 5 percent In Water, 50ml For Injecton Due To Mold Contamination
FDA	510b634824	2013-03-16	http://www.fda.gov/Safety/Recalls/ucm344017.htm	Nishimoto Trading Co., Ltd of Santa Fe Springs, CA, is recalling its 4.37 ounce packages of Kameda Brand Rice Cracker "Kotsubukko" snack food because they may contain undeclared milk. People who have allergies to milk run the risk of serious or life-threatening allergic reaction if they consume these products.	Nishimoto Trading Co., LTD Issues Allergy Alert on Undeclared Milk in Kameda Brand 4.37 oz Packages of Rice Cracker "Kotsubukko"
FDA	7aef021761	2013-03-16	http://www.fda.gov/Safety/Recalls/ucm344009.htm	Grippo Foods, Inc, Cincinnati, OH, is initiating a nationwide recall of all bags and boxes of their Plain Potato Chips, Bar-B-Q Potato Chips, Cheddar Cheese with a touch of Jalapeno Potato Chips, Hot Dill Pickle Potato Chips, Sweet Bermuda Onion Potato chips and Salt & Vinegar Potato Chips. These products may have the potential to contain metal fragments.	Grippo Foods Inc. Issues A Voluntary Recall Of All Sizes Of Their Plain Potato Chips, Bar-B-Q Potato Chips, Cheddar Cheese With A Touch Of Jalapeno Potato Chips, Hot Dill Pickle Potato Chips, Sweet Bermuda Onion Potato Chips And Salt & Vinegar Potato Chip
FDA	28ec04a711	2013-03-14	http://www.fda.gov/Safety/Recalls/ucm343716.htm	Bravo! is voluntarily recalling its 2 lb tubes of Bravo! Raw Food Diet Chicken Blend for Dogs and Cats, product code: 21-102, batch ID code 6 14 12, because it has the potential to be contaminated with Salmonella. The recall involves 2 lb. Bravo! Chicken Blend frozen raw diet tubes (chubs) made on June 14, 2012 only; no other products or sizes are involved.	Bravo! Recalls 2 lb Tubes of Chicken Blend-Raw Frozen Food Diet for Dogs and Cats (One Lot Code) Because of Possible Salmonella Health Risk
FDA	d07558214f	2013-03-11	http://www.fda.gov/Safety/Recalls/ucm343084.htm	Diamond Pet Foods is voluntarily recalling limited production codes of Premium Edge Finicky Adult Cat Formula dry cat food, Premium Edge Senior Cat Hairball Management Formula dry cat food, Premium Edge Kitten Formula dry cat food, Diamond Naturals Kitten Formula dry cat food and 4health All Life Stages Cat Formula dry cat food. Tests conducted by the company indicated the products might have a low level of thiamine (Vitamin B1).	Premium Edge, Diamond Naturals and 4health Dry Cat Food Formulas Voluntarily Recalled Due to Possibility of Low Levels of Thiamine (Vitamin B1)
FDA	cef4c16337	2013-03-11	http://www.fda.gov/Safety/Recalls/ucm343216.htm	Green Planet, Inc. is conducting a voluntary consumer recall of a product sold as a dietary supplement under the brand name of "Night Bullet," found to contain trace amounts of an analogue of an FDA-approved drug. Finished product of Night Bullet was tested and found to contain trace amounts of an analogue of an FDA-approved drug.	Green Planet, Inc. Issues a Voluntary Nationwide Recall of One Lot of "Night Bullet," a Product Marketed as a Dietary Supplement to Support Male Sexual Performance, Due to Undeclared, Potentially Hazardous Active Ingredient
FDA	62b366115a	2013-03-08	http://www.fda.gov/Safety/Recalls/ucm342851.htm	Bumble Bee Foods, LLC, is expanding a voluntary recall on specific codes of 5-ounce Chunk White Albacore and Chunk Light Tuna products. The recall has been issued because the products do not meet the company's standards for seal tightness.	Bumble Bee Foods Expands Voluntary Recall on Specific Codes of 5-Ounce Chunk White Albacore and Chunk Light Tuna Products Due to Loose Seals
FDA	8b24a68e19	2013-03-08	http://www.fda.gov/Safety/Recalls/ucm342902.htm	Steve’s Real Food of Murray, Utah is recalling its 5 lb. bags of "Turducken Canine Diet – 8oz. Patties due to potential contamination of Salmonella.	Steve’s Real Food Recalls Turducken Canine Recipe Patties Because of Posssible Health Risk
FDA	97ec98ba6f	2013-03-08	http://www.fda.gov/Safety/Recalls/ucm342911.htm	Tri-Union Seafoods LLC, which previously announced a voluntary recall, is now expanding it to include a limited amount of Chicken of the Sea brand 5-ounce chunk light tuna in oil. This is in addition to the limited amount of Chicken of the Sea brand 5-ounce chunk white albacore tuna in water announced March 6, 2013.	Tri-union Seafoods Expands Recall To Include Chunk Light Tuna In Oil Products
FDA	fcf6177eec	2013-03-08	http://www.fda.gov/Safety/Recalls/ucm342968.htm	Diggin' Your Dog™ announced today that they are voluntarily withdrawing one lot of its Strippin' Chicks™ Pet Treats produced on 8-30-12 because they have the potential to be contaminated with Salmonella. The sample was obtained in Colorado and the company has accounted for its distribution in Colorado of this lot.	Diggin’ Your Dog Recalls Strippin' Chicks Pet Treats Due to Possible Salmonella Hazard
FDA	4a84454810	2013-03-07	http://www.fda.gov/Safety/Recalls/ucm342650.htm	Tri-Union Seafoods LLC is voluntarily recalling a limited amount of Chicken of the Sea brand 5-ounce cans of chunk white albacore tuna in water. The seams on the lids of the cans do not meet the standard for seam quality.	Tri-Union Seafood Issues Voluntary Recall on Select 5-Ounce Chunk White Albacore Tuna in Water
FDA	a691b86a14	2013-03-06	http://www.fda.gov/Safety/Recalls/ucm342537.htm	Cargill’s animal nutrition business today announced a voluntary recall of certain brands of its ruminant mineral products because they were deficient in vitamins A, D and E. The affected products were manufactured at Cargill’s facilities in McPherson, Kansas, and Montgomery City, Missouri, between Dec. 7, 2012, and Feb. 27, 2013.	Cargill’s animal nutrition business conducts voluntary recall of select mineral product used in ruminant feed
FDA	1f362a0262	2013-03-06	http://www.fda.gov/Safety/Recalls/ucm342592.htm	Bumble Bee Foods, LLC, has issued a voluntary recall on specific codes of 5-ounce Chunk White Albacore and Chunk Light Tuna products. The recall has been issued because the products do not meet the companyâ€™s standards for seal tightness.	Bumble Bee Foods Issues Voluntary Recall On Specific Codes Of 5-Ounce Chunk White Albacore And Chunk Light Tuna Products Due To Loose Seals
FDA	4c4738dfc3	2013-03-05	http://www.fda.gov/Safety/Recalls/ucm342413.htm	The Kroger Co. (NYSE: KR) Bakery in Clackamas, Oregon is recalling select Wheat Bread products sold at the company's Fred Meyer Stores in Idaho, Oregon and Washington and QFC stores in Oregon and Washington because these products may contain pieces of plastic. Customers should return the product to stores for a full refund or replacement.	Kroger Recalls Select Wheat Bread Products in Idaho, Oregon and Washington States
FDA	570f1b4739	2013-03-02	http://www.fda.gov/Safety/Recalls/ucm342034.htm	See’s Candies, Inc. of San Francisco, Calif., is recalling one code of 1.7 ounce Divinity Easter Egg with Walnuts, because some boxes labeled Divinity with Walnuts may actually contain Peanut Butter Eggs. People who have an allergy or severe sensitivity to peanuts run the risk of serious or life-threatening allergic reaction if they consume this product.	See’s Candies, Inc. Issues Allergy Alert on 1.7oz Divinity Egg with Walnuts, code L.A.D. 102/13
FDA	45e0c9f183	2013-03-02	http://www.fda.gov/Safety/Recalls/ucm342025.htm	Food For Life Baking Company of Corona, California is recalling 15,369 cases of Ezekiel 4:9 Sprouted Grain Cereal shipped between November 20, 2012 to February 11, 2013, because the product may be mislabeled and may contain an undeclared allergen - almond:	Food For Life issues Recall - Allergy Alert - Undeclared Allergen in Food For Life Ezekiel 4:9 Cereal
FDA	bb81cf8f8e	2013-02-27	http://www.fda.gov/Safety/Recalls/ucm341338.htm	LION PAVILION LTD. of 56-15 58th Street Maspeth, NY 11378 is recalling Grassplot Ginger Slices because it contains undeclared sulfites. Consumers who have severe sensitivity to sulfites run the risk of serious or life-threatening allergic reactions if they consume this product.	Lion Pavilion Issues Alert on Undeclared Sulfites in Grassplot Ginger Slices
FDA	bc2a776299	2013-02-27	http://www.fda.gov/Safety/Recalls/ucm341348.htm	Domega NY International Co., Ltd. at 47-57 Bridgewater Street Brooklyn New York 11222 is recalling GREEN DAY BRAND WHITE MELON SEEDS because they contain undeclared sulfites. People who have severe sensitivity to sulfites run the risk of serious or life-threatening allergic reactions if they consume this product.	Domega NY International Co., Ltd Issues an Alert on Undeclared Sulfites in Green Day Brand White Melon Seeds
FDA	44675dd904	2013-02-27	http://www.fda.gov/Safety/Recalls/ucm341527.htm	United Pet Group, Inc., announces that it has voluntarily withdrawn a limited quantity of the products "Ultra Blend Gourmet Food for Parakeets," "eCotrition Grains and Greens Nutritional Supplement for Parakeets," "eCotrition Grains and Greens Nutritional Supplement for Canaries and Finches," and "eCotrition Grains and Greens Nutritional Supplement for Cockatiels." These products contain small quantities of dried parsley flakes supplied to United Pet Group by Specialty Commodities, Inc. On February 11, 2013, Specialty Commodities, Inc. initiated a voluntary product recall of parsley flakes distributed to United Pet Group and other pet food suppliers because the products may have the potential to be contaminated with Salmonella.	United Pet Group Inc., Voluntarily Withdraws "Ultra Blend Gourmet Food for Parakeets," "eCotrition Grains & Greens Nutritional Supplement for Parakeets," "eCotrition Grains & Greens Nutritional Supplement for Canaries and Finches," and "eCotrition Grains
FDA	58a038a32e	2013-02-27	http://www.fda.gov/Safety/Recalls/ucm341576.htm	Zachary Confections, Inc., today announced a voluntary recall of certain production lots of its Zachary Chocolate Covered Marshmallow Eggs because they have the potential to be contaminated with Salmonella, an organism which can cause serious and sometimes fatal infections in young children, frail or elderly people, and others with weakened immune systems. Healthy persons infected with Salmonella often experience fever, diarrhea (which may be bloody), nausea, vomiting and abdominal pain.	Zachary Confections, Inc. Announces Recall of Zachary Chocolate Covered Marshmallow Eggs due to Possible Contamination and Possible Health Risk
FDA	498330d395	2013-02-25	http://www.fda.gov/Safety/Recalls/ucm340921.htm	Olaax Corp announced today that it is conducting a voluntary nationwide recall of the company's dietary supplement sold under the brand name MAXILOSS WEIGHT ADVANCED softgels to the user level because they contain undeclared Sibutramine. Olaax Corp. is conducting a voluntary recall after being notified by the US FDA that testing found the MAXILOSS WEIGHT ADVANCED product, to contain Sibutramine.	Olaax Corp. Issues a Nationwide Voluntary Recall of All Lots of Maxiloss Weight Advanced Softgels Dietary Supplement
FDA	d8032893ea	2013-02-24	http://www.fda.gov/Safety/Recalls/ucm340893.htm	Affymax, Inc. (Nasdaq: AFFY) and Takeda Pharmaceutical Company Limited (Takeda) today have decided to voluntarily recall all lots of OMONTYS® (peginesatide) Injection to the user level as a result of new postmarketing reports regarding serious hypersensitivity reactions, including anaphylaxis, which can be life-threatening or fatal. The companies have been working actively with the U.S. Food and Drug Administration (FDA) which has indicated its agreement with this decision.	Affymax and Takeda Announce a Nationwide Voluntary Recall of All Lots of OMONTYS® (peginesatide) Injection
FDA	a764778b66	2013-02-23	http://www.fda.gov/Safety/Recalls/ucm340886.htm	Herbalife International of America announced the voluntary recall of certain lots of its niche Instant Healthy Meal Nutritional Shake Mix packets because the label identifies the product as dairy-free, when it may in fact contain trace amounts of milk proteins. Individuals with severe allergies to milk run the risk of serious or life-threatening allergic reaction if they consume products containing milk proteins.	Herbalife Issues Allergy Alert due to Undeclared Milk Allergen in Instant Healthy Meal Nutritional Shake Mix Packets
FDA	617bdc3a99	2013-02-23	http://www.fda.gov/Safety/Recalls/ucm340891.htm	Hy-Vee, Inc. today issued a voluntary recall of certain bags of Hy-Vee dog food due to elevated levels of a chemical contaminant commonly found in corn. Routine random tests conducted by the Iowa Department of Agriculture indicated higher-than-normal levels of aflatoxin in some samples of Hy-Vee dog food produced at a Kansas City plant operated by Pro-Pet, LLC.	Hy-Vee Issues VoluntaryRecall of Certain Dog Food Products
FDA	6e7a9a37e9	2013-02-23	http://www.fda.gov/Safety/Recalls/ucm340892.htm	Bruce Foods Corporation of New Iberia, LA is recalling mislabeled cans of 10 oz Food Club Red Enchilada Sauce with code GES 462449, Best Before Date: 12/3/2016 that could contain Green Enchilada Sauce instead of Red Enchilada Sauce. Only the Food Club Green Enchilada contains wheat and soy.	Bruce Foods Corporation Expands Recall to Indiana of Food Club Red Enchilada Sauce Because of Possible Health Risk
FDA	12b7ef9b9e	2013-02-22	http://www.fda.gov/Safety/Recalls/ucm340644.htm	GoldCoast Salads, a Naples Florida firm, is voluntarily recalling Blue Crab Spread, Maine Lobster Spread, Lobster and Shrimp Spread, and Smoked Salmon Spread that may be contaminated with Listeria. The Blue Crab Spread being recalled is coded EXP 2/14/13 B.	Goldcoast Salads Expands Voluntary Recall to Include Additional Products Due to Possible Health Risk
FDA	7052e2bb6e	2013-02-22	http://www.fda.gov/Safety/Recalls/ucm340676.htm	Mondelez Global LLC announced today a nationwide voluntary recall in the United States, including Puerto Rico, of the belVita Breakfast Biscuit product, Apple Cinnamon and Chocolate varieties, following notification from a third-party supplier, due to the possible presence of fragments of flexible metal mesh caused by a faulty screen at their facility.	Mondelez Global LLC Conducts Nationwide Voluntary Recall of belVita Breakfast Biscuit Apple Cinnamon and Chocolate Varieties in the U.S. and Puerto Rico
