FDA	a16447c7dc	2011-04-30	http://www.fda.gov/Safety/Recalls/ucm253358.htm	Organic Food Bar, Inc. of Fullerton, CA is issuing a voluntary recall on the specific listed lots of RAW Organic Food Bars listed below, because they may contain undeclared peanut proteins from cashew butter supplied by one of the vendors. These bars are being recalled because they are made with the same lot of cashew butter that was used in previously tested chocolatey chocolate chips bars.	Organic Food Bar, Inc. Expands its Voluntary Recall on Chocolatey Chocolate Chip Bars to Include Additional Products and Lots
FDA	f8315f8e6b	2011-04-30	http://www.fda.gov/Safety/Recalls/ucm253360.htm	Satur Farms of Cutchogue, NY is recalling 88.5 pounds of Satur Farms Cilantro, because it has the potential to be contaminated with Salmonella, an organism which can cause serious and sometimes fatal infections in young children, frail or elderly people, and others with weakened immune systems.	Satur Farms, LLC Recalls Satur Farms Cilantro Because Of Possible Health Risk
FDA	3e41e5f8b1	2011-04-29	http://www.fda.gov/Safety/Recalls/ucm253123.htm	Ethos Environmental, Inc. is conducting a voluntary recall because FDA lab analysis has confirmed the presence of Sulfoaildenafil, an analogue of Sildenafil, making these products unapproved new drugs. Sildenafil is an FDA-approved drug used as treatment for male Erectile Dysfunction (ED). The active drug ingredient is not listed on the label for these products.	Ethos Environmental, Inc. Issues a Voluntary Recall of Specific Lots Of The Dietary Supplement Regenerect
FDA	3ddb78ba2e	2011-04-26	http://www.fda.gov/Safety/Recalls/ucm252802.htm	The Raymond-Hadley Corp. of Spencer, NY is recalling some varieties of Better Batter brand baking mixes, because they may contain the undeclared allergen Milk. People who have an allergy or severe sensitivity to milk run the risk of serious or life-threatening allergic reaction if they consume these products.	The Raymond-Hadley Corporation Issues Allergy Alert on Undeclared Milk in Better Batter Brand 20oz. & 2.5lb. Pancake & Biscuit Mix, 18.25oz. Yellow Cake Mix, and 18.25oz. Chocolate Cake Mix
FDA	f6efd4ce9b	2011-04-26	http://www.fda.gov/Safety/Recalls/ucm252798.htm	Elsie Grace’s Dry Food Company of Frankfort, Kansas is issuing a recall of some dip mix and soup mix products because they may contain undeclared milk, soy, or wheat. People who have an allergy or severe sensitivity to milk, soy, or wheat run the risk of serious or life threatening allergic reaction if they consume these products.	Elise Grace's Dry Food Company Issues Nationwide Allergy Alert Because Of Undeclared Allergens In Their Dry Food Products Line
FDA	c5266098cd	2011-04-26	http://www.fda.gov/Safety/Recalls/ucm252819.htm	This voluntary recall was initiated because some vials of this lot were observed to contain particulates. American Regent is undertaking this recall in consideration of the potential for safety issues if this lot of product is administered to patients. Potential adverse events after intravenous administration of solutions containing particulates may include disruption of blood flow within small blood vessels in the lungs, localized inflammation (swelling and accumulation of inflammatory cells), and granuloma formation.	American Regent Initiates Voluntary Nationwide Recall of Ammonium Molybdate Injection, USP (Molybdenum 250mcg/10 mL) 10 mL Single Dose Vial Due to the Presence of Particulate Matter
FDA	59f7669670	2011-04-24	http://www.fda.gov/Safety/Recalls/ucm252468.htm	Alfalfa Sprouts	Jonathans Sprouts Recalls Alfalfa Sprouts Because of Possible Health Risk Extends Recall of 4/19/11 to Additional Products and Codes )
FDA	780687e0fa	2011-04-23	http://www.fda.gov/Safety/Recalls/ucm252457.htm	L&M Companies, Inc. of Raleigh, NC is issuing a voluntary recall of one lot (1590 cartons) of whole cucumbers because it has the potential to be contaminated with Salmonella. No illnesses have been reported in association with this recall, and no other products are involved.	L&M Companies, Inc. Recalls One Lot of Whole Cucumbers Because of Possible Health Risk
FDA	f9507389d5	2011-04-22	http://www.fda.gov/Safety/Recalls/ucm252374.htm	Woodsmoke Provisions, LLC is voluntarily recalling forty pounds (40 lbs.) / 160 packages of the The Fresh Market Signature Collection Atlantic Smoked Salmon in 4 oz. retail packages with lot code 1459/2, because they have the potential to be contaminated with Listeria monocytogenes.	Woodsmoke Provisions Voluntarily Recalls 160 packages of 4 oz. The Fresh Market Signature Collection Atlantic Smoked Salmon Due to Possible Health Risk
FDA	a8c6abbb8c	2011-04-22	http://www.fda.gov/Safety/Recalls/ucm252406.htm	New York State Agriculture Commissioner Darrel J. Aubertine today alerted consumers of undeclared milk in “Carob Brown Rice Crunch Squares” and in “Carob Mint Miniatures”, packaged and distributed by Simple Foods, located at 116 Killewald Avenue in Tonawanda, New York. People who have severe sensitivity to milk may run the risk of serious or life-threatening reactions if they consume this product.	Undeclared Milk in “Carob Brown Rice Crunch Squares” & “Carob Mint Miniatures”
FDA	c23e750d9a	2011-04-21	http://www.fda.gov/Safety/Recalls/ucm252154.htm	S&M Enterprise Corp, 4703 2nd Ave, Brooklyn NY 11232, is recalling GROVE GROW NOTES DRIED TARO because the product contains undeclared sulfites. People who have severe sensitivity to sulfites run the risk of serious or life-threatening reactions if they consume this product.	S&M (USA) Enterprise Corp. Issues Alert on Undeclared Sulfites in Grove Grow Notes Dried Taro
FDA	f4f5db9361	2011-04-21	http://www.fda.gov/Safety/Recalls/ucm252161.htm	S & M Enterprise Corp, 4703 2ndAve, Brooklyn NY 11232, is recalling RAIN SWISS ROLL (STRAWBERRY FLAVOR) and (COCONUT FLAVOR) because they contain undeclared eggs. Consumers who are allergic to eggs may run the risk of serious or life-threatening reactions if they consume this product.	S&M (USA) Enterprise Corp Issues Allergy Alerts on Undeclared Eggs In Rain Swiss Roll (Strawberry Flavor) and (Coconut Flavor)
FDA	8709b74042	2011-04-21	http://www.fda.gov/Safety/Recalls/ucm252165.htm	See’s Candies, Inc. of San Francisco, Calif., is recalling one code of 4.25 ounce Mayfair Eggs, with Cherries & Pecans because they contain walnuts. People who have an allergy or severe sensitivity to walnuts run the risk of serious or life-threatening allergic reaction if they consume this product.	See’s Candies, Inc. Issues Allergy Alert on 4.25 ounce Mayfair Eggs, Code 138
FDA	c4820f6657	2011-04-21	http://www.fda.gov/Safety/Recalls/ucm252310.htm	Doctor’s CarbRite Diet of New Brunswick, NJ is voluntarily recalling all lots of the 2 oz. Chocolate Brownie Doctor’s CarbRite Diet Bar that are missing the allergen statement, “Allergy Alert: Made on equipment that also processes soy, milk, egg, peanuts and tree nuts”, due to possible peanut allergen cross-contamination. This allergy statement would be found at the end of the Ingredients list.	Doctor's CarbRite Diet Issues Allergy Alert on Certain Chocolate Brownie Flavored Bars
FDA	9cc17e97e9	2011-04-21	http://www.fda.gov/Safety/Recalls/ucm252290.htm	Satur Farms of Cutchogue, NY is recalling 138 pounds of Satur Farms Cilantro, because it has the potential to be contaminated with Salmonella, an organism which can cause serious and sometimes fatal infections in young children, frail or elderly people, and others with weakened immune systems. Healthy persons infected with Salmonella often experience fever, diarrhea (which may be bloody), nausea, vomiting and abdominal pain.	Satur Farms, LLC Recalls Satur Farms Cilantro Because of Possible Health Risk
FDA	05b25c725a	2011-04-20	http://www.fda.gov/Safety/Recalls/ucm252028.htm	S&M (U.S.A) ENTERPRISE CORP, 4703 2nd Avenue, Brooklyn, NY 11232, is recalling RAIN SWISS ROLL (BANANA FLAVOR) because it contained undeclared eggs. Consumers who are allergic to eggs may run the risk of serious or life-threatening allergic reactions if they consume this product.	TS&M (U.S.A.) Enterprise Corp Issues Allergy Alert On Undeclared Eggs In Rain Swiss Roll (Banana Flavor)
FDA	c679f0dbf5	2011-04-20	http://www.fda.gov/Safety/Recalls/ucm252047.htm	Jonathans Sprouts of Rochester, MA is recalling its conventional alfalfa sprout products with sell-by date of 4/23 (see list below), as a precaution, because it has the potential to be contaminated with Salmonella, an organism which can cause serious and sometimes fatal infections in young children, frail or elderly people, and others with weakened immune systems. Healthy persons infected with Salmonella often experience fever, diarrhea (which may be bloody), nausea, vomiting and abdominal pain.	Jonathans Sprouts Recalls Alfalfa Sprouts Because Of Possible Health Risk
FDA	6abe6809f1	2011-04-18	http://www.fda.gov/Safety/Recalls/ucm251713.htm	A-1 Sandwich Inc. is recalling certain ready-to-eat sandwiches because the product label does not declare allergens. All sandwiches that contain mayonnaise and have an expiration date of 4/16/2011 or before are not labeled with egg as an ingredient.	A-1 Sandwich Company Voluntarily Recalls Sandwiches with Undeclared Allergens
FDA	a095c1f506	2011-04-18	http://www.fda.gov/Safety/Recalls/ucm251859.htm	Charcuterie La Tour Eiffel of Montreal, Canada, is voluntarily recalling all Summersweet seafood mousses and dips because the products have the potential to be contaminated with Listeria monocytogenes, an organism which can cause serious and sometimes fatal infections in young children, frail or elderly people, and others with weakened immune systems	Charcuterie La Tour Effel Recalls Mousses And Dips
FDA	3cd62e48b2	2011-04-18	http://www.fda.gov/Safety/Recalls/ucm251855.htm	Royal sweet Bakery, Inc at 119 49 street, Brooklyn, NY, 11232 is recalling HERRING IN VEGETABLE OIL FILLING discovered by New York State Department of Agriculture and Markets Food Inspectors during a routine inspection and subsequent analysis of product by Food Laboratory personnel confirming that the fish was improperly eviscerated prior to processing. This product may be contaminated with Clostridium botulinum spores, which can cause Botulism, a serious and potentially fatal food-borne illness.	Royal Sweet Bakery, Inc. Issues an Alert on Uneviscerated Fish
FDA	7e8dc62d0f	2011-04-16	http://www.fda.gov/Safety/Recalls/ucm251702.htm	La Fiesta Food Products, Inc., is voluntarily recalling all Dried Shredded Shrimp products due to an error on the ingredients labels. The products contain sulfites and the new labels will be updated accordingly.	La Fiesta Food Products, Inc., Issues Allergy Alert due to Incorrect Ingredient Label on Dried Shredded Shrimp
FDA	ff7d6b4823	2011-04-15	http://www.fda.gov/Safety/Recalls/ucm251689.htm	Organic Food Bar, Inc. of Fullerton, CA is recalling the specific listed lots of Chocolatey Chocolate Chip RAW Organic Food Bars listed below, because they may contain undeclared peanut proteins. People who have an allergy or severe sensitivity to peanuts run the risk of serious or life-threatening allergic reaction if they consume these lots of products mentioned below.	Organic Food Bar, Inc. Issues Allergy Alert on Chocolatey Chocolate Chip Raw Organic Food Bars
FDA	9daadf1b4c	2011-04-15	http://www.fda.gov/Safety/Recalls/ucm251639.htm	B&M, Inc. of Mount Vernon, Missouri is voluntarily recalling Archer Farms Ground Turmeric sold at Target stores in glass bottles with a net weight of 2.6 oz. (74g), due to elevated levels of lead. Lead can accumulate in the body over time. Too much can cause health problems, including delayed mental and physical development and learning deficiencies.	B&M, Inc. Conducts Voluntary Nationwide Recall Of 6 Lot Numbers Of Archer Farms Ground Turmeric Due To Excessive Lead Levels.
FDA	4bfc466fe5	2011-04-14	http://www.fda.gov/Safety/Recalls/ucm251515.htm	Ortho-McNeil Neurologics Division of Ortho-McNeil-Janssen Pharmaceuticals, Inc., today announced it is voluntarily recalling two lots of TOPAMAX® (topiramate) 100mg Tablets. These two lots were shipped between 10/19/2010 and 12/28/2010 and distributed in the U.S. and Puerto Rico.	Ortho-McNeil Neurologics Voluntarily Recalls Two Lots of TOPAMAX®
FDA	14ce9c20d5	2011-04-11	http://www.fda.gov/Safety/Recalls/ucm250718.htm	Mexicantown Wholesale of Detroit, Michigan is recalling all lots of PAN NUEZ because they contain undeclared pecan chips. People who have an allergy or severe sensitivity to pecans run the risk of serious or life-threatening allergic reaction if they consume these products. Mexicantown Wholesale of Detroit, Michigan is also recalling all lots of PAN NUEZ, MAGDALENA, PAN DE MAIZ, YOYO and TACOS DE PAN DANES manufactured between 6/27/2010 and 12/28/2010, because they contain undeclared milk. People who have an allergy or severe sensitivity to milk run the risk of serious or life-threatening allergic reaction if they consume these products. The recalled PAN NUEZ, MAGDALENA, PAN DE MAIZ, YOYO and TACOS DE PAN DANES also contain undeclared wheat and FD&C Yellow#5, which can elicit moderate reactions in sensitive individuals.	Mexicantown Whole Issues Allergy Alert On Undeclared Pecans In Pan Nuez And Undeclared Milk In Magdalena, Pan De Maiz, YoyoPan Nuez, And Tacos De Pan Danes
FDA	38f2920e34	2011-04-08	http://www.fda.gov/Safety/Recalls/ucm250479.htm	Tri-Union Seafoods LLC is issuing a precautionary, voluntary recall of a limited amount of Chicken of the Sea brand 6.5-ounce chopped clams. The product is mislabeled and may contain tiny shrimp, and the company is conducting this precautionary, voluntary recall to ensure public health as shellfish is considered an allergen.	Tri-Union Seafoods Issues Precautionary, Voluntary Recall Of Limited 6.5-Ounce Chopped Clams
FDA	06be3ca32e	2011-04-08	http://www.fda.gov/Safety/Recalls/ucm250591.htm	Waco’s Bestyett Sandwiches of Waco, Texas, is voluntarily recalling its 3.5 ounce packages of Pimento Cheese Sandwiches and Chicken Salad Sandwiches because they contain undeclared eggs. Individuals that have an allergy to eggs run the risk of serious or life-threatening allergic reaction if they consume these products	Waco’s Bestyett Sandwiches issues a Voluntary Recall of Pimento Cheese Sandwiches and Chicken Salad Sandwiches due to Undeclared EGGS
FDA	22bb70e554	2011-04-07	http://www.fda.gov/Safety/Recalls/ucm250211.htm	Le Bon Patissier of La Crescenta, CA is conducting a voluntary recall on the following Le Bon Patissier Products because they contain undeclared allergens. People who have an allergen or severe sensitivity to wheat, egg, pistachios, walnuts, or milk run the risk of serious or life-threatening allergic reaction if they consume these products.	Le Bon Patissiere-2, Inc. Announces Voluntary Recall On Select Le Bon Patissiere Products That Contain Undeclared Allergens
FDA	a83106379d	2011-04-06	http://www.fda.gov/Safety/Recalls/ucm250190.htm	resh Express is voluntarily recalling 2,939 cases of 9 oz. Bag Spinach with Product Codes starting with H081 and H082, UPC Code of 7127913204 and Use-by Dates of April 6 and 7 out of an abundance of caution due to a positive test result for Salmonella from random sample testing.	Fresh Express Announces Precautionary Recall of a Limited Number of Cases of 9 oz. Bag Spinach Due to Possible Health Risk from Salmonella
FDA	04abc37d07	2011-04-04	http://www.fda.gov/Safety/Recalls/ucm249126.htm	AVNS Inc announced today it is voluntarily recalling THE BEST Enhancement Supplement. AVNS Inc is conducting a voluntary recall after being informed by their manufacturer, Drive Total Energy, that the Food and Drug Administration (FDA) lab analyses found that the products to contain Sulfoaildenafil, an analogue of Sildenafil, an FDA-approved drug used in the treatment of male Erectile Dysfunction (ED), making these products unapproved new drugs.	AVNS, Inc. Issues a Voluntary Recall of THE BEST Enhancer
FDA	46e810fb62	2011-04-02	http://www.fda.gov/Safety/Recalls/ucm249597.htm	Cottage Grove Farmhouse Bakery, Cottage Grove, Oregon is recalling Wheat Sourdough Bread, Oatmeal Bread, and Garlic Basil Parmesan Bread because they may contain undeclared Pasteurized Egg white. People who have an allergy or severe sensitivity to eggs run the risk of serious or life-threatening allergic reaction if they consume these products.	Cottage Grove Farmhouse Bakery Issues Allergy Alert On Undeclared Pasteurized Egg White In Breads
FDA	b5f11feb7a	2011-04-02	http://www.fda.gov/Safety/Recalls/ucm249556.htm	Sassy Cow Creamery, LLC of Columbus, WI is recalling Blueberry Cheesecake and Butter Pecan Ice Cream because it may contain undeclared peanuts or egg and soy. People who have an allergy or severe sensitivity to egg, soy, or peanuts run the risk of serious or life-threatening allergic reaction if they consume these products.	Sassy Cow Creamery, LLC Issues Allergy Alert On Peanut Oil In Butter Pecan Ice Cream And Egg And Soy In Blueberry Cheesecake Ice Cream
FDA	aefc9aafc7	2011-04-01	http://www.fda.gov/Safety/Recalls/ucm249386.htm	Arko Foods International of Los Angeles, CA is recalling Angelina Brand Smoked Roundscad, 8oz packs, because it has the potential to be contaminated with Clostridium botulinum, a bacterium which can cause life-threatening illness or death. Consumers are warned not to consume the product even if it does not look or smell spoiled.	Arko Foods International Recalls Angelina Brand Smoked Roundscad Because Of Possible Health Risk
FDA	cf5d2f1231	2011-03-31	http://www.fda.gov/Safety/Recalls/ucm249201.htm	Thomas Produce of Boca Raton, FL, is recalling 320 boxes of Jalapeno Peppers because they have the potential to be contaminated with Salmonella, an organism which can cause serious and sometimes fatal infections in young children, frail or elderly people, and others with weakened immune systems. The recalled Jalapeno Peppers were sold to distributors in Florida, New York, North Carolina, New Jersey, Minnesota, and Pennsylvania from 2/15/2011 to 2/18/2011.	Thomas Produce Recalls Jalapeno Peppers Because of Possible Health Risk
FDA	9142fc9846	2011-03-31	http://www.fda.gov/Safety/Recalls/ucm249283.htm	Louie Foods International of Fresno, California, is voluntarily recalling all Louie’s brand sprouts with a “Use By” date on or before 4/14/11, because they may be contaminated with Salmonella. To-date, no illnesses have been reported.	Louie Foods International Voluntarily Recalls Certain Sprouts
FDA	6b47d10365	2011-03-31	http://www.fda.gov/Safety/Recalls/ucm249270.htm	Frankly Fresh, Inc. of Carson, CA. Is voluntarily recalling its seafood line of products, because it has the potential to be contaminated with Listeria monocytogenes, an organism which can cause serious and sometimes fatal infections in young children, frail or elderly people, and others with weakened immune systems.	Frankly Fresh Inc. Voluntarily Recalls Seafood Salad Products Because Of Possible Health Risk
FDA	9fca03a5f3	2011-03-30	http://www.fda.gov/Safety/Recalls/ucm248977.htm	Nutrition Express of Torrance, CA is voluntarily recalling specific products containing whey protein isolate sourced from one supplier because they have the potential to be contaminated with Salmonella, an organism which can cause serious and sometimes fatal infections in young children, frail or elderly people, and others with weakened immune systems. Healthy persons infected with Salmonella often experience fever, diarrhea (which may be bloody), nausea, vomiting and abdominal pain. In rare circumstances, infection with Salmonella can result in the organism getting into the bloodstream and producing more severe illnesses such as arterial infections (i.e., infected aneurysms), endocarditis and arthritis.	Nutrition Express Voluntarily Recalls Protein Supplements Because Of Possible Health Risk
FDA	2cf1c2d7e3	2011-03-30	http://www.fda.gov/Safety/Recalls/ucm249068.htm	The Alabama Department of Public Health today is announcing an ongoing investigation of an outbreak of Serratia marcescens bacteremia in six Alabama hospitals. On March 16, ADPH was notified that an outbreak had occurred in two of these hospitals among patients receiving TPN (total parenteral nutrition).	CDC And ADPH Investigate Outbreak At Alabama Hospitals; Products Recalled
FDA	e1be02c4e1	2011-03-30	http://www.fda.gov/Safety/Recalls/ucm249131.htm	The Smokehouse LLC of Mamaroneck, New York, is conducting a voluntary recall of PORTIER FINE FOODS Norwegian Smoked Salmon of various size packages including 4 oz., 8 oz., 16 oz. and random weight sizes, Batch Code 066 only, due to potential contamination with Listeria monocytogenes. Listeria monocytogenes is an organism which can cause serious and sometimes fatal infections in young children, frail or elderly people, and others with weakened immune systems.	THE SMOKEHOUSE LLC RECALLS ONE BATCH OF PORTIER FINE FOODS NORWEGIAN SMOKED SALMON BECAUSE OF POSSIBLE HEALTH RISK
FDA	4ce73c9496	2011-03-28	http://www.fda.gov/Safety/Recalls/ucm248718.htm	X-Hero and Male Enhancer Dietary Supplements	USA Far Ocean Group Inc. Issues Voluntary Nationwide Recall of X-Hero and Male Enhancer, Products Marketed as Dietary Supplements
FDA	1edcfff6e0	2011-03-28	http://www.fda.gov/Safety/Recalls/ucm248703.htm	NAC Foods Corporation of Palisades Park, New Jersey is announcing a voluntary recall of the Mi Pepito Arnica Flower and Stem Arnica due to inaccurate usage information on the product label. The current label states ‘Use to enhance the flavor of your favorite dish.’	Recall of Arnica Flower And Stem Arnica Due To Inaccurate Usage Information On Product Label
FDA	c68965bb56	2011-03-27	http://www.fda.gov/Safety/Recalls/ucm248576.htm	APP Pharmaceuticals, Inc., (APP) announced today that it has issued a voluntary recall of five lots of Irinotecan Hydrochloride Injection, which is used for recurrent or progressive metastatic colorectal cancer. This recall is being conducted as a precautionary measure and there have been no reports to dates of adverse events related to the recalled products.	APP Pharmaceuticals Issues A Nationwide Voluntary Recall Of Irinotecan Hydrochloride Injection
FDA	f039da7860	2011-03-27	http://www.fda.gov/Safety/Recalls/ucm248552.htm	Greenstone LLC announced today that it is voluntarily conducting a recall, to the patient level, of medicines with lot number FI0510058-A on the label. This includes Citalopram 10mg Tablets (100-count bottle) and Finasteride 5mg Tablets (90-count bottle), both distributed in the U.S. market.	Greenstone Announces Voluntary Nationwide Recall Of Citalopram And Finasteride Due to Possible Mislabeling
FDA	4d4c8c0f0e	2011-03-27	http://www.fda.gov/Safety/Recalls/ucm248548.htm	Circle City Marketing and Distributing, doing business as Candy Dynamics, Indianapolis, IN, is issuing a voluntary recall of Toxic Waste® Short Circuits™ Bubble Gum, 3.2 oz (90 g) size, Lot #15070SC12. The product is imported from Pakistan.	Candy Dynamics Recalls Toxic Waste® Short Circuits™ Bubble Gum Net wt. 3.2 oz. (90g) Package --- Lot # 15070SC12
FDA	0471013d54	2011-03-26	http://www.fda.gov/Safety/Recalls/ucm248529.htm	Mai's Bakery, Inc. of Monterey Park, CA. is recalling its listed “Hopia Mongo” and “Moon Cake” products because they may contain undeclared egg. People who have allergies to eggs run the risk of serious or life-threatening allergic reaction if they consume these products.	Mai's Bakery Issues Allergy Alert For Undeclared Eggs in Their Packages of "Hopia Mongo" and "Moon Cake" Products
FDA	f373258cb3	2011-03-24	http://www.fda.gov/Safety/Recalls/ucm248388.htm	outhampton, PA, Shaping Beauty, Inc. has been informed by the Food and Drug Administration (FDA) that a weight loss dietary supplement sold and marketed by the firm contain an undeclared drug ingredient. FDA lab analyses of dietary supplement tea distributed by the company were found to contain undeclared Sibutramine used as an appetite suppressant for weight loss. The FDA has not approved the following products as drugs; therefore the safety and effectiveness of this product is unknown. All lots of the following dietary supplement products are being recalled	Shaping Beauty, Inc. Issues a Voluntary Nationwide Recall of Weight Loss Tea Found to Contain an Undeclared Drug Ingredient
FDA	ceecab6a9e	2011-03-24	http://www.fda.gov/Safety/Recalls/ucm248363.htm	Unified Grocers is recalling Cottage Hearth Stone Ground Wheat Bread (24 oz) and 7 Select 100% Whole Wheat Bread (24 oz) because they may contain undeclared milk. People who have an allergy or severe sensitivity to milk may run the risk of serious or life-threatening allergic reaction if they consume these products.	Unified Grocers Issues Allergy Alert on Undeclared Milk in Cottage Hearth Stone Ground Wheat Bread (24 oz) and 7 Select 100% Whole Wheat Bread (24 oz)
FDA	7567adb81a	2011-03-23	http://www.fda.gov/Safety/Recalls/ucm248103.htm	Del Monte Fresh Produce N.A., Inc. (“Del Monte Fresh”) of Coral Gables, Florida is voluntarily recalling 4,992 cartons of cantaloupes, each containing 4 plastic mesh sleeves with 3 cantaloupes per sleeve, because they have the potential to be contaminated with Salmonella Panama, an organism which can cause serious and sometimes fatal infections in young children, frail or elderly people, and others with weakened immune systems. Healthy persons infected with Salmonella Panama often experience fever, diarrhea (which may be bloody), nausea, vomiting and abdominal pain. In rare circumstances, infection with Salmonella Panama can result in the organism getting into the bloodstream and producing more severe illnesses such as arterial infections (i.e., infected aneurysms), endocarditis and arthritis.	Del Monte Fresh Poduce Voluntairly Recalls Cantalopes Because Of Possible Health Risk
